id,name,cb_description
23131,Big-Akwa,food tech innovation land aquaculture symbiosis aquaculture process industry solution approach fish production symbiosis temperature waste heat plant fish farm water fish growth energy usage water fish farm resource industry technology resource infrastructure present opportunity footprint fishfarm capital investment production cost fish loop nutrients nature
23306,Billecta,solution payment account payee bill money money detour trust account payment notify track customer system solution flow creation invoice reconciliation payment accounting requirement management type system business accounting system
1731,Tandem,bank legacy banking build app product input community user goal money help user time stress
2089,Talia,woman man way pension guidance tool pension empower woman gap
10756,Billhop,payment institution business consumer bill invoice credit card company
23891,BIMobject,corporation work product manufacturer product
24623,Binalyze,binalyze tool enterprise extent cyber breach
25680,BioBag-International,assortment product collection waste municipality bag sack food waste container food waste liner sack food waste caddie waste collection product municipality kitchen institutions food waste bag
41,NationBuilder,software leader company partnership company b funding board chairman fall role downtown office
6041,TeachKloud,platform provider compliance level country
434,Tavus,video cloning platform video
24503,BioEsol,energy storage solution energy user outage grid
22727,Biofrigas-AB,facility technology upgrade biogas scale production agriculture treatment plant industry company
43,auxmoney,lend platform consumer credit risk model process access credit risk cost lending auxmoney forefront inclusion
24072,Biolex-Therapeutics,stage company protein monoclonal antibodie enhance efficacy potency system technology plant production biologic product product treat
22524,Biomason,developer building material technology cement building material alternative cement production microorganism chemical process masonry material room temperature clay concrete energy consumption manufacturing builder build material carbon company microorganism biocement ® ambient temperature power biotechnology reinvent cement planet industry carbon emission cement use project tile product
24855,Biom'Up,expert field biomaterial develop devices collagen technology product specialtie orthopaedic general healing regeneration tissue bone
10705,Supira-Medical,paradigm shift industry incubator team state art facility work environment ideation concept cross work path decision make product
177,Pure-Storage,class enterprise storage ground advantage flash memory company product application server virtualization desktop virtualization database analytic olap cloud compute cost flash datum center organization growth power space constraint company product customer
23386,Bio-Restore,fashion innovation company expert design material science digitization product commercialization
22827,Bioservo-Technologies,start company result collaboration scientist mission muscle device semâ„¢ technology product market market semâ„¢ technology ceo company team person
1817,Wicrypt,application user money datum company program customer megabyte data beneficiary wallet host connect router fee hotspot
1456,Thread,styling platform help man clothe platform combination stylist machine learn algorithm information stylist suggestion customer preference time man
4639,TheySay,sentiment analysis product platform approach sentiment sentiment entity passage text
45,Cockroach-Labs,database cloud application company size app scale survive cockroachdb world enterprise industry company retail medium
24394,Biovian,-stop shop contract manufacturing biopharmaceutical service development facility c production product experience process development -manufacture quality aspect
1775,Cooperative-Innovations,reality development studio enterprise entertainment game technology content
512,Qt-Software,market user interface application framework desktop platform user application framework source software developer application user interface desktop operating system consumer device support maintenance training service software service track programs migration custom development service optimization requirement workshop client consumer electronic manufacturing entertainment transportation sector office development office company subsidiary
25560,Biowater-Technology,design engineer generation technology solution wastewater treatment market team experience project installation company technology solution treatment water wastewater mbbr office partner representative world
21896,Bipi,car subscription startup consumer car ownership subscription quality car payment transaction process platform user book car point time customer way access car
20979,Birds-Relations,app service marriage counseling
22103,Bitfone-Corporation,software software solution service provider air repair upgrade
6570,Transformative-AI,life event patient healthcare provider people live
25657,BitLog,logistic consult firm supply chain commerce industry software market world experience retail manufacturing company pillar operation
385,Reap,platform access connectivity innovation company management software payment product flagship business success tool customer market group investor team office country
540,RevenueCat,subscription platform build app subscription subscription toolkit business tool app subscription product user datum chart -party integration
1014,Troop,troop fintech platform resource shareholder right action network investor
22258,Bitreactive,technology platform development maintenance application logistic application technology sensor network meter company development tool development application creation integration component -partie process block marketplace distribution channel interaction network development application
24615,Bitrise,platform development developer integration testing deployment integration service developer love developer workflow result step integration process service development workflow developer customer startup enterprise company automation
6190,Typelane,employee onboarding flow way goodbye employee workflow design personalisation process
46,ERPLY,solution inventory data shop store warehouse time datum company software platform range accounting web shop outlet credit card reader device payment business solution store customer relationship inventory car service market car schedule job salon spa booking cafe
1571,MOO.COM,office print statiry photo design partner site card image collector item dream tool people content print product sticker card business card postcard card customer country
25453,BizBot,shareholde tool investor business owner user datum time resource growth paperwork company
23645,Blazar-Capital,company builder internet space idea partner entrepreneur ceos company investment expertise leadership inception brand angel investor
22571,BlueCall,wellness empowerment toolkit organisation leader employee wellbee hand toolkit coaching session self development need
22780,Bluetest,develop reverberation chamber software development evaluation product antennas company state art test method antennas test end user parameter coverage throughput battery lifetime measurement systems distributor network reverberations system location site world
22113,Blyk,blyk medium work operator people brand stuff service leader mobile advertising audience engagement ability response rate investment advertiser text medium advertising format behaviour people message phone people brand way company office partner
3764,UK-Flooring-Direct,retailer quality brand wood laminate vinyl consumer trade e pioneer
218,RPX-Corporation,provider patent risk solution buy acquisition syndication patent intelligence insurance service service efficiency patent market litigation company approach capital patent expertise client contribution patent buying power patent patent risk client network client fee company size right patent portfolio acquire patent asset right client network member sector consumer electronic pcs commerce software service medium content distribution communication device network semiconductor promise patent patent right portfolio
23711,bmetric,business boost sale conversion customer experience contact centre channel channel management strategy bmetric service machine technology technology consumer culture majority interaction website customer website lion share session time machine approach customer journey rethink engage customer solution align customer channel contact centre flagship technology model customer journey time channel cost sale service outcome customer -party journey data customer message action customer need channel availability solution bmetric tracking touch brand insurance banking publishing telecommunication utility sector
6112,Upptalk,communication app user text group chat multimedia app device contact mobile phone user user credit signing friend video promotion
24317,bMobilized,pioneer technology cost time skill create state art website company technology website website customization feature map site business advantage opportunity engage customer device software service basis business increase customer engagement revenue service website network partner venture service provider web development agency directory service company partner market service revenue retention rate desire business mobile foundation service engage customer device platform web services platform company team forefront development web technology
23788,Boatflex,peer peer platform boat rental mission create network rent quality boat sailor members way cost ownership boat renter network rental motor boat fun day water sailboat holiday experience price
20130,Vivid-Vitality,mind premium powder
5506,Vara,staff management business worker notebook spreadsheet track payroll app
4374,Utility-Stream,gas electricity water procurement technology service
21904,Boatsetter,boat rental community boat owner boat captain water experience boat share marketplace boat rental consumer experience company catalyst growth capacity vessel turn boat owner return boat investment approach class market tool company home rental driver model share economy marine industry team marine professional tech veteran car rental industry expert share economy industry traction network industry business partnering company basis roll platform
25648,BoFood,bofood food compromise taste health environment product choice people need wish quality product bofood company person food industry role company bofood product taint soy flavour product combination flavour status bofood factory dessert dairy product factory bofood property right product trademark climate product
10671,​Reacta-Biotech,manufacture food challenge material pharmaceutical standard
1624,HotelRunner,accommodation transition sale operation visibility user self service platform freemium business model sale distribution management platform type accommodation web booking engine channel manager travel agency wholesaler website content management system desk center management relationship management payment collection promotion tool division supply acquisition contracting onboarde account opening engagement performance report commission collection service travel agency technology provider payment system country accommodation platform travel agency wholesaler payment system partner
1478,Vira-Health,health company term health woman condition collection datum healthcare
24516,Bokadirekt,service aim service reservation phone internet service provider idea service collaboration service provider industry user booking service
2702,Vitesse-PSP,areas bank collections bank industry peer platform help payment way
22913,Boka-konferens,boka konferens booking platform user book conference room space office product consumer inquiry telephone number email address website
22354,Bolånegruppen,group interest rate mortgage loan bank interest rate member members household money
22926,Bomill-AB,market equipment analysis separation grain product food industry experience cereal technology sector dedicate time idea grain quality company quality wheat wheat barley kernel technology head office town airport company quality technology sale organization agent distributor
21987,Bookboon,book company company website book professor expert field expertise subject business book university textbook
1509,VOI-Technology,micro mobility startup scooter transportation headquarter create system scooter center way commute people carbon footprint cities transportation network
7802,Believer-Meats,biotechnology company transform meat production manufacture fat muscle cell food safety impact aim timeless vision animal meat production reality edge agriculture technology award biologist bioengineers reality world chef scene
22246,Boostcom,world proptech company shopping industry shopping centre customer office location venture fund market position product development shopping centre company integrate touch point shopping mall environment datum layer sale owner customer point point solution loyalty scheme mobile advertising solution importance provide customer result line development expertise technology customer solution concept contribute goal sale office
25103,BOOST-Pharma,biotechnology research company stem cell therapy treatment mesenchymal stem cell bone capability bone patient bone formation
191,Milestone-Systems,milestone software manage processing video image surveillance network server installation
21700,BOOST-Thyroid,data science company patient control condition datum information condition mission term health consequence halt disease progression health outcome age cost healthcare
23060,Bower,deposit solution package product number package product garbage environment value term pledge deposit bottle beer can consumer incentive recycle package world position technology consumer deposit value phone recycling packaging place solution sort packaging plastic bag mug product reverse machine consumer recycle recycling station location consumer brand mean way increase recycling rate app consumer brand deposit value packaging money point responsibility packaging time relationship end consumer deposit system sound behavior deposit station behavior incentive deposit station
22366,Boxgard,boxgard aim customer storage customer self storage company price storage space transport box accessory solve headache customer solution transport storage space use transportation fro box home overview goal service order storage transportation track box thank interest support partner world leader transport safekeepe opportunity platform job offer superb service customer
22985,Branäsgruppen,resort operator idea slope municipality promise support person charge care project time construction ski slope project boost project council finance message project state aid ground inauguration plant kronor cost bankruptcy agreement creditor debt plant owner resort
4328,iProfile-Ltd,space definition user qualification experience format recruitment industry standard
21633,BrandBastion,community management choice advertiser premium solution advertiser performance medium brand help brand advertiser conversation ease power mission organization industry conversation relationship audience
21909,BrandHouse-Holding,retailer specialist shop consumer quality product brand border efficiency logistic financing sme license product business history market suite technology
22156,Brayfoil-Technologies,wind turbine blade force industry expand turbine size wing technology biomimicry bird wing flight wing change shape way technology wind turbine blade change shape load mw device pilot turbine site university partner
2772,MonkeyBall,play earn soccer game kind fun monkey game
23059,Aim-Sweden,company manufacture 3d printing product structure company thing customer flexibility design manufacturing component metal polymer manufacture technology industry technology application
6246,Mural,fintech startup payout platform fee web3 leader company
24184,Bread,partner retailer pay time solution finance company technology advance consumer credit access transparency ease use cost product merchant partner sale product consumer
23475,Breye-Therapeutics,firm stage provide edge treatment management disease
5413,Eatron-Technologies,​fast software supplier software vehicle reality oem grade software platform bmstar imstar software platform counterpart connectivity analytic update software improvement performance reliability lifetime vehicle software solution industry vehicle benefit business ​consumer planet
22037,Bricknode,platform institution security brokerage business platform user interface office operation advisor end customer access function user experience core service operation module provider addition software provider subsidiary security firm act labelling capability
23090,Brighteco,value startup hardware computer screen
15611,Molab,drug discovery process benefit patient people benefit range application drug discovery chemistry toxicity property
22155,Brim-Explorer,ocean excursion noise pollution ship
483,NGINX,company source project suite technology application solution bridge gap application service span code customer
482,Sezmi-Corporation,entertainment service company strength broadcast technology internet offer entertainment solution consumer company video entertainment platform aggregate sources- tv programming hdtv movie internet video demand personalization navigation plan platform platform pc infrastructure company management team executive entertainment company
21804,Brocc,company marketplace consumer service intermediary solution term transfer credit payment
21880,Budbee,delivery service customer satisfaction efficiency mile logistic service track information instant chatting time queue customer shop experience
22459,Buddy-Healthcare,care coordination platform coordination provider care protocol journey format patient patient patient information task questionnaire instruction care period care professional time visibility patient preparation recovery procedure patient attention
9367,Lofty,service solution storage storage neighboring city storage apartment optimize living space apartment alternative service mode storage home delivery self storage furniture storage storage self storage box rent storage box rent
6577,Novacta-Biosystems,knowledge team business model biocatalysis pathway engineering service business effort disease pipeline
23126,BudID,budid service housing business solution housing transaction
23267,BuildX,construction market construction project capacity time price soar record price market contractor trade barrier market mission change situation market contractor vision construction market contractor price trade barrier way platform construction tender sector company work step vision
15395,twidox,user organisation share document technology document internet enable user world web focus website industry document research material paper articles coursework dissertation datum statistic site archive index text user charge
3941,One-Media-IP-Group,acquisition exploitation medium property right distribution medium outlet medium product music video word book company music content tv film advertising video game
431,OpTier,provider application business transaction day dna market award cloud solution business monitor production application enterprise insight application performance business result customer satisfaction
23239,Bumbee-Labs,analytic prediction datum signal phone insight environment data collection datum cleaning model method kind approval account company approval method datum element insight number visitor dwell time path zone level datum dashboard system customer datum model network network insight purpose
23842,Burt-Corporation,startup studio building datum company advertising industry company address gap technology creator publisher marketer product generation tool attention measurement conference platform advertising growth analyst entity
5732,Oxagen,company drug discovery development solution molecule drug treatment bowel psoriasis allergy arthritis disease
10414,Image-Metrics,team computer scientist consumer application computer vision analysis recognition technology patent man year research element company experience games device environment algorithm recognition gesture emotion wink eye camera laptop tablet smartphone self representation content control technology device game app developer sdks company research development office
6070,Overwatch-Research,track software research afford time error collaboration lab
25251,Butchers-&-Bicycles,point day cycling product passion hand pride district hope
9537,Actuation-Lab,actuation problem servicing requirement longevity actuator
21754,BYON8,co attempt health care industry solution inception pace developer team members team concept company vision concretization idea backup idea office university supporter history phase support venture capitalist partner world health care exception aim health care demand
25133,Bytbil.com,marketplace car motor home motorcycle outlet garage mission service buy car customer car dealer sell car
7120,Impact-Biomedicines,development life treatment patient cancer pipeline fedratinib molecule kinase inhibitor treatment myelofibrosis polycythemia vera
25504,ByteActive,partner information security cost operation people datum reduction de duplication blend datum manipulation compression encryption source level de duplication bit level compression chain encryption source datum technology security datum storage cost customer
22077,Cabana,flexibility travel plan traveler book company fleet custom hotel room van traveler freedom travel sleep element bed storage bathroom internet ground premium experience lodge quality amenity suite space tech traveler convenience peace mind contact check app traveler check hotel room pit desk
24543,Cabforce,mission door door travel experience agony offer price credit card payment receipt taxi hire car minibus booking city
23921,Cacharge,company commitment solution background estate energy optimisation entrepreneurship
24428,Cachet,service marketplace mission platform economy worker insurance policy platform use service platform worker cost earning lifestyle platform economy
24560,Cajo-Technologies,laser solution purpose forerunner laser software material knowledge laser beam innovation solution traceability product marking production process
24948,CALA,mission access class infrastructure fashion industry way web platform app customer design fabric selection product development network partner addition logistic post purchase experience fulfillment customer service
23889,CallDesk,software service platform route call center solution crm system startup enterprise client price minute customer language
696,Phorm,technology company development web personalization technology solution internet service provider phorm behavior advertising technology service office
2199,PharmaKodex,company molecule drug pain condition company office subsidiary
10662,Creative-Car-Park,specialist car park management company parking enforcement solution site
10571,Impression-Technologies,service engineering need concept production knowledge expertise support ® technology transform project facility house production run customer partner
9958,Index-Stock-Imagery,index advertising community source stock photograph illustration library image artist artist agency
22016,Calmark-Sweden-AB,method enzyme lactate blood analysis point care biomarker method development information
24065,Cambio+-Healthcare-Systems,healthcare solutions care stage personâ´s life technology goal health care company plattform support healthcare organisation
23004,Camcoil-Systems-Sweden-AB,manufacture reel metal industry company
291,Productboard,product management system product team customer roadmap
4845,automaited,process automation software integrate system support workflow adjustment system minimizes risk cost process
25592,Campadre,campaign website member clothing accessory home decoration lifestyle product price shopping concept shopping club brand price time campaign member member campaign member member number member number member investor staff
12047,Marondo-Capital,investment partnership growth technology company ambition generation sme leader industry healthcare technology material technology software cybersecurity marketing technology team market investment experience company
8775,Industrial-Origami,metal design technology license sub license supply manufacturing aspect company technology sheet material load structure customer technology product technology license sub license design service technology simplifie design assembly product product design precision method contract manufacturing partner network
9253,OWS-Agri,technology development company ozone nitric oxide safety food agriculture product
23929,Canary,service company fund people impact lab research influence policy formation way health platform employee grant money emergency hardship time difficultie ability living expense mortgage utility food date organization employee distress access emergency grant
198,Rakuten-Americas,buy product store search inventory retailer location technology alert store customer pickup consumer need retailer customer
594,InfoGear-Technology,software asic cost internet market product iphone telephone touch screen access line service company
78,Rebtel,solve problem encounter border flee communication work banking problem management group company tradition disruption technology platform communication money transfer user work program home group world company employee nationalitie
418,Respond.com,marketplace purchase consumer quality business user request form response service provider market user sevice provider
