id,name,cb_description
23996,Canatu,solution design freedom user experience level 3d touch device weather develop 3d film sensor heater solution film plastic glass textile leather touch switch user interface 3d heater solution sensor film method equipment supply cnb ™ film touch sensor module vendor industry consumer electronic sale location network kind innovation
25410,Candidator-AB,candidator company operation telephony outsourcing service company organisation market motto strategy term customer relationship levels solution customer business benefit
13991,Marvel-Fusion,developer fusion energy technology offer environment energy reactor pulse energy laser fusion power consumer energy source company
3751,Research-&-Development-Specialists,businesse r&d tax credit refund hmrc
8939,Oxford-BioElectronics,medicine people patent technology team design expertise mix market device
372,Shopmonkey,process management software auto repair shop platform entry invoice payment shop management system customer ability pay person tool customer email user appointment confirmation reminder share invoice inspection sheet payment question click company
22574,Capcito,provider capital sme invoice factoring business loan button cloud accounting application bank lend platform scoring engine accuracy credit assessment solution sme growth business
21844,Capeesh,machine intelligence language company engine build user industry job department mother tongue
496,RetentionForce,marketing software business state art marketing solution technology chatbot software client loyalty program program customer review feedback collection tool marketing marketing automation platform use time marketing business repeat customer minimizes work automation use content template business system tool business business use feature system marketing tool growth plan plan package solution stage business
173,RightScale,enterprise delivery cloud application customer line revenue cloud usage risk cost cloud cost management optimization solution organization action cloud enterprise solution organization access portfolio cloud service business unit development team enterprise control
23555,Capevo,platform form company
120,Robinhood,robinhood stock brokerage customer stock option etfs cryptocurrencies commission startup equity cryptocurrency option trading cash management account stock brokerage platform access market people money trading stock application company
10704,CloudCath,sensor platform dialysis patient complication detection number visit
21993,Capitainer,patient volume blood spot home technology volumetric blood collection device patient blood sample comfort home technology solution cost saving healthcare provider blood sample
1492,muse.ai,company world video content content audience video human goal build search knowledge product user experience upload search content solution video experience complexity audio content world product video searchable bite consumption platform
22095,CAPNIA,company product gas delivery system number disease application gas compound product trial treatment acute migraine symptom people condition
82,Secret-Escapes,negotiate rate luxury hand hotel holiday price pay booking hotel room access member rate email address cost access rate hotels holiday struggle match price guarantee
188,SecureWave,endpoint security software solution company security data leakage prevention protection system health maintenance compliance solution security solution monitor control application network organization datum threat company government education manufacturing sector product network reseller service provider partner
456,SESO,labor marketplace agriculture shortage labor problem farm workers guest worker program service offer qualify training worker visa automation management software employer law employer quality workforce cost worker employment opportunity
7905,InforSense,enterprise business intelligence software product core technology platform organization automate datum source information analysis process insight core technology product analytic document explore automation library edition edition machine company product research software application cohort identification researcher analysis datum generation throughput platform solution framework patient specimen data research analytic environment bioinformatic solution sequence analysis informatic database annotation vendor environment cheminformatics solution addition business intelligence product solution asset management credit risk risk edition solution company workshop training service company biotechnology consumer good service manufacture communication company operation office subsidiary
23573,Capturi,platform speech recognition customer centric business customer platform conversation analysis software company customer conversation time access insight value improve quality maximize customer employee satisfaction customer employee satisfaction conversation analysis language class
5051,Skuad,payroll benefit compliance country employment employment lifecycle company business investment hr admin effort
24125,Carbo-Culture,carbon tech startup carbon atmosphere carbon material biocarbon technology woody temperature instant biocarbon benefit carbon form atmosphere year material benefit biomaterial soil word biocarbon power carbon atmosphere climate change climate change material
21520,AISPECO,company monitor system helicopter uavs vehicle
24501,Carbonwave,seaweed platform address sequestration pollution volatility climate emergency system level approach operation collection distribution ecosystem economy
24343,CardioMech,developer device heart disease surgery placement chord valve company device placement chord surgeon access option heart disease technology treat patient regurgitation prolapse flail
4022,Shuropody,shuropody foot provider clinic people site footcare service comfort footwear support footcare product
25324,Cardior-Pharmaceuticals,biotechnology company development therapeutic treatment prevention heart disease inhibitor master switch alteration heart stress injury spin therapeutic treatment prevention heart disease number death world
2565,AeroCloud,edge technology aviation industry
15430,matched.io,job technology developer company simplifie hire process assist team job career
215,Silverfin,cloud platform accountant efficiency competitiveness profitability compliance service power development delivery service data client system host cloud accounting workflow datum hub compliance
94,SourceLabs,provider set tool service support source software company subscription enterprise support maintenance upgrade source software website community project document source software
10736,NeuroVia,need disease goal arrest onset deficit
13084,TakWak,producer device camera mp3 player
22418,AISTI,wood fiber tile carbon recycle bring sustainability construction tile tile
7279,InLive-Interactive,television solution technology software television viewer television program telephone time player broadcaster platform interaction viewer format television station content programs company partnership company office
407,Squarespace,website build e commerce platform user brand transact customer company suite product entrepreneur creative professional project business website domain commerce marketing tool scheduling tool medium presence access design customer country touchpoint company
30,Standard-Treasury,company business bank apis ease transfer transaction company banking service business startup end files spec page
53,Stardoll,entertainment gaming destination teenager world teen likeness design dress approach fashion celebrity friend audience girl site collection garment home design accessory variety world brand
13632,MaRVis-Medical,production guidewire intervention treatment market field measure increase benefit safety technology area radiation procedure ray
21672,Aiten,healthcare measurement lifestyle change disease
3017,Quit-Genius,world clinic nicotine alcohol addiction evidence approach therapy medication device employer health plan cost addiction live employee member
23705,Cardlay,approach discussion process payment card time notification account functionality transaction company load transaction time cardlay integrate payment card transaction expense management software platform platform issue load card expense visibility currency expense app time notification account functionality transaction free resource cardholder accounting department customer benefit
104,StorSimple,application storage solution storage performance scale datum protection cost enterprise storage application
6751,Sunfire,manufacture system gas fuel production mineral oil gas e e e fuel infrastructure oxide cell conversion process generator electricity heat vision energy source wind farm plant system wind wave sun
22427,CareChain,effort technology coordination scale collaboration ecosystem order minimise coordination establishment consortium ecosystem challenge context technology infrastructure start test advantage automation security benefit fix ownership model deploy resiliance security number member network consortium co partner
17269,The-Meatless-Farm,producer plant mince burger sausage taste protein vegan
10763,Buyk,food delivery platform food grocery product
22759,CareLigo,product aid heart disease care quality life career saving consequence
3448,Tessera-Therapeutics,stage life company biotechnology scientist clinician ability message disease source potential medicine breakthrough gene therapy gene edit limitation utilization efficacy life innovation enterprise resource category company health sustainability
433,Temporal-Technologies,computer software company user application developer primitive fields information technology software development computer software
2865,Symetrica,development commercialization radiation detection identification system security diagnostic space research development application company
22393,CAREMAKER,fundraise thing honeymoon memorial friend life event project idea idea ceo period cancer endure chemotherapy radiation treatment organization institution struggle tool time fundraiser contact question search idea platform fundraiser charity project
23281,Care-to-Translate,language migration language barrier problem healthcare sector effort problem interpretation service cost care translation tool problem language barrier provider communication healthcare professional patient language cost safety healthcare
22908,CargoBeacon,device cargo environment datum cargo transportation industry support temperature humidity acceleration shock event datum timestamp order event
64,topi,subscription platform retailer manufacturers equipment business tech infrastructure retailer manufacturer business customer access refinance insurance hardware management click company usd m date
1479,Thington,company founder consumer product technology expertise location network web datum
22197,Carmel-Pharma,manufacture distribution product quality life people administer drug system drug transfer device drug interaction environment company product cancer center oncology practice specialty pharmacy facility office
25494,Caromba,consumer workshop service car repair shop chain consumer price service market
24534,CarZar-(Pty)-Ltd,car buying service consumer hand vehicle
7884,Paksign,signature platform individual business paperwork sign document identity e signature
98,Trustpilot,review platform review domain people share review business company tool consumer feedback business result mission people business experience review time consumer office employee nationalitie
7128,Alderaan-Biotechnology,company antibodie target oncology nk cell
95,Soluto,support protection service user contact premier support technician web communication device management service support user problem email alert remedy issue pc laptop smartph save time frustration service action pc insight report asset management activity
13198,Resourcify,platform operating system recycle waste management company recycler software location recycler container waste stream
4607,Innovify,innovation product management company headquarters range expertise client product business driver work model function philosophy partner client scope application development range product website apps software market opportunity value driver organization entrepreneur up approach solution fund infrastructure business competition partner guide company phase stage conceptualisation development product niche implementation business process market potential environment stage idea business ideology life idea idea way peak success partner ambition
20963,Cascadian-Therapeutics,stage company product treatment cancer company stage product candidate tucatinib molecule tyrosine kinase inhibitor combination kadcyla combination kinase protein kinase study cell division cycle dna damage replication stress addition company development novel antibodie t cell immunoreceptor domain receptor t cell nk cell response cancer license agreement manufacture commercialize tucatinib research collaboration agreement discovery novel inhibitor collaboration agreement discovery novel immunotherapy target oncology
3364,Unbxd,e commerce product discovery platform intelligence datum shopper product machine site search shopper search result merchandiser insight machine learn algorithm e commerce company user interaction website conversion sale volume
22243,Catchatrade,seafood marketplace risk seafood trading company platform user ability community seafood professional trading opportunity reduce cost sale sale volume use trading platform seller buyer
23607,Catglobe,research company software product service research industry research ™ client company range research tool client access ™ resource center panel technology work administration interview method statistics company product service partner country
23665,Catinet,catinet carpet clean industry dust particle measurer dust remover press extractor carpet spin carpet service pack table type carpet
10811,Wishcard-Technologies-Group,gift technology company company brand gift voucher location solution partner
5125,VERSATILE,machine learn construction process capture data point time insight job site performance decision hook crane kind technology production datum job site information material construction progress crane utilization
100,VirtualLogix,virtualization software solution devices network virtualization software platform system operating system application operating system environment hardware company product time operating system operating system purpose processor signal processor virtualization solution device solution product eclipse environment user build platform consult training service support program company solution multimedia device equipment system application semiconductor company manufacturer carrier company office
24448,Causalus,company world process software medication (= patient medicine use people prescription medicine mrs standard drug reaction health expenditure process time medication change impact track document action transparency
58,Spendesk,time money spending process visibility automation business finance team time topic business business up brands community finance leader member
24328,Cavai,cavai advertising company product help advertiser cloud advertising experience mobile cookie
24262,Cavitar,expert illumination laser diode laser technology laser lighting speed image machine vision application company component product system user r&d application integrator monitor system cavilux illumination laser power brightness efficiency source process laser customer heat motion feature accuracy measurement r&d application industry solution time monitor ergonomic cost saving fiber coupling solution environment space
6829,WatchMeGrow,solution parent childcare user video service childcare preschool user kid camera classroom daycare videos cloud family privacy
3885,Uform,portfolio companies family housebuilder company coffee food shop chain software developer
3781,XCD-HR,self service system hr visionary firm information fingertip hr control value hr work business talent team world hr vision reality
6968,YakCloud,cloud telephone system entrepreneur business owner phone number user phone voicemail box click
10821,Inspired,co school group inspire student environment
24084,Cayenne-Medical,sport medicine company surgery product enable surgeon cruciate ligament reconstruction hamstring tissue graft company device knee kinematics device reconstruction application reconstruction procedure bone bone bone bone graft addition interference screw shoulder product
24041,CBTec-Oy,employee vision education technology vision belief education history philosopher world olive tree grove event foundation education people philosophy education world educator student classroom share course college trainer coach learn management system course content teacher interface use educator engage student discussion board videos notifications corner world
23567,CCURE,ccure ® pharmaceutical company development production range injection product use plastic syringe ccure ® term storage pharmaceutical product introduction ccure ® product time handle ampoule vial syrinx hospital ward diminish filling syrinx place condition compliance legislation quality assurance pharmaceutical production safety traceability product economy syrinx use time preparation ward patient care ccure ® project example cooperation institution corporation
23218,CE-Check,company mark product business automation tool scalability reliability performance service assist business requirement product feature support testing product test lab creation storage file service platform self certification subscription product software product testing lead time system business cost time market
3603,Zume,zume world plastic waste substitute plastic packaging
24856,Celladon,biotechnology company therapie treatment heart failure product calcium cycling contractility heart muscle cell enzyme replacement therapy heart failure
22291,Cellfion,cellfion material level energy storage conversion
89,Supersolid,studio game date download popularity game game review platform title feature character game team game veterans backgrounds award hit series
4651,Oxyntix,team technology energy process field capitalise property expertise
735,Waterplan,platform company water availability facility
203,Bird,vehicle share platform transportation solution community platform city citizen access vehicle user transport
25609,Centiglobe,payment system speed blockchain exchange system custodian asset value user value time protocol feature user freedom access exchange market delay purpose facilitate economy legacy system consensus transaction time footprint technology
13199,voiio,people culture core company truth success solution company employee welfare benefit platform range offer employee life health challenge crisis match need
23772,Cercare-Medical,software tool stroke management effect stroke software area area image mismatch volume number salvageable tissue
47,Upserve,work restaurant workforce restaurant employee chain restaurateur business margin capital budget software time guest staff menu marketing finance restaurant level management assistant guidance restaurant ingredient guidance manage guest staff marketing finance restaurant company
23563,Cerebriu,health tech company machine imaging efficiency quality radiology software solution company image acquisition protocol triage brain acquisition decision stage process company finding brain brain stroke bleed tumor dementia brain
24106,Ceregene,biotechnology company treatment disorder delivery system growth factor program vector nerve growth factor study treatment disease cere-120 trial disease development development sclerosis disease disease
23778,Certainly,mission help business user experience salesperson fix company people experience conversation transaction focus term relationship customer software connect platform business customer partner country business size state art quality experience customer language schedule demo specialist opportunity
8545,Nykaa,platform beauty wellness product man woman content product beauty video expert e beauty magazine helpline product service customer product brand delivery experience
22602,CERTEGO,supplier security solution protection property people company capacity presence service employee chain security solution feasibility study project work installation service management responsibility analysis place security solution work clock leader door open solution housing ensure property partner security solution business border
25199,Cervi,ventilation air solution solution air energy saving solution modernization ventilation refrigeration refrigeration equipment maintenance
20798,Denwa-Communications,operate heart company increase staff productivity customer service sale staff team expert responsiveness business downtime time mile data infrastructure business telephone system staff brand solution house engineer support plan cover client level service point sale completion
3987,SDL-Group,expertise property service coverage risk management surveying letting estate agency mortgage insurance broking
10115,Intercytex-Group,development stage biotechnology company research development commercialization cell therapie regeneration skin hair company cell technology platform cell product product program development rejuvenation skin damage repair product trial shef-1 cure cause hair regeneration product trial skin graft replacement burn wound trial company
24315,CFEngine,pioneer organization way deliver infrastructure application organization provision resource application order availability security compliance scale environment user country world organization company directv
23236,Cgrain,instrument quality control cereal image analysis ceo seed company instrument image analysis seed testing seed seed testing laboratory research project devolop image analysis grain milling industry farm farmer country project company ceo business product development manufacturing
124,Etsy,commerce site smartphone application buy handmade vintage item user product category clothing accessory jewelry craft supply tool wedding entertainment home live kid baby vintage
6742,Yubi,platform trade execute fulfill debt solution investor
51,Zendesk,customer service platform software organization customer relationship empower organization customer engagement customer product use organization flexibility innovation scale growth customer industry language
22531,CGTrader,way people content way experience world source stock custom 3d model activity business line company self service world source 3d content 3d model community user designer designer platform enable 3d design term range industry leverage 3d content design cost scale time market gaming advertising animation 3d printing architecture 3d enterprise customer retailer product 3d model customer experience photo shoot customer experience sale conversion product nerk designer 3d model complexity scale
24805,Chain-Antimicrobials,peptide peptide catheter infection test product result
24281,ChemoCentryx,company medication disease cancer discovery development commercialization molecule therapeutic receptor chemo receptor company molecule product candidate chemokine receptor system cascade disease
23797,Cherryz,marketplace variety item accessory categories product health beauty home bath kitchen household food tech item company
24472,CHOOOSE,apis software climate compensation app meet customer climate action customer experience platform climate solution type climate program
24724,Chord-Hero,range product music fun product product child music game
432,7TM-Pharma,company drug focus metabolic asthma disease company transmembrane receptor molecule receptor antagonist agonist disorder bowel syndrome drug inflammatory disease
23408,Chr.-Hansen,bioscience company ingredient solution food pharmaceutical industry culture probiotic color variety food confectionery beverage supplement animal feed solution research development competency technology investment employee countrie production facility
20,Acutus-Medical,technology company platform display heart activation pattern chaos complex vision electrophysiologist company product co team scientist engineer professional
29,Adyen,technology company platform integrate gateway risk management processing settlement payment merchant payment method sale channel merchant mobile point sale channel headquarter
83,Alan,health partner access life body mind service health insurance healthcare system mind thing people insurance
505,AlertMe,platform ecosystem device appliance home provide end end service way point solution devices application platform ecosystem device appliance service user control home mass market user work complexity user web app ecosystem application need award technology facilitate deployment device adoption business speed market agility service
24674,Ciegus,service health care professional medication medicine safety personnel drug expertise drugs administration patient information concise manner day medicine
21953,Cimon-Medical,owner technology monitor blood flow ultrasound core innovation coin ultrasound probe element transducer beam measure blood circulation area tissue blood flow signal volume research equipment measure blood volume flow region equipment measure circumvent problem attempt blood flow monitoring measure blood vessel transducer processing system operator
105,Anine-Bing,headquarters downtown fusion heritage spirit staple basic statement piece timeless director piece collection marrie meet design approach date boutique world flagship store expansion world
