id,name,cb_description,next_sentences,industry1,score1,industry2,score2,industry3,score3,industry4,score4,industry5,score5
23502,AnaptysBio,privately hold therapeutic antibody product company use somatic hypermutation antibody discovery optimization,"SHM is the body's natural process for generating potent antibodies to fight disease. The Company's SHM-Platform utilizes the key components of SHM and other techniques to generate antibodies for therapeutic applications through an iterative process of natural evolution and high-throughput selection a process that has been referred to as naturalizing antibodies. 

 This versatile platform can be used both to discover and optimize antibodies directed at specific disease targets and also affinity mature existing antibodies to improve their binding properties. In addition to providing a more powerful approach to antibody discovery and protein optimization, it addresses a growing void in the therapeutic antibody field due to a string of acquisitions and licensing deals that have reduced the availability of many technologies.",BioTech,0.254,Life Sciences,0.239,Genomics,0.195,AdTech,0.176,Nano,0.156
24894,Anatomic-Studios,anatomic studio close knit team experience expertise design fashion biomechanic prosthetic,"But more than anything, we are a team of passionate creators dedicated to increasing the quality of life for people through personalized design - we believe in design that celebrates the uniqueness of the human body, personality, and style of the person wearing our products.",Design,0.319,Beauty,0.318,Fashion,0.308,Manufacturing,0.286,MedTech,0.24
24942,Anergis,clinical stage biopharmaceutical company discover develop allergy vaccine base technology ultra fast desensitization,"It offers vaccines against birch pollen, ragweed pollen, and house dust mite allergies. 

 Francois Spertini founded Anergis in 2001. Its headquarters in Lausanne in Switzerland.",BioTech,0.214,Life Sciences,0.162,Healthcare,0.151,Genomics,0.135,Longevity,0.132
25385,Animail,found revolutionize e commerce development pet industry,"Back in 2007: a challenger and a start up. Today: driving the digital development of the industry as nordic market leader online. 

 Our customers choose between 8000 different products - ranging from pet food to accessories such as toys, treats, supplements, clothing, healthcare, hygiene and more. Our product range covers dogs, cats, small animals, birds, reptiles and fishes. Purchases are made online and goods we ship the good to our consumers - all the way the door step.

 Since 2011 backed by Verdane Capital",Retail,0.48,Physical Storage,0.344,Fashion,0.344,E-commerce,0.34,MarTech,0.339
6066,Elucidate,elucidate provide rating datum analysis financial institution,"Businesses and revenue growth are made possible by the company's ratings and risk pricing products, which also encourage lawful behavior and help create a fairer and more open system. With Elucidate, a business' front, and back office teams can collaborate easily, improving customer service and lowering risk.",Business Intelligence,0.352,Data Management,0.351,Analytics,0.28,Sales & CRM,0.272,Energy Efficiency,0.266
3949,Magma-Global,design manufacture m pipe ® high performance pipe create meet challenge riser jumper spool flowline application,"Magma has developed m-pipe® to meet the particular challenges from deep water and high pressure, high temperature and sour service operating environments.

 Magma was founded in 2009 by its management team and received additional backing to accelerate its growth programme in 2010 from Calgary-based KERN Energy Partners and Copenhagen-based NES Partners.",3D Printing,0.288,Manufacturing,0.213,Procurement,0.167,Sales & CRM,0.163,Industrial IoT,0.145
16930,Datatecnics,datatecnic generate unique dataset empower client unprecedented knowledge health infrastructure accurately forecast asset lifetime prevent downtime ensure budget deploy efficient manner possible,"We’re experts in the design and delivery of IoT systems to digitise the infrastructure of our large utility and energy customers.

 By designing our own hardware, from the ground-up, we’re able to transform assets with digital capabilities to produce high-quality, high-resolution data, and in turn drive unmatched predictions on asset performance and health.

 Everything we do is to make our customers’ lives easier through high-quality, instantly available knowledge of their assets’ health.",Data Management,0.422,Data Infrastructure,0.39,Data Centers,0.377,Big Data,0.37,Data Storage,0.364
10183,Travtus,lead digital employee rental community deliver automation line intelligence natural conversation,Adam never misses a call and understands the 1000’s of unique needs of customers.,InsurTech,0.407,MarTech,0.406,Future of Work,0.405,Industrial IoT,0.401,Automation,0.382
5367,Love-Home-Swap,use home travel world free big online travel club,"Members can choose from 54,000+ stylish homes in city and holiday destinations in 160+ countries worldwide - and the very best levels of service before, during, and after their stay.",Travel,0.522,Sharing Economy,0.347,Esports,0.342,Social Networks,0.288,E-commerce,0.27
233,Enfore,business platform pair collection versatile easy use app run smartphone tablet personal computer,"It was founded in 2009 by Marco Boerries. Enfour's solution creates a level playing field by giving small businesses instant access to the tools, capabilities insights normally only available to larger companies. Their goal is to provide the majority of small businesses around the world with similar efficiencies and scale effects to those that large enterprises possess. 

 They founded enfore to re-imagine how these businesses utilize technology and to enable them to stay competitive in a connected world. By combining innovative hardware, powerful and easy to use software as well as comprehensive services, enfore delivers an amazing solution to connect all business aspects.",Sharing Economy,0.318,Platforms,0.315,Communications,0.31,Mobile,0.286,E-commerce,0.257
22456,Anocca,provide service biotechnology immunotherapeutic drug discovery drug development immunology service,"The company does precise and efficient analysis of T-cell biology, which is required to deliver a variety of therapeutics that specifically harness or manipulate T-cell immunity in a number of disease areas, including cancer, assisting the life sciences sector in developing a variety of therapies and vaccination strategies.

 Anocca was established on October 23, 2014 by Reagan Jarvis in Södertälje, Vasternorrlands Lan.",BioTech,0.51,Life Sciences,0.501,Genomics,0.355,Longevity,0.333,AgTech,0.289
10196,Outdoorsy,outdoorsy marketplace platform connect owner camper,"Lots of folks own RVs.  Lots of folks want to rent RVs. Outdoorsy is how they meet.

 Outdoorsy is the first peer-to-peer marketplace to disrupt the $32B recreational vehicle industry. We connect passionate RV owners with qualified renters and make it easy and safe for them to transact.

 They're disrupting the RV market by removing all the friction and complexity from the current user experience. They provide choice and access for people who love to travel in RVs, as well as the opportunity for RV owners to make a tangible income from renting their vehicle.",Sharing Economy,0.315,Platforms,0.256,Travel,0.191,Creator Economy,0.179,Esports,0.177
11,Everpix,everpix smart photo platform give effortless way enjoy life photo collection,"Snap more pictures, stay organized, and have all of your photos on-the-go. Everpix dusts off your memories and lets you see them in a brand new light


Everpix is an online platform that enables its users to store, share, and organize photographs. It enables its users to take images and organize pictures into folders.


 Everpix was founded on August 26, 2011 by Wayne Fan, Kevin Quennesson, and Pierre-Olivier Latour. It is based in San Francisco, California.",Health Tech,0.211,Creator Economy,0.185,Edge Computing,0.175,Connected Life,0.173,Fashion,0.17
8384,Guidebook,guidebook simple powerful mobile application builder let create app easy step technical skill require,"Just choose from a gallery of mobile app templates, select your features, and fill it with content. Then publish in minutes to Google Play and the Apple App Store.",API-First,0.351,Productivity,0.287,3D Printing,0.263,Platforms,0.249,Mobile,0.244
24405,Antas,s.r.l,"anticipates the market needs, realising the concept of Facility Management in its structure. As a matter of fact, it establishes the new service standards, the reference point for the whole sector. One of the Gruppo Giglio feature is the ability of proposing itself as a 360° partner for the management of all support service activities for public and private companies. The wide experience and the know-how acquired allow the company to select, together with the customer, the best solutions possible, according to his specific features and needs. The technical experience developed and strengthen during these years allows Antas s.r.l. to supply a wide range of services to residential, industrial and tertiary public fields. Among these services we find: COMBINED ENERGY SERVICE, FACILITY MANAGEMENT, RENEWABLE ENERGIES, COGENERATION, PROJECT FINANCING and ENERGY EFFICIENCY.",Security,0.183,Healthcare,0.177,Entertainment,0.168,Psychedelics,0.161,Defense,0.157
23359,Antourage,antourage medium technology platform allow content creator interactive experience multi platform audience,"The company's mission is to give the world's greatest live media creators the tools they need to do their job in a changing media landscape.

 Founded in 2015, the company is headquartered in Stockholm, Sweden.",Creator Economy,0.52,Social Networks,0.462,Platforms,0.458,Sharing Economy,0.381,Esports,0.359
425,Expel,security operation provider offer manage detection response mdr remediation phishe support threat hunt,"Expel’s technology and people work together — each doing what they do best — to detect, understand, and fix issues fast. The collaborative experience in the Expel Workbench™ platform enables customers to choose how they run their security operations — whether that’s following along with live investigations, or receiving alerts at every step from when an investigation starts until it’s done. This unmatched transparency means customers always know what’s happening in their investigations into incidents like business email compromise (BEC), business application compromise (BAC), phishing, ransomware, cryptojacking, and supply chain attacks, to name a few. This allows security operations center (SOC) teams to dedicate their time to strategic security priorities rather than sifting through alerts.

 The company was founded in 2016 and is headquartered in Herndon, Virginia.",Cybersecurity,0.374,Security,0.347,InfoSec,0.336,Defense,0.239,Extremism,0.169
87,Experiment,experiment online community crowdfunde platform scientific research,"It provides crowdfunding services for scientific research related to categories such as biology, chemistry, computer science, medicine, anthropology, psychology, engineering, and more.

 The platform provides its services for researchers from over 150 institutions and universities around the world. It is in strategic partnerships with [Tulane University School of Medicine](http://www.crunchbase.com/organization/tulane-university-school-of-medicine), [University of Washington](http://www.crunchbase.com/organization/university-of-washington), and the Sci-Fi Fund.

 Experiment was founded by [Skander Mzali](http://www.crunchbase.com/person/skander-mzali), [Cindy Wu](http://www.crunchbase.com/person/cindy-wu), and [Denny Luan](http://www.crunchbase.com/person/denny-luan) on March 12, 2012. It is based in San Francisco, California.",Social Networks,0.395,Esports,0.314,Creator Economy,0.312,Sharing Economy,0.297,Platforms,0.297
10216,Prozo,integrate supply chain company tech enable warehousing freight network enable fast fulfillment,"It is powered by a supply chain technology stack and control tower that spans the entire supply chain. It serves businesses of all sizes in the B2B, D2C, and B2C segments by providing enterprise-grade supply chain capabilities on a pay-per-use basis.",Logistics,0.663,Physical Storage,0.618,Supply Chains,0.562,Retail,0.544,Procurement,0.444
23874,AnyDesk,found unique remote desktop access software download user worldwide add month,"The software is based on their unique proprietary codec, DeskRT, that allows for virtually latency-free collaboration, whether you’re down the hall, or on the other side of the world. They’re one of the 50 fastest-growing firms in Germany, and they need someone like you to help us keep expanding.

 AnyDesk is the fastest remote desktop software on the market. It allows for new usage scenarios and applications that have not been possible with current remote desktop software.",Sharing Economy,0.187,Cybersecurity,0.167,Platforms,0.154,Telecoms,0.146,Future of Work,0.134
13,Built-Technologies,enterprise technology company provide cloud base construction lending software,"Its collaboration software brings the draw management process online and helps reduce construction loan risk, increases loan profitability, transforms the borrower experience, and simplifies compliance. 

 The company was founded in 2014 and is headquartered in Nashville, Tennessee.",Cloud Ops,0.415,FinTech,0.389,Cloud Computing,0.369,PropTech,0.361,Data Storage,0.35
13950,clipkit,overall reach marketable premium video view month clipkit largest fast grow independent online video marketer,"With the combined forces of their video syndication technology, their own video player technology and a huge video library clipkit builds new video reach every day and brings together advertisers, publishers, and video producers.

 The clipkit GmbH was founded by Cengiz Kurz (Managing Director) and Werner Vollert in October 2008 in Coburg, Germany. Since August 2009 their headquarter has been based in Berlin. By today, they employ a team of 55 in the fields of ad sales, publisher acquisition, content & licensing, product management, support, and IT. Following Berlin, new offices have been opened in Frankfurt, Cologne, Istanbul and Porto. 

 They are experts for online video distribution and marketing. clipkit knows the demands of big video owners and publishers as well as the needs of specialized video producers and website editors. Through a long history and variety of online video campaigns they have a great understanding for advertisers and their wish for the best possible content and context. clipkit is constantly developing the future of online video advertising and content syndication with an integrated approach.",Creator Economy,0.357,Video/Audio,0.334,Esports,0.313,Sharing Economy,0.287,Entertainment,0.276
281,Fireblocks,platform protect digital asset transit focus protect transmission customer digital asset exchange counter broker hot wallet cold store,"Fireblocks enables banks, fintech, exchanges, liquidity providers, OTCs, and hedge funds to securely manage digital assets across a wide range of products and services. The technology consists of the Fireblocks Network and MPC-based Wallet Infrastructure.",Payments,0.39,Platforms,0.337,FinTech,0.311,Network Infrastructure,0.299,Cybersecurity,0.297
4648,Omega-Diagnostics,subsidiary engage manufacture development distribution medical diagnostic product,"The company operates in three segments: Allergy and Autoimmune, Food Intolerance, and Infectious Disease. The Allergy and Autoimmune segment engages in the research, development, production, and marketing of in vitro allergy and autoimmune tests that are used by doctors to diagnose patients with allergies and autoimmune diseases. This segment’s principal products include Allergozyme, Allergodip, and Genesis Elisa. The Food Intolerance segment engages in the research, development, and production of kits that are used in the detection of immune reactions to food. It also provides clinical analysis to the general public, clinics, and health professionals, as well as supplies consumer food detective test. This segment’s principal products include Genarrayt microarray, Food Detective, and Foodprint service. The Infectious Disease segment engages in the research, development, production, and marketing of kits that are used in the diagnosis of infectious diseases, such as syphilis, tuberculosis, dengue fever, Chagas disease, and malaria. Its principal products comprise Immutrep Syphilis, Micropath Bacterial tests, and Dengue Elisa. The company offers its diagnostic kits and systems to hospitals, blood banks, clinics, and laboratories through distributors in approximately 100 countries worldwide. Omega Diagnostics Group PLC was founded in 1987 and is headquartered in Alva, the United Kingdom.",Procurement,0.341,Healthcare,0.318,Manufacturing,0.31,Physical Storage,0.303,Logistics,0.298
25689,Aporeto,aporeto offer comprehensive cloud native security container microservice,"It secures all workloads across any infrastructure with identity-based access control for a Zero Trust posture.

 Aporeto was founded in 2016 and is based in San Jose, California.",Cloud Ops,0.457,Cloud Computing,0.402,Cybersecurity,0.334,Cloud Infrastructure,0.301,Data Storage,0.272
555,Flipagram,popular mobile app allow user create short photo video story set music,"With tens of millions of monthly users worldwide, Flipagram has been one of the fastest growing apps in the world.",Video/Audio,0.292,Entertainment,0.276,Media,0.21,Social Networks,0.204,Creator Economy,0.184
22597,Appfarm,appfarm offer lead code application development platform web mobile app,"The Appfarm platform lets users create, launch and manage cloud-based applications in a full-stack tool (Appfarm Create) available directly in the browser. All development is done using visual building blocks making the app development accessible for users without formal training and experience in programming. Technical infrastructure and cloud environments are managed by the platform automatically.",API-First,0.284,Platforms,0.276,Developer Tools,0.245,Mobile,0.237,AdTech,0.214
14,Flipboard,flipboard developer mobile social magazine platform collect share news article news source,"It lets users aggregate web content based on personal interests and publish the content as a personalized social magazine that can be shared and followed through social media that enable users to catch up on the news, read stories from around the world and browse the articles, videos and photos friends are sharing.",Social Networks,0.386,Media,0.345,Creator Economy,0.336,Esports,0.229,Sharing Economy,0.224
485,Flutter-Entertainment,flutter operate world recognisable sport bet gaming entertainment brand betfair,"Flutter has over 6 million customers in more than 100 countries.

 In addition to the exchange, Betfair has an established games portfolio. Betfair Games, Betfair Poker, Betfair Casino and Betfair's multiples and accumulator products, are hosted from Malta, which is an area that has seen significant growth and investment.   The company is also developing automated price feeds to third parties, establishing white-label exchanges and through its own Betfair Mobile product.

 On May 28, 2019, Paddy Power Betfair has completed its rebrand as Flutter Entertainment. The operator’s shares now trade as Flutter Entertainment plc under the ticker symbol FLTR on both the London Stock Exchange and Euronext Dublin.",Esports,0.428,Gaming,0.319,Metaverse,0.242,Sharing Economy,0.223,Communications,0.216
19565,Anú-Dairy,bring butter market,"Anú Dairy is a regenerative agriculture company that develops solutions to increase soil organic and carbon levels along with traditional chemical free organic farming. The Company uses grazing management and soil microbiome analysis to discover the best option for farmers, consumers, animal welfare and environmental impact.",AdTech,0.271,Beauty,0.257,Food & Beverage,0.238,Retail,0.186,Physical Storage,0.185
21783,Appium-Technologies,appium lead vendor generation telecommunication application platform application converge telecom market,"To enable its business Appium delivers the leading telecom application platform and service creation environment for the OSA/Parlay market (www.parlay.org).

 Appium complements its service creation and deployment platforms offering with a range of commercially available applications and application components together with deployment and business models for addressing the enterprise as well as consumer market segments.

 Appium works in a standard Independent Software Vendor (ISV) business model. Appium addresses its offerings to Network Operators, Service Providers, Application Developers and, as the market evolves, Enterprises.

 Appium was founded in 1992, with head offices in Malmoe, Sweden, and originally provided professional services and solutions in the areas of Intelligent Networks, Mobile Systems, NGN and services. In 2000, the company decided to exploit the opportunities arising from the OSA/Parlay standards and was re-oriented to be a product company.",Sales & CRM,0.356,Platforms,0.324,Telecoms,0.32,Mobile,0.312,Communications,0.31
165,Front,communication hub build strong customer relationship digital channel,"For many businesses, almost every customer conversation can make or break the relationship — the stakes are that high. Front puts these conversations at the center of a team’s attention and surrounds them with collaboration capabilities and contextual data from multiple systems. This lets teams stay focused on delivering timely, accurate, and deeply personalized communications. More than 7,500 businesses, including Shopify, Airbnb, Hulu, Lyft, and Mailchimp, use Front to build better customer relationships, one conversation at a time. To learn more, visit front.com.",Communications,0.407,Sharing Economy,0.369,Creator Economy,0.354,Social Networks,0.34,Telecoms,0.329
405,Frengo,frengo community people share buzz stream opinion update question prediction game,"The service allows users to follow buzz on their mobile phone or on the website. 

 In March of 2008, Frengo launched an Open Social Mobile Toolkit that allowed developers to launch mobile applications across Facebook MySpace, Bebo, Hi5 and others.",Social Networks,0.339,Esports,0.25,Gaming,0.212,Search,0.191,Generative AI,0.181
23278,AppJobs.com,help gig worker multi app well series product sign stage access utility gig worker,"Appjobs.com matches job seekers with the right gig platforms in their city and introduces them to gig economy. Appjobs Work helps gig workers aggregate their work and income data, get insights to maximise their earnings and access a range of services such as income protection and financial services.",Sharing Economy,0.291,Future of Work,0.251,Edge Computing,0.235,Creator Economy,0.227,Industrial IoT,0.225
9048,Melio,melio fintech company give small business way digitally manage business business payment receivables,"It was built to help small businesses keep up with business. A B2B payments experience that not only saves time but also significantly improves cash flow. A payment workflow so simple it helps businesses focus on their customers, not their back office.

 It was founded in 2018 and is based in New York, New York.",Payments,0.394,Physical Storage,0.355,FinTech,0.348,Logistics,0.302,Procurement,0.29
22267,Applied-Petroleum-Technology,offer high quality analysis consult oil industry area exploration production discipline organic inorganic geochemistry biostratigraphy sedimentology structural geology basin modelling,APT is the only service company in Norway offering this combination of geological services in-house and with a staff boasting extensive oil-company experience.,Chemicals,0.346,Carbon Capture,0.317,OceanTech,0.316,Carbon Removal,0.298,Business Intelligence,0.281
52,Funxional-Therapeutics,develop pharmaceutical product,"Its product candidates include BN83470 for the treatment of respiratory indications, initially asthma; BN83250 for the prevention of surgical adhesion formation and for the treatment of stroke; and FX125L, an orally available small molecule that belongs to a therapeutic class named broad spectrum chemokine inhibitors. The company also offers early stage preclinical programs that focus on Alzheimer's disease, autoimmune disorders, and pain and diabetes. Funxional Therapeutics Ltd. as founded in 2005 and is based in Cambridge, the United Kingdom.",Life Sciences,0.36,3D Printing,0.348,Chemicals,0.324,BioTech,0.313,Procurement,0.267
549,Genmab,genmab biotechnology company focus develop fully human antibody therapeutic potential treatment cancer,"Its discovery, development, and manufacturing teams are using cutting-edge technology to create and develop products to address unmet medical needs.",BioTech,0.355,Life Sciences,0.301,Genomics,0.291,Longevity,0.253,Psychedelics,0.186
25712,Apptimate,secure service,"They offer secure Point-2-Multi point communication between users, apps, devices and “things”, outside firewalls. It’s anonymized, advanced elliptical curve point-to-point encrypted and geoposition mashup. But most important; they don’t store any data. They know nothing, what they call “Forgetful Networking”.

 Build mobile and Internet of Things applications with enterprise level communication security where you have complete control over by what, where and by whom data should be consumed, stored and what should be forgotten. They don’t know anything about your users and their data. And that’s the best way they can protect your data, by not having access to your data.",Cybersecurity,0.451,Security,0.384,Cloud Computing,0.369,InfoSec,0.335,Payments,0.307
