id,name,cb_description,next_sentences,industry1,score1,industry2,score2,industry3,score3,industry4,score4,industry5,score5
4081,InterResolve,radically new approach deal car accident personal injury claim,"Their highly-automated process works with insurers and car rental agencies to bypass the expensive and inefficient legal processes. InterResolve is also an ethical solution for end-customers because it provides early medical attention, more clarity on claim and quicker payment of compensation – whilst ultimately cutting car insurance costs.",InsurTech,0.286,LegalTech,0.155,Automotive,0.151,Mobility,0.14,RegTech,0.123
2785,GladCloud,trade marketing infrastructure combine location datum dynamic customisation brand asset analysis machine learning provide solution stakeholder large brand trade customer,"The platform is specifically designed for brands that sell products and services via large networks of independently owned merchants, such as alcoholic beverages with bars, professional cosmetics with salons, food delivery, and table booking services with restaurants.",Retail,0.389,Sales & CRM,0.338,Procurement,0.33,AdTech,0.325,DeFi,0.312
23680,13th-Lab,lab develop generation computer vision platform mobile device,"13th Lab believes the camera has the potential to become the most important device sensor, and we are building the tools to enable this. Their platform is based on SLAM (Simultaneous Localization and Mapping). The technology was originally invented by NASA to be used by autonomous vehicles on space missions. 

 The first application built on this platform (Ball Invasion) is now available in the iOS App Store for all iPad2 owners.",Computer Vision,0.339,Semiconductors,0.295,MedTech,0.284,Design,0.276,AR/MR/VR,0.268
2932,Hilson-Moran,provide consultancy building service sustainability facility management service firmly establish lead service engineer commercial office retail leisure hotel residential project,,Physical Storage,0.35,Energy Efficiency,0.341,Travel,0.328,Circular Economy,0.302,GreenTech,0.296
22003,1928-Diagnostics,diagnostic digital health company crunch dna datum cloud enable healthcare provider fight antibiotic resistance,Our software service provide revolutionary outbreak tracing and diagnostics for full infection control at any hospital.,Health Tech,0.359,Data Infrastructure,0.319,Healthcare,0.309,MedTech,0.306,Data Management,0.281
21617,1939-Games,games indie game development studio base,"They are focused on WWII gaming experiences and are currently working on a digital collectible card game that goes by the name of KARDS. The game will draw familiar elements from the card game genre and fuse them with classic WWII gaming for an elegant, action packed and fun card game. 1939 Games was founded around the KARDS project in 2015 by former CCP veterans.",Gaming,0.602,Developer Tools,0.426,Metaverse,0.373,Creator Economy,0.313,Entertainment,0.299
23558,2021.AI,serve grow business need oversight management apply,"The team’s expertise in data science combined with the AI platform GRACE is a business differentiator for clients and partners worldwide. GRACE is a key component for organizations to solve some of the most complex business problems with AI while providing comprehensive data and AI Governance capability for responsible, transparent, and trustworthy model development. 2021.AI is headquartered in Copenhagen, with employees in five locations globally.",Supply Chains,0.301,Circular Economy,0.299,Social Impact,0.284,Cloud Ops,0.278,RegTech,0.269
22310,20nine,20nine helped transform regional national global brand wide range category industry apply insight gather way solve local national global marketing problem great energy originality,"They build brands like Temple University Athletics, MDA Ride for Life, Millworks, Ascension, Kleer, Tie Bar, Eye view, Media math, and many other.",Circular Economy,0.434,Climate & Clean Tech,0.358,GreenTech,0.354,Sharing Economy,0.335,MarTech,0.328
21774,21GRAMS,offer postal management corporate customer leverage technology leadership postage optimisation combination unique set knowledge experience post print document management software,"The Company's offering allows customers to outsource their non-core production of bulk mailings, simplify their communication processes and to significantly reduce postage expenses by exploiting savings opportunities on deregulated postage markets.",Sales & CRM,0.334,Physical Storage,0.325,Logistics,0.306,Supply Chains,0.296,Retail,0.268
9229,Geltor,geltor conscious biodesign company create world advanced designer protein,"We start by imagining and deeply exploring nature’s tree of life and combine biology, protein optimization, and fermentation to create sustainable, high-performance consumer proteins with optimal functionality and benefits. These proteins are 100% animal- and GMO-free, globally scalable, and sustainably cultivated. Geltor’s products are the result of endless curiosity and ceaseless optimization, clinically demonstrated for high performance.",Creator Economy,0.305,Deep Tech,0.292,Life Sciences,0.29,Beauty,0.251,Longevity,0.242
4726,Cloud-Sustainability,cloud base software platform change way sustainability knowledge consultancy training deliver,"It reduces costs, educates and empowers the user, creating self-sufficiency and delivering long-term sustainable benefit.",Cloud Ops,0.422,Future of Work,0.403,Cloud Infrastructure,0.348,Cloud Computing,0.339,EdTech,0.33
2475,IOCOM,iocom create visual communication software design videoconference collaboration solution break barrier communication unprecedented ease use performance security price business afford,Experience limitless communication with IOCOM.,Communications,0.381,InfoSec,0.316,Future of Work,0.295,Metaverse,0.288,Design,0.284
4315,iSIZE-Technologies,isize technology company deliver deep neural network data drive video preprocessing order provide significant bitrate saving standard encoder significant quality improvement bitrate,This will also allow for other advanced ai services like automated tagging and recognition to run seamlessly in conjunction with live content delivery.,Video/Audio,0.361,Data Storage,0.321,Network Infrastructure,0.269,Computer Vision,0.264,Edge Computing,0.244
8761,NPS,found order exploit polymer technology invent develop research laboratory,"Having established an exclusive licence to the technology, NPS has been working to apply it to specific applications across many industries.",Deep Tech,0.311,Manufacturing,0.303,Materials,0.266,3D Printing,0.246,Nano,0.233
246,Iterable,iterable cross channel platform power unify customer experience empower marketer create optimize measure relevant interaction experience customer love,It provides a marketing automation platform designed to optimize and measure every customer interaction.,Retail,0.379,Sales & CRM,0.342,MarTech,0.34,Sharing Economy,0.315,Mobility,0.296
19064,Cyrus-Audio,cyrus operate specialist audio company manufacturing precision hi fi equipment,"Focusing on two-channel audio, the company has achieved its premium market position through innovative engineering and attention to design detail.",Manufacturing,0.281,Hardware,0.278,Video/Audio,0.254,Supply Chains,0.232,Physical Storage,0.229
25530,24SevenOffice,offer fully integrate ajax power /erp web application -market,"Modules include accounting, CRM, invoicing, project management, file management, e-mail, and more. In addition, the product is extended with services from many partners such as banks, payroll, accounting firms, VoIP-integration, [WebEx](/organization/webex), hosting, and more. The company's market is Norway, Sweden, and the UK. The invoice and accounting modules are customized for use in these markets.",MarTech,0.285,AdTech,0.274,Connected Life,0.253,Sales & CRM,0.252,E-commerce,0.252
23102,2D-fab-AB,fab manufacturer green graphene provide graphene product,"It is an AI-based production of two-dimensional materials. Their powder consists of graphene and nano graphite and is sold dry. They supply their materials to the following industries such as transport, medicine, electronics, energy, defense, and desalination.",Deep Tech,0.283,Climate & Clean Tech,0.28,Materials,0.248,Carbon Removal,0.238,Hardware,0.224
8367,Utmost,utmost provide workday native alternative legacy vendor management system,"It gives enterprises a single solution to source, engage, and optimize spend for the extended workforce.

 The company was founded in 2018 and based in Dublin, Ireland.",Procurement,0.387,Productivity,0.33,Sales & CRM,0.315,Future of Work,0.314,Supply Chains,0.31
3351,Jiffy.ai,software company offer ai power intelligent integrate platform modern day digital enterprise,"It helps businesses automate tasks through intelligent robots that can detect and adapt automated scenarios based on change. This allows organizations to utilize their staff more productively, without having to worry about tasks that are critical yet add no value to the system. Right from processing unstructured data that is captured in different formats, to making cognitive decisions and using NLP and ML-based algorithms, JiffyRPA has helped customers achieve close to 90+% of automation. This is significant as most of the traditional RPA solutions are rule-based and only achieve lower automation levels for complex processes.",Automation,0.425,Health Tech,0.412,Web3,0.384,Industrial Tech,0.371,Industrial IoT,0.368
9293,eleXsys-Energy,operate cleantech energy company,"eleXsys Energy’s innovative technology unlocks the full potential of electricity networks, by providing services that enable a two way flow of electricity on grids",Energy Efficiency,0.378,GreenTech,0.374,Energy Distribution,0.344,Electrification,0.328,Climate & Clean Tech,0.298
741,Gemfire,combine entrepreneurial atmosphere extensive technology base,"Founded in 1995, Gemfire specializes in applying planar semi-conductor-type processing technology to create optical solutions for system integrators, through an innovative new family of high-performance telecom and specialty components. Currently, the company has primary operations in Livingston, Scotland (near Edinburgh), as well as aerospace support operations (and additional telecom manufacturing capabilities) in Fremont, California.",Circular Economy,0.426,Sharing Economy,0.37,Sales & CRM,0.32,Social Impact,0.302,Future of Work,0.292
3560,Jobandtalent,jobandtalent demand staff marketplace aim labor market liquid transparent help company hire flexible way mission reduction unemployment world,"The labor market has evolved from a very structured state into an extremely flexible one. Companies are demanding flexibility which has resulted in the growth of liquidity in the market. However, the flexible state of the labor market is also leaving the workers in a vulnerable and unprotected employment situation. Jobandtalent has created a Workforce as a Service (WaaS) platform in order to make this labor flexibility beneficial for both companies and workers alike.

 The company has offices in the UK, Spain, Germany, Sweden, Mexico, and Colombia, and has plans for further expansion to France and Italy by the end of the year.",Future of Work,0.314,Human Resources,0.305,Sales & CRM,0.296,Sharing Economy,0.293,InsurTech,0.246
25024,360-Logistics,total supplier -party logistic online store,"From their automated fulfillment center in the middle of Oslo, they deliver the market's fastest and most precise logistics services, so business owners can concentrate on the growth of their online store.

 360 Logistics is Norway's most automated 3PL operator, with over one million annual shipments from their fulfillment center in Oslo. They currently have a warehouse area of ​​5,000 m2, over 15,000 Autostore boxes and 25 employees.",E-commerce,0.415,Procurement,0.373,Supply Chains,0.365,Retail,0.331,Sales & CRM,0.318
21625,3rd-Eye-Studios,collection technology movie tv game industry veteran build atmospheric sophisticated game groundbreake technology tool game developer,"Located in Helsinki and Shanghai, 3rd Eye Studios was founded in June 2016 by a group of game industry veterans, who previously worked in senior positions at companies like Remedy Entertainment, Unity Technologies, Bugbear Entertainment, RedLynx and Moon Studios.
",Gaming,0.533,Metaverse,0.363,Developer Tools,0.319,AR/MR/VR,0.314,Entertainment,0.308
126,Joost,major undertaking organization skype founder janus friis attempt perfect iptv joost,"Joost is a p2p on demand video player that offers professional (legal) programming much like on your television, but whenever you want.   The service is free, however, there are video advertisements interspersed between and during programs as well as small type or image ads on the sides of your screen.

 With very heavy backing from media giants CBS and Viacom, Joost looks good to take on competitors [Bablegum](http://crunchbase.com/organization/bablegum) and [Microsoft LiveStation](http://www.techcrunch.com/2007/07/06/first-look-at-livestation-not-much-to-report/).   Currently Joost has content deals with CNN, the NHL and Sony as well as their financiers CBS and Viacom (MTV, Comedy Central etc). They have also [recently](http://www.joost.com/forums/p/2007/08/widget-api/) developed a new Widget API open to third parties to make their own Joost widgets. 

 Unlike many online video platforms, joost does require a download and cannot play video directly from users' browsers.   joost offers a desktop client that allows the user to watch on-demand TV over the internet. In addition, Joost enhances the TV experience by offering interactive tools. For example, users will be able to chat with friends while watching a show. The channels will also have interactive displays where users can discover behind-the-scene content.

 Joost's peer-to-peer technology also lowers the cost of channel owners by reducing the amount of data the servers must stream out. joost only serves some selected users, while the rest of the data is distributed from user to user.  

 Rumor has it that Joost is in talks with hardware manufacturers to [embed](http://www.techcrunch.com/2007/06/15/embedded-joost-will-change-the-market/) its platform into TV set-top boxes. If the move were successful it could change the TV industry substantially.

 Joost is now fully public and open to all.

UPDATE: Joost has recently deactivated it's software client and now streams it's entire catalog via Adobe's Flash Player which is available for Windows, Mac OS X, and Linux.",Communications,0.277,Creator Economy,0.273,Telecoms,0.251,Web3,0.225,Metaverse,0.222
14040,NAVENTIK-GmbH,develop market high precision software solution automobile positioning,PATHINFDER enables diverse sensor systems within the car to execute partially autonomous driving in rural and urban areas at a relevant security level.,Automotive,0.322,Sales & CRM,0.278,Industrial Tech,0.274,Autonomous Driving,0.266,Automation,0.252
24369,3Shape,global leader digital dentistry provide state art intra oral scanning solution software dentist dental laboratory country,,Health Tech,0.294,MedTech,0.284,Business Intelligence,0.276,DeFi,0.239,Future of Work,0.235
22957,3TEMP-AB,3temp ab design develops sell service tool equipment coffee industry high quality segment,"3TEMP AB head office is located in Arvika, Sweden and received knowledge support and investment in 2018 to develop, manufacture and market high-end drip-filter coffee brewer segment worth US$8.4BN per year. 
 The Team today includes people with industry experience and commercial knowledge to elevate this startup to position itself as the dominant player in the drip-filter coffee brewer segment.",Circular Economy,0.373,Retail,0.316,Supply Chains,0.313,Procurement,0.307,Automation,0.302
25192,42Networks,develop sell product system solution triple play fiber premise embed voip solution,They have been on the market with broadband telephony and Fiber-To-The-Home (FTTH) products since 1999 and they are now selling the fourth and fifth generation of products.,Network Infrastructure,0.298,Retail,0.29,Communications,0.256,AdTech,0.251,Telecoms,0.248
22815,46elks,grow number developer globe provide platform tool developer integrate telephony infrastructure application,"In simple words - Voice, SMS and MMS for developers.

 Founded during the spring of 2011 in Uppsala, Sweden.",Telecoms,0.344,Communications,0.342,Mobile,0.326,Health Tech,0.322,Sales & CRM,0.313
25010,4Subsea,4subsea lead provider technology service help operator maintain production subsea oil gas field offshore wind farm,"By combining expert engineering competence, practical experience and a digital service, we ensure the integrity of subsea assets all the way from reservoir to deck.

 The company was founded in 2007 and our clients include all the major oil and gas operators as well as the large suppliers of subsea equipment. 4Subsea delivers solutions on a unique digital platform, aiming to be in the forefront of digitising oil, gas and offshore wind operations worldwide. 
",Telecoms,0.322,Supply Chains,0.295,OceanTech,0.281,Industrial IoT,0.278,Logistics,0.263
24698,A2O,a2o concept process produce sell climate friendly food plant base insect base product,"It is a food manufacturing and processing company. For inquiries, an online inquiry form is available on their website.",Circular Economy,0.319,Carbon Removal,0.234,Food & Beverage,0.231,Climate & Clean Tech,0.211,GreenTech,0.209
25510,A3P-Biomedical,a3p biomedical provide prostate cancer diagnosis treatment,"They specialize in advanced prostate cancer diagnostics. Their main product, Stockholm3, is a clinically and commercially validated blood test for the early detection of aggressive prostate cancer. The test combines protein markers, genetic markers, and clinical data in a proprietary algorithm for the purpose of detecting aggressive prostate cancer at an early stage.",MedTech,0.332,Life Sciences,0.317,Health Tech,0.242,Genomics,0.22,Analytics,0.19
25360,AAC-Microtec,primarily provide space solution system commercial governmental educational customer,"The company develops, manufactures, and sells microelectronics systems and small spacecraft. It offers developments tools, including virtual system integration equipment and JTAG debuggers, as well as flat satellite, OBC lite, µRTU, and nanoRTU development kits. The company also provides 1U and 6U satellite systems and sub-systems; and rapid integration architecture products and space wire avionics, as well as power products, such as µPOL and POL artes.",Space Tech,0.376,Physical Storage,0.334,Transportation,0.309,Telecoms,0.305,Data Centers,0.305
155,Just-Eat,vision takeaway smart way promise consumer restaurant alike,"To consumers Just-Eat provide convenient and easy access to a huge variety of delivery restaurants and order food online, and to restaurants they help improve their business by increasing their exposure and providing new revenue streams. 

 Today Just-Eat is the world's leader in online takeaway ordering. As of early 2012 Just-Eat has activities on four continents and more than 38 000 restaurants on their network, with more than 12 000 in the UK alone. 

 The roots of Just-Eat originate in Denmark where the company launched in 2001 by Founder http://www.crunchbase.com/person/jesper-buch.   After some initial years of boot strapped growth the company slowly started to internationalise, beginning with the UK launch in 2006. The internationalisation of the company gained momentum in 2009 when Just-Eat had their series A investment round and received £10.5 million from Index Ventures. 

 Whilst headquartered in London, UK, Just-Eat operate with significant local teams in all their market countries and consider the energy and quality of Just-Eat's local activities critical to success. 

 In March 2011 a second round of investment saw two leading US venture capitalists, Greylock Partners and Redpoint Ventures, invest £30million. Greylock Partners have previously invested in Facebook, LinkedIn and Wonga. Just-Eat's parent company is Just-Eat Holdings Limited.",Retail,0.24,Sharing Economy,0.231,Circular Economy,0.227,Food & Beverage,0.225,E-commerce,0.216
3602,Nature’s-Fynd,nature fynd food company produce protein microbe discover geothermal spring,"The company's mission is to create foods that both nourish people and the planet. Its revolutionary fermentation technology grows protein using a fraction of the land and water resources required by traditional agriculture.

 Nature’s Fynd was founded in 2012 and is headquartered in Chicago, Illinois.",Food & Beverage,0.195,Carbon Removal,0.181,Climate & Clean Tech,0.18,Gut Microbiome,0.143,GreenTech,0.143
24656,Aalbun-Ltd,aalbun innovation intellectual property startup found disrupt intellectual property space,"Aalbun’s services and tools are powered by a secure, digital platform that acts as a single pane of glass to request and service all your innovation and intellectual property needs. Combined with our fixed-pricing model, our mission is to democratise and simplify the process of innovation and enable innovators to change the world.

 Aalbun is trusted by one of the top five patent filers in the world and was named as one of the top 12 legaltech startups in the UK.",Deep Tech,0.361,Creator Economy,0.274,LegalTech,0.256,DeFi,0.24,PropTech,0.238
2867,Kaptivo,use visual collaboration easier efficient,"With Kaptivo, remote meetings now include live-streamed whiteboard content, with augmented capabilities including automatic note-taking.

 With Kaptivo, remote meetings now include live-streamed whiteboard content, with augmented capabilities including automatic note-taking. Businesses and schools use Kaptivo in conjunction with Zoom, Cisco Webex, Microsoft Teams, Slack and other collaboration tools to improve productivity while keeping content secure.",Productivity,0.375,Future of Work,0.306,Design,0.224,AR/MR/VR,0.207,Metaverse,0.206
24423,Aapiable.io,portal service customer developer partner,"Apiable portal supports multiple heterogeneous API gateways at the same time, allowing one to connect of all of the organization's gateways while only requiring one developer touchpoint. Use its pre-built adaptors to connect your existing API management system (s). Create new API products by combining one or more of APIs to meet a business need.",Sales & CRM,0.314,InsurTech,0.269,LegalTech,0.256,RegTech,0.243,Procurement,0.235
15785,Maniko-Nails,maniko distributor cosmetic item,"They are reimagining nail polish. Their actual nail polish-based nail polish strips have a glossy finish and no chips. Their products are starter kits, manicures, pedicures, accessories, and gifts.",Beauty,0.383,Materials,0.245,Creator Economy,0.223,Sales & CRM,0.203,Fashion,0.198
8,JustPark,park app reinventing parking digital era,"Parking has been difficult for too long, and they’re on a mission to make it easy. Today, they help over 2 million drivers enjoy easy parking - so they can save time, avoid stress and make smarter decisions - and also help some of the biggest names in property to manage their assets more effectively.

 Their 5-star app helps drivers find parking in seconds, with millions of spaces to choose from - providing real-time information on price, availability, restrictions and directions. You can even reserve and pay for a guaranteed space at over 20,000 JustPark locations, and extend your time in seconds via the app - giving you total peace of mind, before and after you’ve parked.

 On the flip side, their award-winning parking technology helps parking owners and operators to drive efficiency, improve experience and increase revenue. From driveways to offices; hotels to hospitals; local authorities to commercial car parks - they offer industry-leading, data-driven solutions that are trusted by the likes of Marriott, Hilton, JLL, BT, Savills and many more.

 By providing intelligent solutions for both sides of the market, and unlocking under-utilised parking space in the process, JustPark is able to offer drivers the best choice of options, confidence in availability, and a frictionless experience - so parking is easy on every journey.

 Winners of the British Parking Awards 2017 and Richard Branson’s #VOOM competition; backed by BMW, Index Ventures (DropBox, Just Eat, Skype) and LocalGlobe (Citymapper, Zoopla); and providing the sector’s most-loved service with 96% customer satisfaction: JustPark is the UK’s favourite parking app, and is leading a £50bn industry into the digital age.",Sharing Economy,0.246,Mobility,0.242,Mobile,0.221,Security,0.212,Transportation,0.206
22116,Aava-Mobile,found team industry expert strong background mobile platform development original design equipment manufacturer,"Aava Mobile open platforms provide the flexibility to OEM's and mobile operators to incorporate their own ID, user interface, content and services. They let OEM's and operators customize their devices easily and differentiate from their competitors.",Design,0.339,Hardware,0.328,Productivity,0.302,Gaming,0.286,Circular Economy,0.27
23702,abeo,abeo focus understanding meet unique need anesthesiologist,"Their goal is to consistently deliver the same level of personal service as when they started business, but with the sophistication required in today's much more complex healthcare environment. They're dedicated to increasing your revenues by using the most sophisticated billing and management technology available.   They want you to spend less time worrying about managing your practice, so you can spend more time enjoying your life.",MedTech,0.338,Healthcare,0.288,Health Tech,0.239,Computer Vision,0.219,Neuro,0.205
