id,name,cb_description,next_sentences,industry1,score1,industry2,score2,industry3,score3,industry4,score4,industry5,score5
7462,Caraway-Therapeutics,rheostat mission invent novel treatment neurodegenerative disease modulation mitophagy autophagy,"They believe that the degradation of toxic cellular components, whether they are damaged organelles or aggregated proteins, is a fundamental node of biology.   Mutations that impair these clearance pathways cause multiple neurodegenerative diseases, many of which are associated with cognitive impairment. They aim to leverage our understanding of these critical pathways to discover and develop novel small molecules that will restore cellular balance and treat neurodegenerative and rare diseases.",Psychedelics,0.248,Longevity,0.19,Genomics,0.161,Generative AI,0.159,BioTech,0.144
7454,Nitrase-Therapeutics,nitrase therapeutic platform company develop drug newly identify class enzyme call initially target parkinson disease,"The therapies that Nitrome is developing will target these enzymes and potentially help slow or halt the progression of diseases such as Parkinson’s. While the initial focus is on Parkinson's disease, the company aims to expand its proprietary platform to include other disease indications.",Psychedelics,0.353,Life Sciences,0.273,BioTech,0.241,Genomics,0.224,Longevity,0.206
67,Skyport-Systems,system develop ensure security mission critical corporate asset tight integration compute security virtualization policy management,"Skyport’s SkySecure System is an engineered hardware, software and service stack. It operates as a single turn-key system inclusive of all necessary software and hardware and provides continuous protection and integrity verification for application workloads and their underlying hardware and software.",Cloud Computing,0.416,Data Centers,0.394,Cybersecurity,0.391,Cloud Infrastructure,0.367,Cloud Ops,0.342
8453,Knock-Knock,knock knock developer frictionless game technology,"We are a passionate team of game makers who believe that rapidly-developing frictionless technologies such as HTML5 and 5G will be a force of change in the gaming industry - leading to more viral user acquisition and new, instant social gameplay mechanics created by bypassing traditional app stores.

 Knock Knock is headquartered in San Francisco with a studio in Toronto. The team was founded by folks from Zynga, Jam City, Glu Mobile, N3twork, and MZ.

 We’ve raised a total of $6 million in funding, with March Capital Partners leading the Series A in August of 2019. Investors also include games specialists London Venture Partners, Raine Ventures, and Ludlow Ventures. 

 Development is extremely fast-paced, independent and agile. Instead of shipping new products in years, we're doing it in weeks or months, and pushing features faster than ever with maximum autonomy to contributors. Even though these games are lighter, and developed faster, we are thoughtful about the systems and polish of our games to ensure we reach our goal: maximize player retention and virality.

 Our Values: 
- Stay small, and move fast.
- Be weird.
- Grow and learn by shipping.
 - Learn from mistakes, and don't get sad about failure.
 - Minimize BS, and focus on building great games.",Gaming,0.258,3D Printing,0.232,Semiconductors,0.218,Metaverse,0.211,Developer Tools,0.191
24222,Custimy.io,accessible in- platform software small medium sized company,"Custimy.io - the acronym of customers and customization is the captivation of what we are! In the time of digitalization, we believe there is a need for innovation. 

 We have therefore embarked the journey of creating the most Accessible Customer Data Platform for small and medium-sized B2C businesses. 

 With Custimy.io Expro 1.0 you can automatically collect, consolidate, validate, and analyze all your customer and product data from multiple channels (CMS, Email, analytics, customer service & social medias) - so YOU can ensure, that you never send a meaningless newsletter, product recommendation, campaign or email again. 

 With Custimy.io you can empower your business vertically across both your product, marketing, sales and customer service team, and hyper-personalize your product offering based on your customers behavioural attributes such as pricing preferences, preferred communication and preferred products. This will give you the tool to drive longer CLV, higher customer attraction & retention by giving your existing and new/future customers the best, most relevant, and precise service and product recommendation in real-time.

 In this modern digital age, we have a clear mission and purpose of empowering SMBs and minimize the competitive gap between SMBs and Enterprises. We believe that SMBs have been forgotten in the technological evolution and there is a lack of solutions for them to enable, consolidate, analyse and unify all their customer and product data in one place, secure, compliant and actionable!

 With Custimy.io we take the hurdle and burden of time, development, resources, IT and complexity on our shoulders and out of the equation and deliver it in an all-in-one Customer Data platform Software at a cost-friendly level.",Platforms,0.456,Sharing Economy,0.397,Cloud Computing,0.385,API-First,0.339,Cloud Infrastructure,0.336
68,Scale-AI,scale accelerate development application help machine learn team generate high quality ground truth datum,"Our advanced LiDAR, video, and image annotation APIs allow self-driving, drone, and robotics teams at companies like Lyft, OpenAI, Zoox, Pinterest, and Airbnb focus on building differentiated models vs. labeling data.",Developer Tools,0.282,Generative AI,0.263,Productivity,0.261,Manufacturing,0.245,Cloud Ops,0.24
15612,Logistikbude,web base software automate load carrier management,It is independent of load carrier types and addresses both the tracking of own load carriers and the management of exchange processes in open pools.,Telecoms,0.304,Network Infrastructure,0.276,Physical Storage,0.272,Communications,0.268,AdTech,0.261
70,Humu,human resource company leverage science machine learning,"Its technology builds applies the findings of decades of research to help anyone grow into a better leader, manager, or teammate.

 The company was founded in 2017 and is headquartered in Mountain View, California, United States.",Human Resources,0.416,RegTech,0.405,Analytics,0.389,Future of Work,0.365,Computer Vision,0.355
24018,Cyberlightning-Ltd.,cyberlightning generation control monitoring solution internet thing iot network context,"At the moment we are developing real world and virtual world integration for European Union’s service portfolio and also at the same time enabling IoT networks to be controllable via mobile devices. Our future proof, open source and open standards based Internet technology solutions enable efficient big data manipulation in auto-generated 3D models with no vendor lock-in. 

 Cyberlightning’s new CyberVille™ solution is mainly aimed at Energy Sector system integrators, utilities and solution providers with empowering features for operations in logistics, power plants, smart grid and home area applications – Though our technology is also horizontally scalable through other IoT/big data verticals, such as traffic, infrastructure and health.",Connected Home,0.306,IoT,0.296,Connected Life,0.27,Industrial IoT,0.254,Security,0.246
1359,Coupl,fintech business goal raise generation financially savvy couple,Coupl features a special type of card for couples. Keep track of all of your joint costs.,Economic Empowerment,0.373,FinTech,0.339,DeFi,0.252,Payments,0.251,Future of Work,0.226
24857,Cydan,orphan drug accelerator identify de risk compound therapeutic commercial potential,"Their rigorous process generates data to support a development path and new company formation. Cydan’s experienced and globally networked team brings strong relationships with academia and patient advocacy, deep expertise in drug development, and a track record of successful product commercialization.",Psychedelics,0.279,Life Sciences,0.244,Longevity,0.211,BioTech,0.208,Healthcare,0.177
24336,Cyviz,global provider high performance visualization collaboration command control system meeting room,"The company was founded in 1992 and is based in Stavanger, Norway. It also has regional offices in Houston, Washington D.C., Dubai, Riyadh, Beijing, and Singapore.",Productivity,0.375,Communications,0.287,API-First,0.256,Business Intelligence,0.233,Future of Work,0.232
25411,Dafo-Brand,fire safety company,"The company is considered as one of the Nordic region's largest suppliers of fire protection and rescue equipment. It is at the forefront of technology and can offer the optimal solution for every customer, big and small. 

 Since its beginnings back in 1919, Dafo Brand has developed into a modern, high-tech company. Its fire suppression systems are used world wide and are installed on the assembly line by many of the worlds leading manufacturers.",Security,0.351,Industrial Tech,0.313,Physical Storage,0.261,Food & Beverage,0.258,Cybersecurity,0.226
13743,Authentic-Vision,authentic well know provide new innovative way brand protection,The company holds several patents and is cooperating closely with universities and the world’s leading security printing companies to stay abreast of the latest developments in the fields of brand/value protection and costumer communication solutions.,Beauty,0.282,Cybersecurity,0.245,Fashion,0.232,Security,0.198,Payments,0.193
13202,Open-Bionics,open bionics multi grip bionic arm people upper limb difference,"Open Bionics mission is to make the most advanced bionic technology more accessible to the people that need it. The Hero Arm is the lightest bionic arm on the market, and the only one with a ventilated, adjustable socket and removable aesthetic covers. Wearers have a choice of the design aesthetic, including the official Disney Frozen, Iron Man, R2D2 and BB8 designs.",Healthcare,0.195,MedTech,0.194,Future of Work,0.181,Hardware,0.161,Robotics,0.157
7584,FeeLYX,feelyx provide ai financial datum analysis software lender investor,"By partnering with us, they help them to reduce the time and cost for them to complete their financial due diligence, manage their credit risk, and make more informed business decisions.",FinTech,0.408,Analytics,0.365,RegTech,0.354,Business Intelligence,0.344,Platforms,0.314
3599,Hexagon-Bio,datum drive biotech develop target small molecule therapeutic,Our proprietary platform combines data science and synthetic biology to discover and engineer drugs from DNA sequences. We are mining fungal genomes for inspiration for the next generation of targeted therapies for diseases with unmet needs.,BioTech,0.262,Life Sciences,0.237,Nano,0.214,Psychedelics,0.192,Genomics,0.182
22791,DanAds,white label self serve ad desk publisher small medium advertiser,"The Ad-desk plugs straight into a publishers own ad server, CRM, and payment systems. When the company partners with a publisher, it inputs the branding, advertising inventory, and pricing structure, to create a live self-service Ad-desk within only a few weeks. The company's main client base consists of global enterprise publishers and brands, with customers such as Bloomberg Media, Tripadvisor, Hearst, Expedia Group, Klarna, Freestar, and Philips. DanAds was founded in 2013, based on the belief that transparency between advertisers and publishers is necessary to increase engagement, revenue, and future scalability.",AdTech,0.313,Media,0.207,Creator Economy,0.203,Platforms,0.157,Sharing Economy,0.151
22584,Data-Gumbo,mission empower enterprise business network transact securely efficiently transparently,"Data Gumbo provides the industry’s only smart contract platform enabling organizations, their customers, suppliers, and vendors to successfully incorporate real-time sensor level and field data to validate and automate transactions—eliminating payment delays, disputes, and complicated reconciliations. Subscribers are able to increase operational efficiencies, accountability, transparency, contract, and cash flow certainty.

 Data Gumbo’s smart contract platform provides a unique combination of state-of-the-art distributed ledger technology, real-time IoT sensor data, and applications with APIs to eliminate the need for countless audits. This reduces friction to deliver streamlined operations and transactional certainty while maintaining security controls to protect our customers and their network. Created specifically for enterprises, Data Gumbo’s smart contract platform reinvents the way companies transact.

 Data Gumbo is a venture-backed organization that serves clients globally, across multiple industries. Learn more at www.datagumbo.com.",Network Infrastructure,0.318,Blockchain,0.288,Cloud Ops,0.28,Payments,0.259,Cloud Computing,0.258
7616,TechMet,private industrial company building project secure supply key metal critical future growth evs,"TechMet currently holds interests in both production and development assets in Africa, North America, and South America.",Electrification,0.378,Energy Efficiency,0.329,Automotive,0.275,Energy Storage,0.27,Cybersecurity,0.258
15244,Valence-Security,security company offer collaborative remediation workflow engage business user contextualize reduce saas datum sharing supply chain identity misconfiguration risk scalable policy enforcement automate workflow,"With Valence, security teams can secure their critical SaaS applications like Microsoft 365, Google Workspace, Salesforce, and Slack and ensure continuous compliance with internal policies, industry standards and regulations, without impeding business productivity or the speed of SaaS adoption.",Cybersecurity,0.42,Physical Storage,0.38,Productivity,0.373,InfoSec,0.343,Procurement,0.338
7656,Lavastorm,lavastorm power enterprise grade business application agile analytic help business gain competitive advantage unlock potential datum,"It’s collaborative solution empowers businesses to quickly, easily and accurately build analytical applications at scale, across multiple, disparate data sources. Lavastorm is the only solution that combines data preparation with robust analytics for augmenting data-centric applications with integrated automation and governance. This innovative approach enables IT, data experts and business-process-owners to extract, prepare, and analyze data from disparate sources and deliver these applications to end users",Sales & CRM,0.371,Business Intelligence,0.363,Productivity,0.357,Analytics,0.355,Human Resources,0.346
23589,Dawn-Health,dawn health digital health company offer life change digital health therapy drive improve patient outcome pill,"The company is enabling to design, develop, and service medical device software. They help people live better and longer lives through technology and aim to accelerate digital health globally through strategic consulting and  the development of innovative digital health products together with their partners. As MedTech specialists, they create life-changing solutions with a strategic focus on digital health, SaMD, GxP software, and IoT within healthcare. 

 Dawn Health envisions a time where digital health solutions will revolutionize how people worldwide achieve higher standards of health, and access services to promote and protect their health and well-being. The company has a global ambition to be the preferred Digital Health Partner to the life science industry, and through their partnerships and ventures, to impact one million lives by 2030 through digital interventions.",Health Tech,0.414,MedTech,0.292,Healthcare,0.285,Longevity,0.255,Psychedelics,0.248
24562,Dazzboard,universal medium manager web application connect mobile device pc web manage medium open support portable device mobile phone mp3 medium player,"with dazzboard you can download YouTube videos and Flickr pictures to a mobile phone, upload photos and videos to Facebook 
- connect your portable device to your favourite services",Communications,0.436,Telecoms,0.369,Video/Audio,0.313,Sharing Economy,0.302,5G Networks,0.286
25625,DB-Pro,specialized sql server datum platform streamline enterprise datum management,"Its service offering covers diagnostics, audits, optimization, planning and migration projects as well as continuous DBA services. Its powerful Governor DBA software provides a great asset for holistic diagnostics, monitoring and optimization of Microsoft SQL Server environments.",Data Management,0.401,Big Data,0.325,Data Infrastructure,0.309,Data Storage,0.297,Business Intelligence,0.274
23851,DbVis-Software,dbvis software found,"It is a privately held company dedicated to developing and selling platform-independent tools for database administration and development.

 The core product – DbVisualizer – with more than 3 million downloads of its two flavors: the commercial DbVisualizer Personal edition and the DbVisualizer Free edition. More than 18,500 customer organizations in 123 countries have purchased the commercial version, some opting for the Premium Support level.

 DbVisualizer is a global word-of-mouth success, supported by the quality software with an intuitive user-friendly interface. Staying true to its original objectives, DbVisualizer is still a highly focused software product, not bloated with unneeded functions. New features are only added after feedback from the user community indicates a need.

 Support is offered as a quick and precise service and is performed by the same team that develops the product.

 DbVisualizer is in part built on open source software, and we are giving back to the community thru the free version of DbVisualizer, as well as with educational discounts.",Big Data,0.253,Data Infrastructure,0.249,Data Management,0.238,Data Storage,0.222,Business Intelligence,0.216
737,Digital-Asset,develop distribute ledger technology intend build distribute encrypt straight processing tool,"The company builds platform, developer tools, and leverages modern infrastructure providers to change how businesses interact. Its service offering is Daml, an application platform unconstrained by organizational boundaries where companies can create new multi-party solutions that transform disparate silos into synchronized networks, eradicating latency and errors by guaranteeing consistent data. The company works with organizations in financial services, healthcare, and insurance, including 5 of the top 10 stock exchanges.

 In 2014, the New York, New York-based company was established by Don Wilson, Eric Saraniecki, Sunil Hirani, and Yuval Rooz. Digital Asset is backed by strategic investors, including 7RIDGE, Eldridge, Salesforce, Samsung, VMware, Accenture, Citi, Goldman Sachs, IBM, and J.P. Morgan.",Blockchain,0.457,Payments,0.383,Crypto,0.362,Physical Storage,0.346,DeFi,0.34
17282,Micaton-Ergonomics,company establish aim develop manufacturing commercialization low cost solution high technologic component innovation everyday domestic fixing job easier,Their aim is to provide the market with quality tested products through an extensive commercial net of self-produced as well as worldwide remarkable partners. That will allows us to be present in more than 100 countries in less than 100 days.,Manufacturing,0.464,3D Printing,0.46,Industrial IoT,0.4,Retail,0.394,Productivity,0.377
24844,DBV-Technologies,global clinical stage biopharmaceutical company found pediatrician entrepreneur believe food allergy day treat safely effectively,"With this mission driving their commitment to the advancement of treatments in this field, they are investigating a potential new class of immunotherapy that aims to activate the immune system of patients through the skin.",Nutrition,0.286,Food & Beverage,0.25,Gut Microbiome,0.201,Healthcare,0.194,FamilyTech,0.185
7698,Rotageek,rotageek help organisation predict meet demand complex datum drive technology effectively fairly schedule staff,"They use personalised algorithms and machine learning to find patterns that would otherwise go unnoticed - providing best in class and fully personalised business forecasting and scheduling. 

 Today, Rotageek lives in London and Melbourne and their clients include O2, Dune, William Hill, Maplin and The Perfume Shop to name just a few. They’re growing really quickly but their approach and their ambitions remain personal, and they always will. Their goal is to create a step change in scheduling capabilities using data-driven, highly intelligent technology that is agile and works both for business and people.",Productivity,0.316,Industrial IoT,0.303,Human Resources,0.286,Future of Work,0.285,Business Intelligence,0.272
21666,DealDash,dealdash found recognize business model customer service,"In 2013, DealDash won the Ernst & Young Entrepreneur of the Year Award. In 2021, DealDash won the Best Excess Inventory Liquidation Service Award from Global Brand Awards.

 Now serving more than 20 million registered shoppers, DealDash has become the most trusted bidding fee auction site on the internet, selling brand new premium products and helping businesses move their excess inventory.

 DealDash forms mutually beneficial partnerships with name brands and wholesalers, promoting products while selling outside the constraints of traditional discount distribution.

 DealDash is able to offer great deals on quality products because of its longstanding relationships with suppliers, producers, and customers. A growing network of suppliers throughout the country — and around the world — prefer working with DealDash to liquidate their products from their overstocked warehouses.

 Once DealDash receives those brand new products, they are auctioned off in fast-paced, no-reserve online auctions. These uniquely designed auctions help customers save 90 percent or more on their purchases.

 DealDash has a dynamic and growing team of 50 passionate people dedicated to providing first-class customer experience as the company continues to grow.",Sales & CRM,0.27,Procurement,0.227,E-commerce,0.221,Physical Storage,0.213,Logistics,0.187
25226,Debricked,debricke help software company minimize risk open source product development,"About 90% of companies that develop software use Open Source, but mitigating risks such as vulnerabilities is a costly and time consuming task which is often overlooked. Debricked's tool enables for increased use of Open Source while keeping the risks at bay, making it possible to keep a high development speed while still staying secure. The service runs on state of the art machine learning which allows for the data quality to be outstanding as well as instantly updated whenever a new vulnerability is discovered. High precision in combination with flawless UX and unique abilities to customize the service to your company's needs makes Debricked one of a kind in the world of Open Source Security.",Developer Tools,0.331,Platforms,0.273,3D Printing,0.266,Productivity,0.25,Sharing Economy,0.245
21315,Denator,denator develop market product stabilize biological tissue fluid moment sample,"Utilizing a patent-pending technology to instantly and completely stop the degradation process and maintain sample stability thereafter, Denator aims to become the leading supplier of instruments and consumables that enable scientists to stabilize biological tissues and fluids at the moment of sampling thereby enhancing the quality and value of subsequent analytical results.",Procurement,0.164,AdTech,0.151,Life Sciences,0.15,Longevity,0.145,RegTech,0.14
