,id,name,cb_description,industry
0,1820,0xKYC,modular knowledge system identity credential management reimagine create knowledge proof zkps prove ofac sanction year age know fraud wallet list,cloud infrastructure
1,3640,10X-Genomics,genomic create revolutionary dna sequence technology help researcher well identify subtle variation overlook technology shre biological sample tiny fragment sequence short stretch computer assemble genome,genomics
2,9594,111Skin,commit positive luxury skincare push boundary technological change establish sustainable philanthropic female lead future skincare addition source ethical material cut edge ingredient,social impact
3,473,1stdibs,internet company offer marketplace rare desirable object furniture fashion fine art jewelry feature online base platform connect respected dealer maker sophisticated collector share pursuit beautiful design,developer tools
4,7956,1v1Me,application allow user play match favorite video game cash community meet play member company found base new york,developer tools
5,9457,21sportsgroup,online sport good retailer offer selection running shoe bicycle apparel accessory amateur athlete runner cyclist triathlete right professional athlete market range sporting good mainly area outdoor action run cycling triathlon sport combine e commerce retail business reduce gap online offline retail service product company available immediate shipping found jrg mayer based mannheim baden wurttemberg,data centers
6,917,24Symbols,solution read digital book read device internet connection allow read read device internet conection ereader smartphone ipad laptop,cloud infrastructure
7,5470,2GIS,international technology company develop service comfortable life city mission help people live city expensive company russian internet accord forbes main product company city information service bring map navigator business directory monthly active user service cover city country available free mobile application io android,developer tools
8,5958,352-Medical-Group,local organisation trust healthcare professional clinic hospital provide excellence choice diagnosis education treatment health need mission world class provider healthcare solution put patient forefront aim group preferred choice patient healthcare professional,sport & wellness
9,4004,365-Response,response unique software service organisation different create solution directly respond specific challenge collaborate client multiple sector understand detailed requirement identify gap accordingly implement solution response team unique combination fast pace innovative approach establish system unparalleled industry experience proud solution help client achieve improved service level significant cost saving,cloud infrastructure
10,5635,365Scores,cross platform application enable user create personalized sport channel individual live score news form media channel video highlight statistic fixture standing tweet cover major sport platform available language,developer tools
11,4797,3Box,storage simple secure private design app store data user lighter trustworthy enjoy reduce datum management liability,cloud infrastructure
12,8364,3D-Robotics,make advanced drone technology easily accessible construction mining surveying industry use datum analysis help user land mapping site scan service collect accurate aerial datum jobsite turn urn drone photo map model point cloud provide comprehensive onboarde ongoing support enable client batter informed decision relate construction site found headquartered berkeley california,developer tools
13,3918,3sun-Group,limited subsidiary provide hydraulic control instrumentation product service oil gas sector worldwide furthermore offer skilled technician installation servicing wind turbine offshore application onsite testing inspection service oil gas renewable asset technical vocational training service united kingdom europe limited found base great yarmouth united kingdom,industrial iot
14,1767,40-Partners-Ltd,produce talent broadcaster brand short form feature length studio go bit different hopefully game changer talent stay touch course year,connected life
15,1351,42Lab,modular portable affordable biotech laboratory student science technology engineering mathematic stem education require oecd country school struggle introduce biotechnology student high equipment cost troublesome experiment preparation solve problem provide portable modular biotech equipment student conduct experiment companion app serve electronic manual student management tool teacher vision bring biotech experience student like raspberry pi computer science,developer tools
16,8307,4-Antibody-AG,antibody ag develop human antibody drug discovery platform generate antibody therapeutic focus immuno oncology technology platform retrocyte display design generate therapeutic antibody drug candidate incorporate human antibody library express mammalian b lineage lymphocyte company develop preclinical checkpoint antibody program target gitr antibody ag found base basel switzerland,industrial iot
17,6524,5Mins,s gamified learn platform design help employee improve skill curate short form video content lead creator world make available team business adaptive gamifie learn engine,developer tools
18,1504,7bridges,smart logistic platform deliver visibility control logistic process unify data operation enable access global supplier ecosystem world class sustainable logistic operation rapidly achievable reality platform realize future proof sustainable logistic scalable competitive profit growth drive edge,cloud infrastructure
19,4084,7digital,global leader end end digital music solution core business provision robust scalable technical infrastructure extensive global music right create music streaming radio service diverse range customer include consumer brand mobile carrier broadcaster automotive system record label retailer offer radio production music curation service editorial strategy content management expertise,cloud infrastructure
20,432,7TM-Pharma,pharma biotech company discover develop drug primary therapeutic focus diabetes gastrointestinal metabolic asthma vascular disease company offer transmembrane span receptor include small molecule receptor antagonist npy selective agonist gastrointestinal disorder short bowel syndrome antagonist oral drug inflammatory respiratory disease pharma found base lyngby hovedstaden,industrial iot
21,3403,8fit,app help build healthy habit life simple solution support user worldwide individual journey healthier happy life push progress perfection choose good solution quick fix enjoy journey healthiest mind body understand obstacle people face fitness journey not easy s size fit way find lifelong health s building engage approachable way people achieve personal fitness goal,connected life
22,28,8tracks-Radio,internet radio social network streams user curate song playlist contain track handcraft internet radio network social alternative pandora listener tune online mixtape track curate people know love music stream legal radio style manner,developer tools
23,1382,AarogyaAI,aarogyaai artificial intelligence base software service diagnose drug resistant tuberculosis aarogyaai use dna sequence patient upload machine learn algorithm give output report comprehensive drug susceptibility status patient,industrial iot
24,5266,Abacum,abacum saas help finance team deliver business insight abacum collaborative workflow planning platform smb finance team boost productivity strategic impact company believe empower people good collaborative tool multiply strategic impact organization fulfil,cloud infrastructure
25,258,Abacus.AI,abacus ai artificial intelligence research cloud service company help organization design train operationalize machine deep learning model allow organization plug play deep learning system exist customer experience business process company found base san francisco california,cloud infrastructure
26,3853,Abacus-e-Media,abacus e medium bring digital expertise industry specialist creative thinking design build website work believe develop technical solution forge commercial objective business brand strategy produce interactive engage user experience,cloud infrastructure
27,6113,ABA-English,aba english lead digital academy english learning student worldwide headquartered barcelona talented team compose professional country aba english stand unique methodology combine technology pedagogy interaction real teacher mission guide student learn journey empower effective tool achieve goal quickly efficiently aba english recognize good educational app reimagine education award feature apple google educational app,developer tools
28,10663,ABAX,abax developer supplier car logbook car tracker system fleet control software equipment control technology business operate company vehicle product world lead respective field help numerous customer reduce overall fuel spend company vehicle eliminate risk tax penalty,sales & crm
29,6511,Abcodia,abcodia biotechnology company focus discovery validation biomarker cancer screen unique longitudinal serum biobank partnerships ucl technology platform provider lead commercial diagnostic company abcodia able support end end diagnostic development process abcodia found base cambridge uk,climate tech/cleantech
30,9786,Abhi,abhi financial wellness platform provide employee salary advance base accrue wage abhi salary advance app plan change game people spend money allow user withdraw portion accrue salary bank account help employer reduce workload hr finance department facilitate employee need abhi found base pakistan,developer tools
31,3255,ABK-Biomedical,abk biomedical combine clinical market biomaterial specialize improve treatment option patient hypervascular tumor company dedicated transform interventional radiology procedure call embolization,industrial iot
32,5750,Ablynx,ablynx biopharmaceutical company engage discovery development nanobodie novel class therapeutic protein base single domain antibody fragment range human disease include inflammation haematology oncology pulmonary disease today company approximately project pipeline nanobodie clinical development,industrial iot
33,3527,Abogen-Biosciences,abogen bioscience discovery stage biotechnology company focus develop nucleic acid base rna dna therapeutic treatment cancer infectious disease,genomics
34,7990,Abokado,abokado own operate chain food bar restaurant united kingdom offer sushi wraps breakfast juice smoothie drink cake fruit salad soup stir fry asian food abokado supply lunch company mark lilley wife lindsey found headquarters london united kingdom,data centers
35,3174,AbsolutData,absolutdata consulting orient analytic research firm number fortune client wide variety industry country navik ai platform enterprise blend ai technology datum analytic serve intelligence layer forward think company,cloud infrastructure
36,3436,Acacia-Pharma,acacia pharma pharmaceutical company discover develop supportive care drug company focus cancer supportive care product include injectable formulation oral drug use nausea vomiting use cancer cachexia intravenous formulation use prevention treatment nausea vomiting company concentrate discovery effort cancer relate fatigue cancer cachexia xerostomia acacia pharma incorporate base cambridge united kingdom,industrial iot
37,4672,ACAL-Energy,acal energy developer fuel cell system module consumable chemical range use include stationary residential automotive application require large kw power innovative design deliver substantial cost saving fuel cell system performance improvement pem proton exchange membrane accelerate adoption pem fuel cell technology key market,industrial iot
38,739,Accelerated-Payments,accelerated payment enable sme expand grow allow advance cash specific individual invoice accelerate payment create entrepreneur year experience financial service start run business,cloud infrastructure
39,4924,AccelerComm,accelercomm exciting semiconductor ip core company provide solution accelerate generation wireless communication rel rel technology solve bottleneck limit speed generation wireless communication error correction decode required overcome effect noise interference poor signal strength,industrial iot
40,6388,Access-Bank,access bank provide banking product service individual business customer ghana offer standard saving current access advantage solo premier account company provide online banking service include atm online access point sale terminal service bill payment western union money transfer service,cloud infrastructure
41,6483,AccessFintech,accessfintech offer risk management service bank buyside firm track trade lifecycle help firm track trade lifecycle true sense prioritize risk increase number system access fintech bring fintech providers house technology orchestrate interaction distribute provider create single visual display risk financial transaction global sharable view,cloud infrastructure
42,10138,Access-Intelligence,access intelligence b b medium information company headquarter rockville serve energy defense healthcare management chemical satellite aviation cable medium public relation market,data infrastructure
43,3427,Accuri-Cytometers,accuri cytometer found address compelling need life scientist love rapid cell cell analysis capability flow cytometer flow cytometer lab barrier researcher include cost instrument complexity software effort require maintenance large bench space require instrument result company look develop affordable robust cytometer,industrial iot
44,10601,Accutrainee,accutrainee found run solicitor understand legal industry challenge deliver legal service client critical need commercial approach whilst stay sensitive partnership ethos profession understand trainee process having experience hand,social impact
45,8817,AccuVein,accuvein specialize vein visualization technology flagship product hand hold non contact vein illumination solution allow healthcare professional map peripheral vein skin surface goal access avoid vein build proprietary technology embody grow patent portfolio cover broad range image medical diagnostic technology company found headquartered medford new york,developer tools
46,7247,Acea-Health,acea health digital healthcare company develop application call flynote new digital consent platform flynote analyse number factor include patient background deliver personalise risk benefit flynote aim solution consent healthcare,cloud infrastructure
47,6553,Acesion-Pharma,acesion pharma developer medical drug design treatment atrial fibrillation company medical drug develop treatment atrial fibrillation common type cardiac arrhythmia follow concept inhibit type ion channel heart cell involve generate electrical signal regulate heart rhythm provide consumer chronic treatment prevent recurrence af maintain normal heart rhythm,industrial iot
48,6532,Achilles-Therapeutics,achille therapeutic developer immunotherapy intend offer generation patient specific therapy treat cancer company immunotherapie harness immune system destroy cancer cell target truncal tumor neo antigen flag immune system present surface cancer cell enable scientist target destroy tumor harm healthy tissue,industrial iot
49,7485,Achillion-Pharmaceuticals,achillion drive transform live patient family affect disease complement system integral innate immune system scientific clinical evidence implicate complement system specifically complement alternative pathway ap numerous devastating disease condition principal focus achillion advance clinical stage portfolio orally administer factor d inhibitor late stage development potential commercialization patient devastating disorder complement system,industrial iot
50,10086,Acousticeye,acousticeye establish tal pechter noam amir bring acoustic technology ndt non destructive testing industry company develop manufacturer market mobile embed tube inspection device acousticeye patent pende technology offer accurate rapid single point inspection inaccessible tube company dolphin system unique ability quickly find accurately locate defect complex tube system regardless material need physically traverse probe tube,industrial iot
51,10194,Acre,acre rebuild uks mortgage market ground vertically integrate mortgage stack new end end platform broker lender,sales & crm
52,4981,AcreTrader,acretrader agricultural real estate invest platform help buyer buy share farmland online platform acretrader provide transparency flexibility ease use people want invest farmland handling aspect administration property management insurance account work local farmer improve soil sustainability company found headquartered fayetteville arkansas,cloud infrastructure
53,3893,ACS-Clothing,acs provider men hirewear lead retailer uk ireland wtih extensive range formalwear highlandwear provide outfits wearer year range garment available hire found company grow year proud supply large menswear retailer uk,industrial iot
54,7159,Actionality,actionality offer mobile marketing technology solution company adflextm platform enable user develop mobile commercial standardized format campaign logic support update rotation modification interaction reporting serve advertiser mobile operator content providers asia europe company found base munich germany sale office berlin germany hong kong hong kong july actionality subsidiary yahoo,developer tools
55,3073,Actronika,actronika build haptic platform enable seamless system integration actronika leader haptics technology provide cut edge vibrotactile module integrate client system actronika develop human machine interface solution patent haptic technology human bear touch order form relationship learn engaged environment face digitize world mission engage people tangible material experience hardware software possible,cloud infrastructure
56,20,Acutus-Medical,acutus medical develop medical technology treat complex cardiac arrhythmia company platform display heart true activation pattern turn chaos complex arrhythmia clear vision electrophysiologists acutus medical privately fund company found base carlsbad california products co develop europe exceptional team medical scientist biomedical engineer professional found headquartered carlsbad california,developer tools
57,1262,Adaface,adaface build conversational ai ada round tech interview candidate love interview turn ada analyse candidates think process timely hint ask follow question accurately gauge skill ada shortlist qualified candidate role company invest time engage candidate,developer tools
58,3279,Adagene,adagene clinical stage biotech company specialize develop immuno oncology antibodie novel epitope proprietary smart antibody technology increase success rate substantially accelerate time market reduce cost associate develop therapeutic antibody,industrial iot
59,321,Adallom,found cyber defense veteran adallom gartner cool vendor cloud access security broker deliver visibility governance protection cloud application innovative platform simple deploy seamless user available saas base prem solution power smartengine advanced heuristic back elite cybersecurity research team adallom make easy protect data cloud adallom abbreviation hebrew say ad halom literally mean line defense information visit follow,developer tools
60,5787,Adaptate-Biotherapeutics,adaptate biotherapeutic company develop antibody modulate gamma delta t cells situ company found adrian hayday headquartered london,genomics
61,9851,ADC-Biotechnology,adc bio develop new process technology help drug developer meet conjugation process challenge test production new antibody drug conjugate anti cancer drug technology signal fast simple costly development exciting new family drug,industrial iot
62,10620,ADC-Therapeutics,adc therapeutic clinical stage oncology drug discovery development company focus advance highly potent target antibody drug conjugate adcs treatment hematological cancer solid tumor adcs develop late generation pyrrolobenzodiazepine pbd dimer technology provide superior therapeutic index compare generation pbd adcs preclinical study pbd dimer potent toxin actively kill cancer cell differentiate mechanism action warhead commonly adcs,industrial iot
63,5062,Addition-Wealth,addition wealth holistic financial wellness platform empower employee smart informed financial decision take tech forward approach combine digital tool online event expert content access financial professional addition make personalized financial expertise inclusive accessible employee addition partner forward think employer help employee money,cloud infrastructure
64,3020,Adepto,adepto pioneering way company view manage entire workforce ve create total talent ecosystem bring internal external worker place point solution complete solution start brisbane australia global operation tribe hard work dedicated diverse mind passionate create solution organisation people centre,cloud infrastructure
65,3863,Adept-Technology-Group,adept technology group plc provider communication solution adept unite communication innovation use technology bring idea solution business help succeed simply deliver product service help business grow competitive increase profitability improve way communicate customer employee,cloud infrastructure
66,3957,Adestra,adestra empower client maximize marketing roi email drive technology year flexible account structure obsession customer success award win service gain trust global enterprise grow brand alike found principle marketing success take technology s customer service heart business software service software service adestra office dallas oxford london sydney boston,sport & wellness
67,5565,Adfenix,adfenix collect sense world real estate datum adfenix platform estate agent empower help consumer journey buy new home offer quality advertising product relate service click button,developer tools
68,5791,Adiana,adiana engage development testing transcervical sterilization system permanent birth control develop complete tcs consist radiofrequency generator delivery catheter implantable matrix company found base redwood city california march adiana subsidiary cytyc,industrial iot
69,6702,Adikteev,adikteev lead app engagement platform performance drive marketer consistently rank appsflyer performance index adikteev help world spend game app publisher increase retention reacquire churn user drive incremental revenue thank measure engagement strategy creative algorithm adikteev serve customer world office emea,cloud infrastructure
70,4175,Adjug,adjug online advertising marketplace connect buyer seller online advertising provide transparency control choice publisher control online inventory increase earning advertiser run well campaign know conversion traffic come adjug found satish jayakumar michael stephanblome idea improve way advertising gets buy sell ad network connect advertiser publisher directly adjug seek europe lead online advertising marketplace,developer tools
71,9546,ADMA-Biologics,adma specialty immune globulin company develop manufacture intend market plasma base biologic target niche patient population treatment prevention certain infectious disease companys target patient population include immune compromise individual suffer underlie immune deficiency disease immune suppress medical reason adma operate adma biocenter fda license source plasma collection facility provide portion blood plasma manufacturing company lead product candidate,industrial iot
72,10703,Adona-Medical,adona medical privately hold portfolio company shifame innovate interventional approach heart failure complex progressive condition impact approximately patient patient globally adona platform overcome shortcoming exist treatment option enable provider improve care heart failure patient,cloud infrastructure
73,6666,Adsum,adsum fintech company proprietary tech identify client tax credit maximize deliver client account hour handle entire reclaim process client focus investment growth adsum headquarter london england found,sales & crm
74,3470,Advance-Intelligence-Group,advance intelligence group ai drive technology company asia pacific found leverage innovative technology partnership build ecosystem product service serve consumer enterprise merchant,cloud infrastructure
75,10212,Advantage-Club,advantage club provide ai drive platform intend drive employee engagement deliver program connect benefit brand organization client employee company intend provide end end solution facilitate meaningful client employee engagement exclusive privilege reward provide brand partner,cloud infrastructure
76,6721,Adviva,adviva operate european online advertising network target brand advertiser behavioural contextual target technology adviva connect advertiser european consumer want reach,sales & crm
77,2430,Advizzo,want use behavioural science enrich people live insight household datum change way people think water gas electricity world preserve natural resource,social impact
78,29,Adyen,adyen operate technology company netherlands brazil singapore united kingdom canada australia south korea hong kong mexico china new zealand malaysia india japan united states offer adyen platform integrate gateway risk management processing acquire settlement payment directly connect merchant visa mastercard payment method sale channel include merchant online mobile point sale channel pieter van der found adyen headquarters amsterdam netherlands,cloud infrastructure
79,7489,AEA-Technology,aea lead energy climate change consultancy deliver visionary integrate environmental solution worldwide assist government evidence base policy development solve environmental challenge improve organisational performance,industrial iot
