,id,name,cb_description,industry
80,10,Aegerion-Pharmaceuticals,aegerion pharmaceutical biopharmaceutical company engage development commercialization therapeutic pharmaceutical treat cardiovascular metabolic disease develop lomitapide microsomal triglyceride transfer protein inhibitor small molecule drug decrease serum lipid include cholesterol triglyceride treat atherosclerosis dyslipidemia obesity pancreatitis company focus product evaluation treatment hyperlipidemia aegerion pharmaceutical incorporate headquartered bridgewater new jersey,industrial iot
81,6768,Aerones,aerone innovative company develop robotic technology wind turbine blade maintenance service company found headquartered san jose california united states,industrial iot
82,9044,Aether-Bio,aether bio developer machine learn technology purpose enzyme order create new compound technology utilize machine learn combine high throughput robotic laboratory create entirely new compound reinvent production previously discover compound enable healthcare institutes chemical material need cheap sustainable company proprietary hardware allow massively parallelize experimentation generating dataset order magnitude large competition,developer tools
83,2215,AFC-Wimbledon,afc wimbledon continuation wimbledon football club long exist franchising league place milton keynes team win fa cup notably rise dead look come home plough lane,data centers
84,754,Africa-Logistic-Properties,africa logistics property alp integrated property investment development property company dedicate modern grade logistic industrial sector africa base nairobi management team include senior property professional year industrial investment experience emerge market alp back global institutional investor,sales & crm
85,780,Afrocenchix,afro haircare market grow fast big player not understand customer problem ve problem customer centric datum drive approach afrocenchix help formulate manufacture sell bottle safe effective product far award win product feature publication vogue indy good list average star review customer getting start,sport & wellness
86,5924,Agar-Scientific,agar lead manufacturer distributor scientific laboratory equipment focus electron microscopy consumable found alan agar company enjoy global recognition provider high quality component excellent customer service,data centers
87,10408,Agilyx,believe time right expand advanced recycling give post use plastic new circular life convert valuable material original building block reuse enable plastic circularity global commercial scale aim play vital role accelerate shift low carbon economy co found cyclyx international waste plastic management company work directly industry participant engineer customize plastic recovery program supply advanced chemical recycling facility,climate tech/cleantech
88,6158,AGNITiO,agnitio worldwide market leader voice i d product agnitio voice i d government organization prevent crime identify criminal provide evidence court agnitio extensive customer base include lead police intelligence military government organization country agnitio voice i d product number lead customer partner contact center financial service telecommunication enterprise security sector,cloud infrastructure
89,4453,AgPlus-diagnostics,agplus diagnostic develop diagnostic platform technology deliver demand market requirement true quantitative poc product use wide range clinical application,cloud infrastructure
90,6875,Agriconomie,agriconomie agtech e commerce company provide farmer variety online tool include purchase support personalize advice information source share input supplier offer datum service advertising software supplier service division company found clment le fournis paolin pascot dinh nguyen,sales & crm
91,9245,AgriWebb,agriwebb software company focus livestock production industry product enable simplified farm data collection analysis improve management efficiency decision make benchmarke transparency integrate horizontal vertical supply chain agriwebbs founder come generation livestock production aim transform livestock industry datum drive decision make build intuitive farm datum recording,developer tools
92,1338,Agrosight,agrosight analytic company help agronomist farm unit integrate new stream unique valuable data decision make process agrosight detect plant disease early hyper spectral signal dramatically reduce cost food production,industrial iot
93,4774,Aidence,aidence rally datum scientist software engineer medical regulatory business professional provide intelligent software lung cancer pathway clinical application veye lung nodule ai solution pulmonary nodule management ct veye run routine practice lung cancer screen programme europe,cloud infrastructure
94,3517,AI-Medical-Service,ai medical service start company develop artificial intelligence bring wisdom japanese endoscopic specialist contribute development endoscopic medical care worldwide,cloud infrastructure
95,1368,AIMLedge,aimledge develop software platform automate development deployment customize deep learning software edge device brand computing ability specialize optimize solution low end commodity camera platform reduce development time solution enable plug play deployment vision democratize cut edge ai iot business industry size,cloud infrastructure
96,3573,AInnovation,ainnovation own operate company offer product service base artificial intelligence different company platform use technology recognition vision computer learn machine process natural language offer advantage efficiency algorithm permit company improve productivity performance enable business enhance efficiency value achieve digital transformation,cloud infrastructure
97,1219,Ai-Palette,ai palette world artificial intelligence platform fmcg product innovation ai palette create win product concept line brand personality exist product portfolio garner insight million digital conversation couple company datum create product concept address unmet need consumer,cloud infrastructure
98,10231,Airex,airex smart ventilation control build intelligent air ventilation unit atmospheric sensor cloud algorithm company develop retrofit smart ventilation control system control airflow air brick owner benefit decrease energy bill warm home enhance thermal comfort healthy home minimal disturbance compromise air quality smart algorithm allow automatic air flow regulation take account local weather air quality datum airex found headquartered london,cloud infrastructure
99,2082,AirPublic,airpublic provide world city citizen dynamic granular representative datum air pollution currently available develop expertise apply iot environmental sensing emerge smart city revolution,climate tech/cleantech
