Unnamed: 0.1,Unnamed: 0,id,name,cb_description,industry1,score1,industry2,score2,industry3,score3
1952,1952,8885,GMP-Orphan,gmp orphan gmpo mission identify develop provide access innovative treatment patient rare disease experience pharmaceutical development commercial team field rare disease critical advance mission,biotech,0.352,longevity,0.348,life sciences,0.258
1953,1953,2098,Gnergy,gnergy provide building owner manager advice software well understand continuously improve energy efficiency building build proprietary software technology assess improve energy efficiency building software analysis building fabric occupancy usage provide depth analysis energy emission cost,infrastructure tech,0.357,climate tech/cleantech,0.353,connected home,0.276
1954,1954,2866,Gnodal,found world class team infrastructure design expert prove track record deliver good breed networking system meet demand customer team experience collaborative spirit work design manufacture deployment lead definition technology revolutionize datum center building large fast efficient scalable technology world high performance datum center,data storage,0.433,future of work,0.398,cloud infrastructure,0.375
1955,1955,3565,Go1,provide platform allow company upscale workforce demand train dynamic content drive platform company open learn funding follow integration enable organization learn directly workplace ecosystem individual find consume share discuss learning resource library online learn resource,future of work,0.417,platforms,0.37,human resources,0.357
1957,1957,4844,GOALS,provider online football game multiplayer football game primarily pc console offer way gamer game digital asset play,esports,0.505,gaming,0.498,platforms,0.263
1959,1959,8832,Goava,found stridsberg late business opportunity fingertip tell company talk talk talk grant publish certificate publisher,analytics,0.305,sharing economy,0.299,social networks,0.269
1960,1960,4160,GoCardless,global leader recur payment global payment network technology platform pain getting pay business recur revenue business worldwide multinational corporation transact business process payment year office france,analytics,0.4,e-commerce,0.375,fintech,0.37
1961,1961,2476,Go-Instore,humanise online commerce experience lead immersive live video technology solution connect staff physical location website customer enable rich online human interaction successfully increase revenue company sector include retail automotive hospitality property help address vast disparity customer experience conversion rate physical digital channel solve key ecommerce challenge convert onsite traffic buy customer,fashion,0.396,platforms,0.381,future of work,0.375
1962,1962,387,Gojimo,brain child bear frustrated lack quality educational app help teacher start quickly success fellow student university form relationship world educational publisher bring premium content like education soon apparent time student whilst run successful company pretty impossible drop university dedicate time company secure back investor include consumer venture fund start amazing founder innocent drink acquire,edtech,0.337,analytics,0.291,familytech,0.276
1963,1963,5443,GoKwik,online platform help people solve difficulty buy experience e commerce website use shopping experience span user journey point place order delivery product found,e-commerce,0.393,platforms,0.364,fashion,0.323
1965,1965,8626,Goldfinch,credit platform offer crypto loan collateral offer capital digital currency expand access capital emerge market offer stable yield lender enable empowerment financial inclusion emerge market company found blake west,fintech,0.51,defi,0.507,professional services,0.419
1967,1967,15,Gong,gong enable revenue team realize full potential unveiling customer reality patent gong revenue intelligence platform capture understand customer interaction deliver insight scale empower revenue team decision base datum instead opinion innovative company like mulesoft trust gong power customer reality gong customer experience improve win rate increase deal size accelerate employee ramp times gong private company headquarter,sales & crm,0.432,future of work,0.385,platforms,0.354
1968,1968,9237,Good-Catch,good catch specialize develop plant base seafood alternative offer vegetarian shredded tuna crab cake fish patty lentil chickpeas fava bean legumes company found headquarter,nutrition,0.301,oceantech,0.281,agtech,0.278
1969,1969,2927,GoodCourse,mobile micro learn platform make e learn accessible engage non desk worker remote audience enrol learner text message keep learn content brief minute day remove friction learning process app login struggle find time,mobile,0.448,edtech,0.424,social networks,0.31
1972,1972,1563,Goodlord,offer cloud base software help estate agent landlord tenant manage rental process cloud base software digitize tenancy creation progression allow cut pointless time consume administration agent transform tenant landlord experience provide shop agent easily offer service provide value tenant landlord insurance utility service found company establish,platforms,0.406,sharing economy,0.336,cloud infrastructure,0.3
1973,1973,6276,Good-Monday,manage office increase effectivity raise morale inspire great work culture manage office time consuming involve stressful coordination administration service put fire rob management employee valuable time good platform allow access personal dashboard give overview service expense order focus run business office,future of work,0.345,analytics,0.34,human resources,0.311
1975,1975,9850,Goonhilly-Earth-Station,satellite communication teleport provide telecommunication service offer satellite antenna service include satellite communication teleport satellite tracking telemetry earth station verification assistance launch early operation support small aperture terminal deep space communication radio astronomy service,5g networks,0.38,space tech,0.302,communications,0.295
1976,1976,2758,Goopi,cloud base portal allow create customize professional video ad min fraction price patent technology live cloud like cloud service improve performance computer connect,cloud infrastructure,0.384,esports,0.375,platforms,0.359
1978,1978,10351,GO-Outdoors,outdoors small company set big adventure open door soon know simply local quickly earn strong reputation excellent customer service landmark yorkshire outdoor community,travel,0.347,analytics,0.329,sharing economy,0.319
1979,1979,9047,Gordian-Software,build apis enable world lead travel organization increase revenue customer include lead global travel agency management company support airline include partnership singapore airline grow rapidly include revenue growth serve passenger month launch back growth power core value ownership day sprint remote friendly onsite teammate empower good work headquarter bellevue wa information visit,platforms,0.404,professional services,0.367,sales & crm,0.366
1982,1982,2996,GoSquared,platform business understand communicate customer combine analytic live chat marketing automation seamless platform company mission help business convert visitor customer,social networks,0.397,analytics,0.356,platforms,0.351
1983,1983,7593,GoTo-Group,application ride hail food delivery service drive progress provide technology infrastructure solution enable participate thrive digital economy,mobility,0.44,platforms,0.429,food & beverage,0.41
1984,1984,148,Go-Try-It-On,gotryiton allow guest ability share photo honest opinion look guest ask community look private ask friend feedback,social networks,0.416,sharing economy,0.368,creator economy,0.323
1986,1986,5859,Government-Grant-and-Tax-Consultants,ggtc welcome opportunity help client receive entitlement government funding current scheme ggtc offer service focusse market leader field support base s believe grow group business partner financial strength gravita continue develop advisory support sector,professional services,0.395,social impact,0.336,platforms,0.303
1988,1988,5486,GPU-AUDIO,technology startup connect world innovation professional audio develop world fully capable solution audio processing innovative approach allow digital signal processing offload parallel processing architecture s round trip latency enable truly generation feature limitless plugin instance remote compute wireless cloud process continuous audio rendering export audio instantaneous result company found,ar/mr/vr,0.366,video/audio,0.365,industrial iot,0.341
1989,1989,9089,Gr4vy,payment orchestration platform offer payment solution business orchestration platform enable mid sized business ability add spectrum payment infrastructure begin host expand need take technical debt charge customer service transaction addition platform provide hub report monitor manage payment infrastructure found base,platforms,0.437,e-commerce,0.399,logistics,0.345
1991,1991,9045,Grabyo,leader real time video scalable cloud base platform enable broadcaster content right holder instantly create distribute monetise real time video clip platform device deep industry experience provide broadcaster right holder strategic guidance support order extract maximum value time video content capitalise significant commercial opportunity share live tv web social mobile launch mobile platform work broadcaster popular tv format large advertiser,esports,0.398,media,0.366,cloud infrastructure,0.338
1993,1993,8217,Graduway,graduway provide world class community software empower organization build close relationship constituent facilitate valuable conversation connection parent student volunteer alumnus donor,social impact,0.374,edtech,0.282,platforms,0.274
1994,1994,429,Grailed,graile curate e commerce marketplace men clothing goal provide interactive educational meeting grind fashion enthusiast buy sell unique piece,fashion,0.605,e-commerce,0.396,edtech,0.38
1995,1995,6926,GrandNanny,childcare service use childcare bring generation close connects neighbor look rewarding time work local family need school care dbs check aid training payroll provide company,familytech,0.313,analytics,0.252,security,0.243
1996,1996,5202,Graphcore,graphcore startup develop microprocessor design machine learning application create new processor intelligence processing unit ipu artificial intelligence ipus unique architecture mean developer run current machine learning model order magnitude fast company found headquarter,business intelligence,0.347,industrial iot,0.34,data infrastructure,0.336
1997,1997,9836,GraphPath,graphpath help enterprise evolve big datum big knowledge creation large scale enterprise knowledge graphs graphpath aim democratize development management knowledge graphs scale industry vertical time enterprise quickly cost effectively extract value datum build repository proprietary knowledge leverage machine people alike,business intelligence,0.375,industrial iot,0.338,platforms,0.333
1998,1998,6087,gravityAI,gravityai software development datum scientist company provide service payroll form insurance form tax form supply chain management receipt online inquiry form available company website,procurement,0.37,professional services,0.304,logistics,0.301
2000,2000,581,Grazing-Minds,career development platform offer learner corporate customer access sustainable talent world class service progressive approach learn create memorable experience company platform offer short duration course user look bfsi logistic marketing hospitality career employability tool career service enable professional upskill place talent connect dedicated professional provide service,future of work,0.402,platforms,0.345,travel,0.321
2001,2001,731,Green-Biologics,green biologic revenue generate industrial biotech company base aim world lead supplier advanced fermentation technology conversion biomass renewable fuel chemical,chemicals,0.482,greentech,0.389,energy generation,0.38
2002,2002,8770,Greenbird-Integration-Technology,vc back saas provide domain specific ipaas purpose build drive empower smart grid industrial s utilihive productive operation serve moire client far east recognize ongoing energy revolution enterprise saas company offer utilihive smart utility hub empower smart grid industrial internet big datum integration platform domain specific ipaas purpose build utilihive,data storage,0.402,platforms,0.334,cloud infrastructure,0.33
2003,2003,2944,Green-Highland-Renewables,specialise develop small scale run river hydro project provide advice solution landowner community process design procurement operation help provide sustainable future whilst support scotland responsible commitment climate change,infrastructure tech,0.362,energy generation,0.328,productivity,0.28
2004,2004,6089,Greenhouse-Software,hire software company help business great hire powerful hire approach complete suite software service hire maturitytm methodology large partner ecosystem business hire base office employee world support customer smartest successful company like knot worldwide use hire software platform improve aspect hire helping attract talent software right reserve hire maturity talent maker g logo trademarks software co found company headquarter,future of work,0.454,platforms,0.381,human resources,0.38
2005,2005,1204,Green-Li-ion,ion deep clean technology solve existential risk precious metal industry environment patent deep technology profitable current recycling technology fully rejuvenate battery cathode found base,climate tech/cleantech,0.36,electrification,0.343,greentech,0.322
2009,2009,9199,Greenscreens-AI,dynamic pricing infrastructure logistic industry deliver freight market pricing intelligence business insight help grow protect margin exist help customer quote confidence win businessmore profitably solution combine power aggregated market datum organization datum advanced machine learning technique deliver short term predictive freight market pricing specific company individual buying sell behavior,supply chains,0.525,sales & crm,0.507,logistics,0.429
2010,2010,3618,Greensill-Capital,reformer heart challenge status quo work global finance fair levelling play field business people alike company unlock capital world work found headquartered office bundaberg provide innovative financing solution customer inject financing customer supplier country,professional services,0.431,analytics,0.373,fintech,0.337
2011,2011,480,Gregarious-Inc.,change way human live alongside plant believe understand plant work able participate solution existential challenge planet face food system insecurity collapse ecosystem start create delightful mobile app help people grow thrive plant community grow beta user active user plant water m time partner like sill retailer start share help customer care newly purchase plant,climate tech/cleantech,0.365,mobile,0.334,energy generation,0.304
2012,2012,356,Gremlin,downtime expensive damage customer trust service find weakness system cause problem provide framework safely securely easily simulate real outage grow library attack turn failure resilience,sharing economy,0.351,cybersecurity,0.343,data centers,0.341
2013,2013,428,Grey-Area,create category define gaming experience mobile tablet device app company world flurry tech startups gigaom euro list choose,mobile,0.388,gaming,0.323,platforms,0.317
2014,2014,10322,Greyrock-Energy,develop groundbreaking technology direct conversion natural gas pump ready transportation fuel dfp conversion technology avoid costly large scale process associate historical gas liquid gtl approach allow wide flexible deployment low gas volume,carbon capture,0.308,supply chains,0.281,greentech,0.242
2015,2015,8905,Grey-Wizard,grey wizard provide cloud base military grade manage security service design protect website web application core function include behaviour base anomaly protection thank machine learning solution learn characteristic client provide tailored service,cybersecurity,0.352,security,0.342,defense,0.302
2016,2016,2212,GridDuck,transform home business smart grid gateway use wireless network connect plug relay monitor consumption datum execute rule set connect cloud ethernet wireless cellular network company wireless plug relay switch monitor real time consumption pattern monitor grid condition immediately respond command gateway,energy distribution,0.383,infrastructure tech,0.324,iot,0.302
2018,2018,8532,Gridspace,gridspace provide natural sound virtual agent voice observability software contact center company true stack provider conversational ai build integrate enterprise grade softswitch real time conversational llm semantic search engine neural dialog management system author interface management dashboard analytic module,communications,0.348,social networks,0.302,platforms,0.281
2022,2022,703,Groundwork-BioAg,groundwork develop manufacture commercialize mycorrhizal inoculant mainstream agriculture customer achieve significantly high crop yield reduce environmental impact save money agricultural input,energy generation,0.356,agtech,0.352,chemicals,0.241
2023,2023,6773,Group14-Technologies,technology battery storage technology company develop silicon carbon composite material lithium ion market enable electrification tiny medical consumer commercial device possible flavor size transportation bring new finely tune performance capability era lithium silicon battery novel composite material industrial process reliably answer cost scale performance barrier slow world transition electric future,energy storage,0.524,electrification,0.34,materials,0.269
2024,2024,6108,Groupalia,e commerce platform offer discount flash sale leisure package service food product relate service offer platform include deal range restaurant spa gyms event adventure deal sell coupon buyer receive email enable print hand coupon supplier consumption provide consumer opportunity buy attractive service reduce price help supplier benefit enable ensure high volume occupancy rate brand awareness launch,fashion,0.434,sales & crm,0.351,platforms,0.332
2027,2027,1997,GroupU,groupu online tool maximise individual student progress effective classroom collaboration lead teacher think deeply practice power tool planning deliver outstanding lesson,future of work,0.393,edtech,0.375,productivity,0.271
2028,2028,9256,GrowSafe-Systems,growsafe apply science technology improve animal farm profitability datum acquisition technology continuously measure individual animal bio metric datum environmental input farm automatic integration external datum source sensor edge analytic datum point analyze process predictive thinking algorithm identify feed efficient sick market ready animal individually,agtech,0.385,biodiversity,0.297,business intelligence,0.296
2032,2032,3469,Guardant-Health,commit positively significantly impact patient health technology breakthrough pointedly address long standing unmet need oncology back lead seasoned management team comprise think leader successful serial entrepreneur generation sequence rare cell diagnostic closely advise oncologist lead medical steering committee lead cancer center abroad,longevity,0.31,professional services,0.273,biotech,0.257
2033,2033,7301,Guardhog,demand insurance solution support sharing economy platform member want dramatically improve way insurance distribute discover consume define sense urgency dedication innovation create reaction gap market traditional model insurance simply not fit sharing economy know gap fill speed strength execution vital sense urgency simply reflection understand share economy change market proud work work extremely seriously not theirselve seriously,infrastructure tech,0.354,professional services,0.346,mobility,0.298
2034,2034,5127,Guardicore,guardicore innovator datum center cloud security focus deliver accurate effective way protect critical application compromise unmatched visibility micro segmentation real time threat detection response information visit,security,0.477,cybersecurity,0.462,defense,0.361
2035,2035,1850,Guardtime,guardtime network security company validate correctness data network system process technology enable application build truth inherent design deliver value digital company aim build partnership company industry build product market headquarter company,security,0.468,cybersecurity,0.363,defense,0.336
2037,2037,8359,Guevara,web base platform enable user pool car insurance premium online save money new back team launch,insurtech,0.43,professional services,0.287,esports,0.275
2039,2039,8384,Guidebook,guidebook simple powerful mobile application builder let create app easy step technical skill require choose gallery mobile app template select features fill content publish minute google play apple app store,mobile,0.544,design,0.302,e-commerce,0.252
2041,2041,1528,Guidewheel,leader cloud power empower world factory digitize operation reach sustainable peak performance plug play platform clip machine factory floor deliver real time visibility reduce lose production improve performancea critical fix time eye manufacturer impact global supply chain found go accelerator product recognize prize team bring manufacturing expertise success build world class cloud software scale expand quickly plant information visit,future of work,0.373,connected home,0.366,manufacturing,0.327
2046,2046,7857,G-volution,g volution multi fuel technology follow simple principle efficient engine type diesel engine dual fuel engine cleaner expensive fuel displace portion diesel natural gas volution instal alongside original diesel ecu allow engine combust fuel simultaneously,carbon capture,0.343,energy generation,0.25,electrification,0.24
2049,2049,3368,GYENNO-Technologies,digital health company develop medical device people disabilitie product include spoon help people hand tremor eat stress matrix wearable motion gait quantitative evaluation system disease,healthcare,0.511,medtech,0.362,mobile,0.311
2050,2050,3771,Gymbox,own operate chain gyms fitness center gym offer class area box yoga fusion dance martial art aerobics torso tone indoor cycling boxing workout kick boxing company incorporate base,sport & wellness,0.424,e-commerce,0.275,fashion,0.265
2051,2051,3449,Gympass,mission defeat inactivity help company revolutionize inactive employee engage physical activity drive last behavioral change client credit unmatched variety convenience flexibility helping improve employee engagement individual performance overall business success country gym studio partner partner corporation craft ongoing personalized program inspire workforce enroll stay motivated unlock potential,human resources,0.365,sport & wellness,0.362,future of work,0.359
2052,2052,5735,Gynesonics,women healthcare company focus development advanced incision free solution treatment uterine condition serve customer worldwide found headquarter,femtech,0.423,beauty,0.322,healthcare,0.296
2056,2056,1168,Hadean,venture back startup reimagine distribute spatial scalable computing web metaverse distribute cloud platform provide foundation web application metaverse enterprise organisation alike bridge physical virtual world technology enable unprecedented scale fidelity digital realm enhance improve physical include francis crick institute visit,cloud infrastructure,0.409,platforms,0.394,cloud ops,0.364
2057,2057,3076,Haelf,personalized clinically prove treatment back science approach strive empower broader wellbee open floor talk thing easy potentially embarrass scientific research integral treatment provide utilitarian platform ensure reach well health ease believe unequivocally translation science lead well question well choice well health gimmick false promise haelf care,life sciences,0.407,healthcare,0.371,legaltech,0.287
2058,2058,2870,Haemostatix,base co found professor spin establish commercialise new technology platform base specific peptide sequence bind fibrinogen protein essential formation clot peptide couple different form solid support soluble carrier create topical systemic haemostat new technology platform basis pipeline class product treat form bleed surgery trauma leukaemic patient,biotech,0.329,life sciences,0.293,healthcare,0.257
2061,2061,4350,Halo-Neuroscience,develop market neurotechnology system help individual unlock true potential product utilize technology accelerate skill strength acquisition elite athlete process electrical stimulation movement base training build strong optimize connection brain muscle process induce temporary state hyper learn hyperplasticity brain refine brain ability learn adapt training company incorporate base,neuro,0.337,sport & wellness,0.336,future of work,0.329
2064,2064,10789,Hanmere-Polythene,hanmere polythene ltd extruder flexo printer converter blow polythene film packaging material food industry company certify production polythene packaging suitable use direct contact high risk food,food & beverage,0.413,3d printing,0.328,connected home,0.326
2065,2065,8865,Happay,happay travel expense ecosystem platform manage kind corporate spending reimbursement petty cash business expense payment card travel support complete visibility control end end integration,travel,0.444,professional services,0.416,platforms,0.415
2066,2066,7036,HappyFresh,work headquarter expand currently operate city country shop difficult look space park car have isle find need push trolley wait line cashier carry heavy bagsthese activity lot time spend thing build deliver simplify life mission provide easy grocery shopping experience high quality service train personal shopper customer shop have worry freshness grocery day team deliver freshlyhandpicke grocery door liberate life,future of work,0.396,analytics,0.367,infrastructure tech,0.321
2067,2067,337,Happylatte,mobile game developer develop newfangle social game mobile device game blend free play massively multiplayer social game uniquely fit modern mobile phone s journey lead chart bust title download active user fan base,gaming,0.506,mobile,0.404,esports,0.402
