Unnamed: 0.1,Unnamed: 0,id,name,cb_description,industry1,score1,industry2,score2,industry3,score3
957,957,513,Clausematch,award win regulatory technology company enable heavily regulate organization regulate company run business safely meet compliance obligation s ai power platform provide end end policy management regulatory compliance solution help organization navigate compliance lifecycle,regtech,0.468,professional services,0.405,legaltech,0.388
958,958,4650,Clean-Air-Power,pioneer natural gas power vehicle develop technology guarantee diesel engine performance significant cost saving low carbon emission truck run natural gas clean greener cheap way freight pioneer innovative technology complementary component system deliver low fuel cost operator compromise performance driver add benefit significantly low tailpipe air quality emission,greentech,0.267,carbon capture,0.257,food & beverage,0.241
960,960,6495,Cleanshelf,cleanshelf lead saas spend optimization solution focus exclusively track control benchmarke subscription saas application cloud technology help company save saas spending automatically identify unused underused unmanaged license subscription cleanshelf serve client include rocket,platforms,0.378,logistics,0.328,professional services,0.322
961,961,9440,ClearForce,analytic technology company lead provider service bdaas enable organization discover act early behavioral indicator signal risk organization customer co worker self harm solution extend public private sector use case people create risk,professional services,0.338,security,0.303,sharing economy,0.278
962,962,7394,ClearGlass,digital intermediary asset manager pension fund collect underlie cost performance datum asset manager help pension fund decide good fund invest member,sharing economy,0.37,professional services,0.36,data management,0.292
963,963,8078,Clearly-Social-Angels,clearly angel network dedicated business create positive social change kind number company social impact heart business model grow group active commit experienced investor accelerate capital extraordinary business member meet central basis discover country inspire social entrepreneur compelling innovative solution social environmental problem learn include detail involve head dedicated website,analytics,0.424,platforms,0.351,economic empowerment,0.343
965,965,6513,Clear-Review,ongoing performance management solution run cloud build thoughtful discussion feedback company passionate equip human resource professional empower employee bring good selvesto work distinct vision motivate performance improvement strike chord local hr talent executive,human resources,0.522,future of work,0.43,professional services,0.325
966,966,3102,Clearway-Group,clearway service lead vacant property specialist offer security temporary surveillance solution vacant commercial residential property building site reputation response speed service quality securing property unauthorized entry squatter vandalism burglary harm guarantee meet criterion protection retain market value estate help customer deal squatter eviction land clearance property inspection range property service high quality quick response service,security,0.391,sharing economy,0.282,climate tech/cleantech,0.275
967,967,5070,Cledara,cledara give detailed overview software company use allow manage simple way request approve software pay accounting autopilot lean usage finance datum cancel app click need cledara company reduce software cost save software admin,professional services,0.37,business intelligence,0.342,platforms,0.329
969,969,358,ClickHouse,open source column orient olap database management system allow user generate analytical report query offer secure scalable service cloud cloud allow effortlessly advantage efficient real time analytical processing,data infrastructure,0.434,martech,0.381,cloud infrastructure,0.297
971,971,2800,Clicks-Help,click help charity button augmentation software mean website convert visitor business help good cause time,social impact,0.353,platforms,0.286,sharing economy,0.255
973,973,3705,Clikalia,found lead instant property buyer bear aim digitise real estate sector company reduce time take sell property signif icantly make offer accept buy property use technology big datum improve digitise process resell home make sustainable energy efficient,sales & crm,0.333,analytics,0.327,proptech,0.312
974,974,9539,ClimateCrop,technology allow plant store carbon energy result increase yield biomass fruit state found base ness ziona,energy generation,0.422,greentech,0.41,agtech,0.307
975,975,85,Climax-Foods,datum science company innovate future food develop sophisticated machine intelligence tool unlock smart path plant product create new generation plant base food compete animal base predecessor,energy generation,0.365,food & beverage,0.355,agtech,0.313
976,976,10727,Clinical-Genomics-Technologies,privately hold biotechnology company develop innovative product colorectal cancer diagnosis monitor broad intellectual property portfolio include issue pende patent develop validated sensitive specific blood test colorectal cancer recurrence monitor launch gene test base methylate dna gene currently know project,biotech,0.391,regtech,0.382,professional services,0.341
977,977,10259,Clinical-Ink,provide solution clinical trial industry offer sur electronic source solution allow user record comment explanation validate source datum protocol specific document capture datum require protocol company provide electronic source record clinical trial provide clean datum addition offer host service found base,legaltech,0.402,health tech,0.375,regtech,0.325
978,978,4460,Clinical-Insights,clinical insight provide tool business advisory service base rich data analytic pharmaceutical company solution optimize performance dynamic analytical technique base real world real time market information improve market insight develop business solution base sophisticated analysis big datum available real time improve business performance embed analytical technique real time proprietary market information user management system,professional services,0.355,martech,0.347,data infrastructure,0.333
979,979,116,Clinkle,clinkle goal modernize way people transact create generation payment platform change way people pay thing base company planning introduce mobile wallet day day transaction,analytics,0.38,e-commerce,0.366,fintech,0.348
980,980,7040,CL-Invest,cl provide climate mitigation expert project finance assessment development experience cl mission eliminate financial barrier immediate climate action focus methane flare reduction project emerge economy,carbon capture,0.429,professional services,0.38,greentech,0.352
984,984,2318,Cloakroom,cloakroom invent man allow man enjoy fine thing life believe shopping mission need solve efficiently possible cloakroom concept new well way man update wardrobe having leave couch want sure man visit clothing store,fashion,0.462,retail,0.327,analytics,0.316
985,985,6300,Clockwork-Labs,new game studio focus build massively multiplayer societal games focus pure combat instead encourage social interaction cooperation player,gaming,0.43,esports,0.385,social networks,0.32
986,986,8728,CLOS3T,aim ambitious fashion luxury brand step metaverse provide tool deliver exclusive experience client expect t immersive digital wallet provide simplicity utility safety fashion lover allow unlock personalized token gate journey,fashion,0.512,beauty,0.398,design,0.367
987,987,10779,Cloud9-Technologies,cloud communications service provider provide high performance voice message collaboration service design unique need distribute work group team deliver service cloud software application leverage internet advance webrtc technology connect institutional trading community voice messaging solution design especially financial market provide secure compliant way connect trading counterpartie eliminate hassle expense legacy turret system private line,communications,0.434,cloud infrastructure,0.372,social networks,0.371
989,989,5352,Cloudapps,cloudapps revenue intelligence platform help organisation predict deal outcome increase sale productivity identify new revenue opportunity solution combine gamification technique behavioural science late ai algorithm business complete sale data picture need unlocking synthesise learn actionable real time sale intelligence hide business tool day cloudapps enable strong pipeline accurate forecasting well conversion rate effective coach sale rep,sales & crm,0.438,platforms,0.413,future of work,0.39
990,990,3605,Cloudbeds,cloudbed mission power property globally integrate cloud base hospitality management platform empower independent hotelier host technology need grow revenue streamline operation deliver memorable guest experience confidence ease well technology cloudbed found headquarter,cloud infrastructure,0.386,travel,0.386,sharing economy,0.336
991,991,1700,CloudBounce,cloud base online master service help producer musician band sound engineer sound well master song unlike compete online mastering service deliver good crystal clear sound quality,cloud infrastructure,0.341,cloud ops,0.313,future of work,0.306
993,993,10704,CloudCath,cloudcath offering sensor enable digital platform peritoneal dialysis patient provide early complication detection safely reduce number patient visit,healthcare,0.39,medtech,0.285,big data,0.274
994,994,225,Cloud.com,venture back startup base develop open source cloud orchestration software product implementation public private cloud computing environment software design easy build manage deploy iaas offering similar available edition enterprise edition service provider edition open source company change emerge stealth mode,platforms,0.363,cloud ops,0.362,cloud infrastructure,0.331
995,995,9011,CloudMargin,form team professional combine experience collateral management otc derivative technology capital market inspire power new technology drive belief exist collateral management solution price inefficient inaccessible decide change thing well exist bring effective collateral management market participant regardless size status trust client industry knowledge honesty unwavering commitment innovation,professional services,0.484,platforms,0.412,fintech,0.371
996,996,3681,CloudMinds,found cloudmind unique consist secure virtual backbone network commercial humanoid service robot power actuator technology precise compliant grasping capability connect ai cloud brain platform harix enable robotic intelligence secure network equip joint multiple visual perception module sensor compliance safe interaction human environment killer application,robotics,0.458,industrial tech,0.403,future of work,0.291
998,998,5365,CloudSense,electronic design manufacture company offer electronic product testing product development contract manufacturing deliver technology solution wide range industry include defense aerospace automotive marine,manufacturing,0.454,procurement,0.349,industrial iot,0.324
999,999,4726,Cloud-Sustainability,cloud base software platform change way sustainability knowledge consultancy training deliver reduce cost educate empower user create self sufficiency deliver long term sustainable benefit,platforms,0.372,climate tech/cleantech,0.314,future of work,0.311
1001,1001,5763,Clovis-Oncology,clovi oncology biopharmaceutical company focus acquire develop commercialize cancer treatment international market development program target specific subset cancer combine precision medicine companion diagnostic direct therapeutic patient likely benefit,biotech,0.336,life sciences,0.271,longevity,0.252
1002,1002,2094,Club-Soda,club soda movement mindful drinker want cut drinking booze alcohol free get free join member click button sign access goal set progress tracking tool test drinking habit weekly email need support join super supportive online community like online programme find expert member help club soda,food & beverage,0.306,social impact,0.265,fashion,0.249
1003,1003,5903,ClubSpark,award win market lead sport booking management saas platform excess sport provider register player coach client include,esports,0.496,sport & wellness,0.46,professional services,0.348
1005,1005,26,Clumio,innovator authentic saas enterprise backup secure service organization eliminate hardware software premise backup avoid complexity cost run party backup software cloud enterprise aggressively cloud use protect workload like vmware cloud aws native aw service bear public cloud leverage modern cloud service ensure meet current future backup requirement demand enterprise,data storage,0.503,cloud infrastructure,0.397,platforms,0.387
1006,1006,2409,Clustermarket,clustermarket lead operating system life science laboratory goal bring management research digital age democratise access expensive equipment service ultimately enable life science innovator idea market fast award win lab management software previously know bookkit revolutionary marketplace help lab manage connect share resource,platforms,0.365,professional services,0.344,sales & crm,0.318
1007,1007,4355,C-Major-Medical,problem know medical practice worldwide despite work legislation country incident fall fast far hope establish sole purpose develop new range safety device enable hospital clinic medical practicioner prevent,healthcare,0.448,security,0.339,legaltech,0.327
1008,1008,7355,CMP-Therapeutics,therapeutic biopharmaceutical company develop chitin microparticle macrophage dendritic cell nasal respiratory tract company develop nasal spray treatment allergic rhinitis clinical application nasal spray enhance natural resistance influenza respiratory pathogen adjuvant nasal vaccine company found base,biotech,0.433,life sciences,0.265,longevity,0.223
1009,1009,5269,Cmune,care deeply bring amazing experience mobile device believe beautiful content rich gameplay limit console desktop think well acclaim international game developer games multiplayer browser m player imagine multiplayer action game touch device new flagship title fast pace multiplayer title design specifically touch closing gap experience console mobile base representation san francisco back investor dcm dozen mobile gaming industry veteran,gaming,0.491,mobile,0.28,platforms,0.267
1013,1013,4575,COAT,operate sustainable paint company carbon neutral launch revolutionize home decorate experience redefine customer experience purchasing paint,climate tech/cleantech,0.368,design,0.362,beauty,0.325
1015,1015,3730,Cobli,simplifie improve fleet management company grow year employee m raise founding lead softbank present reach customer serve industry telecommunication transportation energy e commerce construction iot artificial intelligence big datum video telemetry technology solution help reduce cost boost productivity increase driver safety raise operational compliance improve end customer experience,analytics,0.38,future of work,0.338,professional services,0.329
1016,1016,45,Cockroach-Labs,cockroach db cloud native distribute database modern cloud application help company sizesand app develop scale fast survive thrive cockroachdb use world large enterprise industry include large company bank retail medium,data infrastructure,0.426,cloud infrastructure,0.343,platforms,0.32
1017,1017,4571,Coco-Coders,teach child aged code foundation person learn lab base business tech star come live online class subscription base code lesson,edtech,0.408,future of work,0.259,familytech,0.256
1018,1018,2494,Coconut,simple tax accounting software sole trader landlord accountant make tax digital income tax mean taxpayer tax return instead make easy organise finance help accountant client ready change,sharing economy,0.343,professional services,0.331,platforms,0.254
1020,1020,2668,Cocoon-Wealth,cocoon international private investment organisation identifie invest fund ground break opportunity believe benefit unrelentingly inventive approach financial engineering strategy asset development believe robust application private equity principle investment time deeply protective business headquarter mayfair cocoon substantial private investment holding m span diverse range industry,professional services,0.431,analytics,0.381,proptech,0.344
1021,1021,1111,Codacy,codacy automate code review tool help developer save time code review tackle technical debt efficiently developer spend time review code gartner estimates global technical debt grow codacy track new issue severity level commit pull request allow hassle free customization static analysis provide advanced code metric health project performance team,developer tools,0.486,future of work,0.296,business intelligence,0.274
1022,1022,455,Codat,universal api saas financial service provider company provide real time connectivity enable software provider financial institution build integrated product small business customer handle heavy lifting integration leave provider free focus integration improve product small business customer back,platforms,0.506,professional services,0.353,analytics,0.348
1023,1023,517,Codecademy,free web mobile base platform teach employable digital skill user worldwide platform learner discover concepts html css javascript jquery python ruby php apis actually build thing get constant feedback peer entirely new networked approach learn interact student globe build amazing project,edtech,0.373,mobile,0.335,gaming,0.261
1025,1025,10006,Codementor,codementor provide live help software development make easy developer connect expert screen sharing video chat way help demand live expert help long term dedicate mentorship build project fast demand help topic include ruby python php javascript css html ios swift codementor helps overcome key challenge timely advice speed development process,future of work,0.325,platforms,0.277,edtech,0.253
1026,1026,272,CodeSignal,lead technical interview assessment solution help company identify right candidate right skillseven not right profile far long company spend time sifting noise produce traditional resume homegrown assessment inconsistent interview want know candidate job help company noise smart assessment question simple process strong platform trust lead company like dropbox trust innovative tech firm financial service institution large enterprise include,sales & crm,0.379,professional services,0.343,human resources,0.318
1029,1029,2167,CognitionX,cognitionx ai advice platform offer rich comprehensive library ai news mission bring clarity accelerate adoption ai organisation global enterprise startup help ensure safe responsible transition ai drive society enterprise edition ai advice platform enable large firm capitalise internal expertise access global network expert,future of work,0.436,professional services,0.359,data management,0.306
1031,1031,6478,Cognitive-Match,use late advance artificial intelligence learn mathematic psychology semantic technology create system match individual content realtime content product offer editorial creative execution system maximize response revenue ultimately profit client,future of work,0.33,design,0.315,media,0.298
1032,1032,80,Cohere,platform give developer business access powered late generation large language model building machine understand world safely accessible provide access affordable easy deploy large language model platform give computer ability read write well understand customer say write compelling copy speak target audience help,platforms,0.349,future of work,0.325,analytics,0.306
1034,1034,3211,Coherus-Biosciences,coherus bioscience biopharmaceutical company engage development manufacture commercialization biologic therapeutic company develop biologic medicine primarily treatment oncology inflammatory disease focus process science analytical characterization protein production clinical regulatory development pipeline include immunology anti tumor necrosis factor biosimilar candidate ophthalmology biosimilar candidate oncology biosimilar candidate,biotech,0.468,regtech,0.358,longevity,0.314
1035,1035,10654,Coinbase,online platform allow merchant consumer trader transact digital currency allow user create bitcoin wallet start buy selling bitcoin connect bank account provide series merchant payment processing system tool support highly traffic website internet launch mission create open financial system world operate,crypto,0.491,fintech,0.406,payments,0.387
1036,1036,8536,CoinDCX,coindcx company specialize crypto enable financial service company focus develop borderless financial service ensure simple uninterrupted flow capital liquidity powerful wallet impenetrable security trading experience fast reliable effortless coindcx empower trader bouquet industry product trade liquidity exchange product design type trader keep trading experience risk tolerance trading frequency consideration company aim democratize finance investment accessible coindcx found headquartered maharashtra,defi,0.452,crypto,0.437,fintech,0.389
1037,1037,589,Coinfirm,coinfirm lead provider blockchain analytic crypto forensic investigation create safe blockchain economy protect customer business counterpartie involve illicit activity like money launder ransomware hack human traffic terrorist financing industry large blockchain coverage m cryptocurrencie protocol support blockchain solution market leader range vasp protocol like wave major financial institution government,defi,0.452,blockchain,0.387,fintech,0.369
1040,1040,7768,Col8,bring video datum like location allow use footage like human instead search endless file folder look bit need system present intuitive way explore context happen video frustrate footage shot find good bit fast concept came quickly realise lot industry drone sub sea surveying asset management professional sport team struggle like,health tech,0.357,robotics,0.325,agtech,0.254
1043,1043,146,Collibra,collibra deliver end end datum intelligence platform accelerate digital business transformation collibra accelerate trust business outcome connect right datum insight algorithm datum citizen company platform break traditional datum silos open organizational datum provide trustworthy business intelligence enable user find datum need collaborate easily understand mean found headquarter,analytics,0.394,data infrastructure,0.384,cloud infrastructure,0.353
1044,1044,3850,Collision-Management-Systems,enable safe world give organisation single point access datum right information manage risk well back fund operate people keep safe day bring datum telematic employee connect sensor source platform empower corporate fleet motor insurance wide risk management industry reduce incident frequency incident cost,security,0.364,professional services,0.321,industrial tech,0.315
1046,1046,4492,Colourstory,free web mobile platform let create beautiful representation life set image genesis founder colour trend visualisation artwork reduce famous painting colorful pie chart open method wide audience sense crowd source idea want able create colorful artwork reveal pattern trend hide photo album,design,0.477,creator economy,0.395,mobile,0.369
1047,1047,382,CoMentis,biotech company focus research development small molecule drug treat neurovascular disease alzheimer disease ad age relate macular degeneration cognitive disorder found company name follow merger zapaq create lead neurovascular disease franchise,biotech,0.359,longevity,0.316,life sciences,0.26
1048,1048,4488,Comino,experience world hardware research development international start specialise design production liquid cool pcs servers product consume electricity equivalent air cool computer pride quality excellence offer service breadth burgeon industry currently operate ai forensic gaming video rendering intention expand outreach,future of work,0.362,gaming,0.361,platforms,0.323
1051,1051,2288,Commerce-One,commerce provide e commerce supplier relationship management solution company found renamed commerce company see tremendous success go public crash wake dot come crash company file bankruptcy protection acquire,procurement,0.415,fashion,0.388,analytics,0.369
1052,1052,6364,Commercial-Bank-of-Ceylon,financial company compaany service include ing card service combank digital flash account whatsapp banking banking combank viber e passbookeslips paymaster service mobile reload bankassurance dialog ez cash mcash,fintech,0.511,payments,0.386,e-commerce,0.317
1053,1053,7255,CommneX-GmbH,commnex gmbh found establish comprehensive interface public financial management financial market commnex platform young interdisciplinary highly motivated team work development expansion establishment commnex service order provide user real efficiency gain experience investor consultant network cooperation partner concern position commnex groundbreake innovation municipal finance market,professional services,0.347,fintech,0.334,data management,0.304
1056,1056,359,CommQuest-Services,provide consulting service offer service include mental health counsel psychiatric service case management art therapy trauma recovery alliance rape crisis,life sciences,0.329,professional services,0.279,happiness & wellbeing,0.251
1057,1057,5273,Commsor,community scale business resource presence way traditional marketing advertising channel right community enable improve customer acquisition streamline support success bolster retention provide crucial product insight visit learn,professional services,0.387,analytics,0.359,platforms,0.348
1058,1058,1747,Compare-Ethics,compare ethic verifie manage deliver compliant product impact claim scale give team confidence communicate impact product addition anti greenwashing regulation follow patent pende verification technology hold strict regulatory scientific standard work lead lawyer academic dedicate advisory board,regtech,0.462,legaltech,0.392,professional services,0.375
