Unnamed: 0.1,Unnamed: 0,id,name,cb_description,industry1,score1,industry2,score2,industry3,score3
0,0,1820,0xKYC,modular knowledge system identity credential management reimagine create knowledge proof zkps prove ofac sanction know fraud wallet list,cybersecurity,0.352,payments,0.31,professional services,0.31
2,2,3640,10X-Genomics,create revolutionary dna sequence technology help researcher well identify subtle variation overlook technology shre biological sample tiny fragment sequence short stretch computer assemble genome,biotech,0.406,genomics,0.378,longevity,0.342
3,3,9594,111Skin,commit positive luxury skincare push boundary technological change establish sustainable philanthropic female lead future skincare addition source ethical material cut edge ingredient,beauty,0.457,fashion,0.342,social impact,0.312
5,5,473,1stdibs,internet company offer marketplace rare desirable object furniture fashion fine art jewelry feature online base platform connect respected dealer maker sophisticated collector share pursuit beautiful design,fashion,0.466,e-commerce,0.453,analytics,0.411
6,6,7956,1v1Me,application allow user play match favorite video game cash community meet play member company found base,esports,0.457,social networks,0.352,sharing economy,0.335
7,7,9457,21sportsgroup,online sport good retailer offer selection running shoe bicycle apparel accessory amateur athlete runner cyclist triathlete right professional athlete market range sporting good mainly area outdoor action run cycling triathlon sport combine e commerce retail business reduce gap online offline retail service product company available immediate shipping found base wurttemberg,fashion,0.48,e-commerce,0.32,sport & wellness,0.318
9,9,917,24Symbols,solution read digital book read device internet connection allow read read device internet conection ereader smartphone laptop,mobile,0.383,iot,0.357,healthcare,0.247
10,10,5470,2GIS,international technology company develop service comfortable life city mission help people live city expensive company internet accord forbes main product company city information service bring map navigator business directory active user service cover city country available free mobile application io,analytics,0.379,platforms,0.367,travel,0.258
11,11,5958,352-Medical-Group,local organisation trust healthcare professional clinic hospital provide excellence choice diagnosis education treatment health need mission world class provider healthcare solution put patient forefront aim preferred choice patient healthcare professional,healthcare,0.388,sharing economy,0.282,physical storage,0.271
12,12,4004,365-Response,response unique software service organisation different create solution directly respond specific challenge collaborate client multiple sector understand detailed requirement identify gap accordingly implement solution response team unique combination fast pace innovative approach establish system unparalleled industry experience proud solution help client achieve improved service level significant cost saving,platforms,0.425,productivity,0.419,future of work,0.285
13,13,5635,365Scores,cross platform application enable user create personalized sport channel individual live score news form media channel video highlight statistic fixture standing tweet major sport platform available language,esports,0.492,mobile,0.362,media,0.342
14,14,4797,3Box,storage simple secure private design store data user lighter trustworthy enjoy reduce datum management liability,cloud infrastructure,0.457,sharing economy,0.323,e-commerce,0.321
16,16,8364,3D-Robotics,make advanced drone technology easily accessible construction mining surveying industry use datum analysis help user land mapping site scan service collect accurate aerial datum turn urn drone photo map model point cloud provide comprehensive onboarde ongoing support enable client batter informed decision relate construction site found headquarter,agtech,0.432,business intelligence,0.321,future of work,0.318
18,18,3918,3sun-Group,limited subsidiary provide hydraulic control instrumentation product service oil gas sector worldwide furthermore offer skilled technician installation servicing wind turbine offshore application onsite testing inspection service oil gas renewable asset technical vocational training service europe limit found base great yarmouth,professional services,0.306,oceantech,0.279,human resources,0.278
19,19,1767,40-Partners-Ltd,produce talent broadcaster brand short form feature length studio go bit different hopefully game changer talent stay touch course,entertainment,0.413,future of work,0.328,esports,0.312
20,20,1351,42Lab,modular portable affordable biotech laboratory student mathematic stem education require country school struggle introduce biotechnology student high equipment cost troublesome experiment preparation solve problem provide portable modular biotech equipment student conduct experiment companion app serve electronic manual student management tool teacher vision bring biotech experience student like pi computer science,edtech,0.275,nano,0.264,food & beverage,0.236
21,21,8307,4-Antibody-AG,develop human antibody drug discovery platform generate antibody therapeutic focus immuno oncology technology platform design generate therapeutic antibody drug candidate incorporate human antibody library express mammalian b lineage lymphocyte company develop preclinical checkpoint antibody program target gitr found base,biotech,0.507,longevity,0.308,life sciences,0.291
22,22,8780,4energy,locate nottingham produce cool solution deliver energy saving traditional cool product datum centre telecom industry,connected home,0.389,data centers,0.341,physical storage,0.334
23,23,6524,5Mins,s gamified learn platform design help employee improve skill curate short form video content lead creator world make available team business adaptive gamifie learn engine,edtech,0.555,future of work,0.379,esports,0.345
25,25,1504,7bridges,smart logistic platform deliver visibility control logistic process unify data operation enable access global supplier ecosystem world class sustainable logistic operation rapidly achievable reality platform realize future proof sustainable logistic scalable competitive profit growth drive edge,supply chains,0.35,industrial iot,0.327,platforms,0.313
26,26,4084,7digital,global leader end end digital music solution core business provision robust scalable technical infrastructure extensive global music right create music streaming radio service diverse range customer include consumer brand mobile carrier broadcaster automotive system record label retailer offer radio production music curation service editorial strategy content management expertise,analytics,0.37,media,0.361,platforms,0.349
27,27,432,7TM-Pharma,biotech company discover develop drug primary therapeutic focus diabetes gastrointestinal metabolic asthma vascular disease company offer transmembrane span receptor include small molecule receptor antagonist selective agonist gastrointestinal disorder short bowel syndrome antagonist oral drug inflammatory respiratory disease found base lyngby hovedstaden,biotech,0.431,life sciences,0.276,regtech,0.251
28,28,3403,8fit,app help build healthy habit life simple solution support user worldwide individual journey healthier happy life push progress perfection choose good solution quick fix enjoy journey healthiest mind body understand obstacle people face fitness journey not easy s size fit way find lifelong health s building engage approachable way people achieve personal fitness goal,mobile,0.434,happiness & wellbeing,0.318,sport & wellness,0.311
29,29,28,8tracks-Radio,internet radio social network streams user curate song playlist contain track handcraft internet radio network social alternative tune online mixtape track curate people know love music stream legal radio style manner,creator economy,0.329,media,0.298,entertainment,0.296
32,32,8509,a55,developer financial underwriting platform offer revenue back credit line system company recur revenue platform underwrite small medium sized enterprise technology platform connect bank account escrow solution billing payment mean credit intelligence enable borrower credit monitor dashboard insight section revenue cost metric integrate cash flow covenant management system lender monitor platform feed real time transactional datum company found headquarter,fintech,0.434,platforms,0.417,professional services,0.386
33,33,1382,AarogyaAI,aarogyaai artificial intelligence base software service diagnose drug resistant tuberculosis aarogyaai use dna sequence patient upload machine learn algorithm give output report comprehensive drug susceptibility status patient,biotech,0.358,healthcare,0.327,data infrastructure,0.306
35,35,5266,Abacum,abacum saas help finance team deliver business insight abacum collaborative workflow planning platform finance team boost productivity strategic impact company believe empower people good collaborative tool multiply strategic impact organization fulfil,future of work,0.417,analytics,0.381,platforms,0.374
36,36,258,Abacus.AI,artificial intelligence research cloud service company help organization design train operationalize machine deep learning model allow organization plug play deep learning system exist customer experience business process company found base,analytics,0.45,future of work,0.368,sales & crm,0.368
37,37,3853,Abacus-e-Media,abacus e medium bring digital expertise industry specialist creative thinking design build website work believe develop technical solution forge commercial objective business brand strategy produce interactive engage user experience,design,0.413,analytics,0.374,future of work,0.352
38,38,6113,ABA-English,lead learn student worldwide headquarter talented team compose professional country stand unique methodology combine technology pedagogy interaction real teacher mission guide student learn journey empower effective tool achieve goal quickly efficiently recognize good educational app award feature educational app,edtech,0.353,future of work,0.3,sales & crm,0.272
40,40,10663,ABAX,developer supplier tracker system software technology business operate company vehicle product world lead respective field help numerous customer reduce overall fuel spend company vehicle eliminate risk tax penalty,logistics,0.426,sales & crm,0.41,professional services,0.393
42,42,6511,Abcodia,biotechnology company focus discovery validation biomarker cancer screen unique longitudinal serum biobank partnership technology platform provider lead commercial diagnostic company able support end end diagnostic development process found base uk,longevity,0.357,biotech,0.338,regtech,0.319
44,44,9786,Abhi,abhi financial wellness platform provide employee salary advance base accrue wage abhi salary advance app plan change game people spend money allow user withdraw portion accrue salary bank account help employer reduce workload hr finance department facilitate employee need abhi found base,human resources,0.417,professional services,0.402,fintech,0.39
46,46,3255,ABK-Biomedical,combine clinical market biomaterial specialize improve treatment option patient hypervascular tumor company dedicated transform interventional radiology procedure call embolization,healthcare,0.262,medtech,0.255,life sciences,0.216
47,47,5750,Ablynx,ablynx biopharmaceutical company engage discovery development nanobodie novel class therapeutic protein base single domain antibody fragment range human disease include inflammation haematology oncology pulmonary disease approximately project pipeline nanobodie clinical development,biotech,0.437,nano,0.382,life sciences,0.264
48,48,3527,Abogen-Biosciences,abogen bioscience discovery stage biotechnology company focus develop nucleic acid base dna therapeutic treatment cancer infectious disease,biotech,0.5,longevity,0.34,genomics,0.304
49,49,7990,Abokado,own operate chain food bar restaurant offer sushi wraps breakfast juice smoothie drink cake fruit salad soup stir fry food supply lunch company wife found headquarters,food & beverage,0.523,connected home,0.341,professional services,0.307
52,52,3174,AbsolutData,consult orient analytic research firm number client wide variety industry country navik ai platform enterprise blend ai technology datum analytic serve intelligence layer forward think company,future of work,0.443,industrial iot,0.375,business intelligence,0.303
54,54,3436,Acacia-Pharma,pharmaceutical company discover develop supportive care drug company focus cancer supportive care product include injectable formulation oral drug use nausea vomiting use cancer cachexia intravenous formulation use prevention treatment nausea vomiting company concentrate discovery effort cancer relate fatigue cancer cachexia xerostomia incorporate base,life sciences,0.384,healthcare,0.33,biotech,0.308
56,56,4672,ACAL-Energy,developer system module consumable chemical range use include stationary residential automotive application require large kw power innovative design deliver substantial cost saving system performance improvement accelerate adoption pem technology key market,chemicals,0.351,infrastructure tech,0.281,industrial iot,0.28
57,57,739,Accelerated-Payments,accelerated payment enable sme expand grow allow advance cash specific individual invoice accelerate payment create entrepreneur year experience financial service start run business,e-commerce,0.407,professional services,0.406,platforms,0.38
58,58,4924,AccelerComm,accelercomm exciting semiconductor ip core company provide solution accelerate generation wireless communication rel rel technology solve bottleneck limit speed generation wireless communication error correction decode required overcome effect noise interference poor signal strength,iot,0.42,manufacturing,0.292,telecoms,0.279
60,60,6388,Access-Bank,provide banking product service individual business customer offer standard saving current access advantage solo premier account company provide online banking service include online access point sale terminal service bill payment money transfer service,fintech,0.522,payments,0.343,e-commerce,0.331
61,61,6483,AccessFintech,accessfintech offer risk management service bank buyside firm track trade lifecycle help firm track trade lifecycle true sense prioritize risk increase number system bring fintech providers house technology orchestrate interaction distribute provider create single visual display risk financial transaction global sharable view,payments,0.393,fintech,0.383,professional services,0.362
62,62,10138,Access-Intelligence,access intelligence b b medium information company headquarter serve energy defense healthcare management chemical satellite aviation cable medium public relation market,analytics,0.386,professional services,0.337,industrial iot,0.332
63,63,3427,Accuri-Cytometers,found address compelling need life scientist love rapid cell cell analysis capability flow cytometer flow cytometer lab barrier researcher include cost instrument complexity software effort require maintenance large bench space require instrument result company look develop affordable robust cytometer,longevity,0.33,oceantech,0.223,biotech,0.214
64,64,10601,Accutrainee,accutrainee found run solicitor understand legal industry challenge deliver legal service client critical need commercial approach whilst stay sensitive partnership ethos profession understand trainee process having experience hand,legaltech,0.431,professional services,0.393,procurement,0.291
65,65,8817,AccuVein,accuvein specialize vein visualization technology flagship product hand hold non contact vein illumination solution allow healthcare professional map peripheral vein skin surface goal access avoid vein build proprietary technology embody grow patent portfolio cover broad range image medical diagnostic technology company found headquartered medford,medtech,0.349,healthcare,0.343,industrial iot,0.322
66,66,7247,Acea-Health,acea health digital company develop application call new digital consent platform analyse number factor include patient background deliver personalise risk benefit aim solution consent,healthcare,0.345,social networks,0.292,insurtech,0.289
67,67,6553,Acesion-Pharma,acesion developer medical drug design treatment atrial fibrillation company medical drug develop treatment atrial fibrillation common type cardiac arrhythmia follow concept inhibit type ion channel heart cell involve generate electrical signal regulate heart rhythm provide consumer chronic treatment prevent recurrence maintain normal heart rhythm,life sciences,0.332,healthcare,0.317,biotech,0.273
69,69,6532,Achilles-Therapeutics,developer immunotherapy intend offer generation patient specific therapy treat cancer company immunotherapie harness immune system destroy cancer cell target truncal tumor neo antigen flag immune system present surface cancer cell enable scientist target destroy tumor harm healthy tissue,biotech,0.409,life sciences,0.36,longevity,0.345
70,70,7485,Achillion-Pharmaceuticals,achillion drive transform live patient family affect disease complement system integral innate immune system clinical evidence implicate complement system specifically complement alternative pathway ap numerous devastating disease condition principal focus achillion advance clinical stage portfolio orally administer factor d inhibitor late stage development potential commercialization patient devastating disorder complement system,life sciences,0.336,biotech,0.28,gut microbiome,0.232
72,72,10086,Acousticeye,establish bring acoustic technology industry company develop manufacturer market mobile embed tube inspection device patent pende technology offer accurate rapid single point inspection inaccessible tube company dolphin system unique ability quickly find accurately locate defect complex tube system regardless material need physically traverse probe tube,industrial iot,0.335,medtech,0.335,oceantech,0.31
73,73,10194,Acre,acre rebuild uks mortgage market ground vertically integrate mortgage stack new end end platform broker lender,economic empowerment,0.265,platforms,0.256,fintech,0.229
74,74,4981,AcreTrader,agricultural real estate invest platform help buyer buy share farmland online platform provides transparency flexibility ease use people want invest farmland handling aspect administration property management insurance account work local farmer improve soil sustainability company found headquarter,platforms,0.309,agtech,0.309,professional services,0.305
75,75,3893,ACS-Clothing,provider men hirewear lead retailer ireland wtih extensive range formalwear highlandwear provide outfit wearer range garment available hire company grow proud supply large menswear retailer,fashion,0.53,procurement,0.383,e-commerce,0.293
77,77,7159,Actionality,actionality offer mobile marketing technology solution company adflextm platform enable user develop mobile commercial standardized format campaign logic support update rotation modification interaction reporting serve advertiser mobile operator content provider company found base sale office subsidiary,mobile,0.297,platforms,0.29,professional services,0.279
78,78,4904,Activiomics,develop groundbreake patented technology enable transformation way biomarker identify diagnostic develop drug candidate identify profiled technology centre novel mass spectrometry base approach global quantitative analysis phosphorylation site phosphorylation critical mediator cellular process site phosphorylation represent important class novel biomarker tiquas target depth quantification cell technology enable quantification phosphorylation event give tissue sample subsequent marker response identify enable development future diagnostic,biotech,0.365,longevity,0.317,business intelligence,0.253
79,79,3073,Actronika,build haptic platform enable seamless system integration leader haptic technology provide cut edge vibrotactile module integrate client system develop human machine interface solution patent haptic technology human bear touch order form relationship learn engaged environment face digitize world mission engage people tangible material experience hardware software possible,gaming,0.318,ar/mr/vr,0.307,future of work,0.299
82,82,20,Acutus-Medical,develop medical technology treat complex cardiac arrhythmia company platform display heart true activation pattern turn chaos complex arrhythmia clear vision electrophysiologist privately fund company found base product co develop exceptional team medical scientist biomedical engineer professional found headquarter,analytics,0.353,healthcare,0.311,food & beverage,0.269
84,84,1262,Adaface,build conversational round tech interview candidate love interview turn analyse candidate think process timely hint ask follow question accurately gauge skill shortlist qualified candidate role company invest time engage candidate,human resources,0.337,professional services,0.287,sales & crm,0.273
85,85,3279,Adagene,clinical stage biotech company specialize develop immuno oncology antibodie novel epitope proprietary increase success rate substantially accelerate time market reduce cost associate develop therapeutic antibody,biotech,0.43,longevity,0.283,life sciences,0.245
86,86,321,Adallom,found cyber defense veteran cloud access security broker deliver visibility governance protection cloud application innovative platform simple deploy seamless user available saas base solution advanced heuristic back elite cybersecurity research team adallom make easy protect data cloud adallom abbreviation say ad halom literally mean line defense information visit follow,cybersecurity,0.437,defense,0.379,security,0.341
87,87,5787,Adaptate-Biotherapeutics,adaptate biotherapeutic company develop antibody modulate gamma delta t cells situ company found hayday headquartered,biotech,0.33,longevity,0.312,life sciences,0.164
89,89,9851,ADC-Biotechnology,adc bio develop new process technology help drug developer meet conjugation process challenge test production new antibody drug conjugate anti cancer drug technology signal fast simple costly development exciting new family drug,biotech,0.483,longevity,0.368,life sciences,0.343
90,90,10620,ADC-Therapeutics,adc therapeutic clinical stage oncology drug discovery development company focus advance highly potent target antibody drug conjugate adcs treatment hematological cancer solid tumor adcs develop late generation pyrrolobenzodiazepine dimer technology provide superior therapeutic index compare generation adcs preclinical study dimer potent toxin actively kill cancer cell differentiate mechanism action warhead commonly adcs,biotech,0.441,life sciences,0.319,psychedelics,0.285
93,93,5062,Addition-Wealth,addition wealth holistic financial wellness platform empower employee smart informed financial decision take tech forward approach combine digital tool online event expert content access financial professional addition make personalized financial expertise inclusive accessible employee addition partner forward think employer help employee money,professional services,0.425,fintech,0.346,human resources,0.33
95,95,3020,Adepto,adepto piering way company view manage entire workforce ve create total talent ecosystem bring internal external worker place point solution complete solution start global operation tribe hard work dedicated diverse mind passionate create solution organisation people centre,future of work,0.481,human resources,0.334,economic empowerment,0.316
97,97,3863,Adept-Technology-Group,provider communication solution adept unite communication innovation use technology bring idea solution business help succeed simply deliver product service help business grow competitive increase profitability improve way communicate customer employee,communications,0.373,5g networks,0.359,analytics,0.353
98,98,3957,Adestra,empower client maximize marketing roi email drive technology year flexible account structure obsession customer success award win service gain trust global enterprise grow brand alike found principle marketing success take technology s customer service heart business service service office,sales & crm,0.408,professional services,0.397,analytics,0.372
99,99,5565,Adfenix,collect sense world real estate data platform estate agent empower help consumer journey buy new home offer quality advertising product relate service click button,platforms,0.397,sharing economy,0.354,sales & crm,0.347
101,101,5791,Adiana,engage development testing transcervical sterilization system permanent birth control develop complete tcs consist radiofrequency generator delivery catheter implantable matrix company found base subsidiary,medtech,0.378,healthcare,0.349,femtech,0.336
102,102,6702,Adikteev,lead app engagement platform performance drive marketer consistently rank appsflyer performance index help world spend game app publisher increase retention reacquire churn user drive incremental revenue thank measure engagement strategy creative algorithm serve customer world office emea,sales & crm,0.411,platforms,0.409,martech,0.364
103,103,4175,Adjug,online advertising marketplace connect buyer seller online advertising provide transparency control choice publisher control online inventory increase earning advertiser run well campaign know conversion traffic come found idea improve way advertising gets buy sell ad network connect advertiser publisher directly seek lead online advertising marketplace,media,0.412,platforms,0.357,sales & crm,0.338
