Unnamed: 0.1,Unnamed: 0,id,name,cb_description,industry1,score1,industry2,score2,industry3,score3
2974,2974,8223,Monica-Healthcare,base develop series innovative wearable device use wireless technology facilitate globally accessible obstetric service home hospital patent technology base acquisition physiological signal passively detect des position maternal abdoman,medtech,0.427,healthcare,0.391,iot,0.343
2977,2977,3880,Mono-Consultants,provide infrastructure support service telecommunication industry aim provide service customer require life cycle asset company know change limited december limited incorporate base additional office,professional services,0.41,platforms,0.347,analytics,0.34
2978,2978,3854,Monodraught,forefront design manufacture low energy low carbon sustainable solution year company focus product set recognise market leader natural hybrid lighting natural cool natural hybrid ventilation product find residential build look increase natural light high impact architectural building olympics handball stadium key sector education product deliver real dividend term low energy carbon footprint improve environment student teacher,climate tech/cleantech,0.37,greentech,0.341,chemicals,0.33
2979,2979,108,Monograph,monograph firm management tool architect complete product manage task track time invoicing client streamline entire workflowso matter monograph reduce non billable hour gets pay time build professionalism client,future of work,0.357,automation,0.354,sales & crm,0.314
2980,2980,1681,Monolith-AI,software company use machine learn datum science help engineer improve product development process enable company monetize old simulation test datum anticipate behavior new product company optimize process reduce number simulation test prototype require develop new product deliver fast well product company found headquarter,future of work,0.4,manufacturing,0.328,business intelligence,0.326
2982,2982,286,Montonio,connect payment orchestration payment initiation single touchpoint checkout solution e commerce store company provide service like bank link payment checkout financing installment plan party solution accept card payment stripe found base,e-commerce,0.516,payments,0.392,procurement,0.365
2983,2983,7365,MooBella,develop revolutionary disruptive technology potential transform expand ice cream industry enable instantaneous aeration flavor freeze ice cream scoop premium hard ice cream eliminate frozen supply chain,food & beverage,0.386,physical storage,0.298,connected home,0.274
2984,2984,6611,Moonbug,global entertainment company create distribute inspire engage story expand kid world mind found office create produce publish video audio content goal teach compassion empathy resilience kid world,familytech,0.433,social impact,0.398,metaverse,0.367
2985,2985,7591,Moonfare,technology enable platform allow individual invest tier private market investment opportunity low minimum fee technology aggregate demand create hassle free investment experience improve liquidity ability cherry pick investment build highly experienced international team talented professional lead technology investment company include company back lead investor,professional services,0.411,platforms,0.316,future of work,0.315
2986,2986,2353,MoonPay,financial technology company provide payment solution cryptocurrency ramp suite product provide seamless experience convert currency cryptocurrencie major payment method include debit credit card local bank transfer pay google pay,payments,0.442,fintech,0.425,e-commerce,0.423
2989,2989,3435,more2,having work agency consultancy know rule great strength ignorance simply sense marketer treat client want treat,professional services,0.473,sales & crm,0.345,analytics,0.336
2990,2990,3069,More-Labs,discover magic elixirs design help rough morning drinking trip home effective dove research connect jing liang researcher professor create version morning recovery launch raise customer world thing going ve grow,food & beverage,0.377,creator economy,0.293,design,0.293
2994,2994,5291,MOSTLY-AI,ai pioneer creation synthetic datum ai model development software testing ais synthetic data set look real company original customer datum detail original personal datum point help company comply privacy protection regulation ensure model fair unbiased fast grow company currently work multiple bank insurer deepest expertise help company business value synthetic datum,future of work,0.335,industrial iot,0.329,manufacturing,0.295
2995,2995,4836,Motatos,sell long life household good store cupboard ingredient beverage toiletrie pet food surplus inventory large producer reduce price say mean offer consumer bargain fight problem food waste selling surplus food limit end landfill establish,analytics,0.431,food & beverage,0.367,procurement,0.363
2996,2996,5166,MotorK,motork ams lead software service saas provider automotive retail industry region employee office country motork empower car manufacturer dealer improve customer experience broad suite fully integrate digital product service motork provide customer innovative combination digital solution saas cloud product large department automotive digital sale marketing industry,sales & crm,0.336,professional services,0.313,platforms,0.31
2997,2997,530,Motorway,way sell car overwhelm focused building good way vision build well car market transparent straightforward smart technology match customer car nationwide network verify dealer enable dealer buy vehicle direct private seller fully online sale platform car successfully sell day reduce time effort side help right deal quickly work help car owner value sell car grow journey begin,analytics,0.346,sales & crm,0.322,professional services,0.275
2998,2998,9497,Motosumo,motosumo build entirely new platform home user mainstay gyms fitness studio world helping upgrade basic equipment revitalize indoor cycling group fitness class,sport & wellness,0.359,edtech,0.287,climate tech/cleantech,0.232
2999,2999,9628,Moveco,mobility ecosystem look set drive safe smart efficient affordable future mobility industry blockchain base platform allow consumer share mobility datum earn reward form mov token pay gas bill,mobility,0.468,defi,0.455,blockchain,0.395
3000,3000,301,Move-Loot,convenient way buy sell furniture seller submit furniture click curate price list item marketplace buyer browse discover unique quality furniture affordable price heavy lifting arrange pick seller delivery buyer easy hassle free,e-commerce,0.34,fashion,0.297,supply chains,0.267
3001,3001,5039,Moven,focus enable bank non bank partner leverage platform acquire engage retain grow customer base app debit card contactless payment sticker provide real time spend insight motivate customer smart decision save enterprise found headquarter,fintech,0.486,professional services,0.459,e-commerce,0.403
3003,3003,5326,Movidius,vision processor company design compact high performance ultralow power computational imaging vision processing chip software development tool reference design architecture deliver new wave intelligent contextually aware experience consumer mobile wearable device consumer industrial camera application headquartered venture back start investor include e dfj esprit,deep tech,0.389,robotics,0.378,health tech,0.367
3004,3004,141,Movinga,vertically integrate logistic tech company customer medium sized move company professional service provider offer logistically optimize move private individual company good transport courier service,supply chains,0.461,logistics,0.381,analytics,0.349
3005,3005,9067,Movirtu,movirtu reinvent way mobile phone increase access phone service rural poor cloud phone provide affordable access mobile phone service people earn afford phone spend income phone sharing village phone provide mobile carrier innovative low cost infrastructure product movirtu enable offer customer phone number message account expense own phone,mobile,0.4,5g networks,0.362,communications,0.335
3006,3006,2383,Movivo,movivo allow user cover cost mobile minute complete survey crowdsource task download new mobile app movivo allow user discover new mobile content earn free airtime mobile phone movivo integrate telecom operator constantly add new partner world provide service,mobile,0.395,communications,0.374,5g networks,0.31
3007,3007,5922,Mowgli-Street-Food,mowgli eat home street bear feed raw need tiffin fresh bright intense flavour mowgli intimate hush dining experience smash grab ze healthy light virtuosic herb spice,sextech,0.279,food & beverage,0.256,nutrition,0.234
3008,3008,4048,MPK-Garages,mpk garages leicester uk base independent operator forecourt majority freehold locate trunk major road business target freehold leasehold property plan add site exist estate operate brand brand retail offering feature facility,professional services,0.366,retail,0.342,proptech,0.322
3009,3009,676,MPowder,develop e commerce brand provide nutritional powder tackle hormonal change provide woman insight practice tool empower menopause sell nutritional powder stage menopause directly customer website receive repeat order brand powder available additional recipe follow new year stock lead online beauty destination follow launch active powder room community maker trial product recipe verifie efficacy provide detailed feedback lifestyle program,fashion,0.422,beauty,0.374,professional services,0.36
3011,3011,8415,Mrs-Wordsmith,mrs worlds innovative vocabulary programme combine data science creativity illustrate word matter academic success launch mrs fast grow back startup help young people learn efficiently engage content artist madagascar word carefully select curate datum scientist ensure child learn word come school book read love teacher parent student,edtech,0.305,social impact,0.232,familytech,0.217
3014,3014,3820,M-Squared-Lasers,m square laser develop manufacture generation laser photonic instrument bring new capability high reliability great ease use diverse range industrial scientific application core team experience track record supplying award win product worldwide market m square ideally place help solve problem de risk project accelerate application,deep tech,0.384,manufacturing,0.324,autonomous driving,0.265
3015,3015,9065,mSURVEY,mobile survey platform driving decision make business continent work know brand world reduce churn improve customer service increase net promoter score solve problem customer service market research technology team deep local reach open communication line customer employee customer,5g networks,0.372,analytics,0.364,sales & crm,0.332
3017,3017,6599,Mucosis,mucosis clinical stage biotechnology company develop innovative mucosal vaccine apply needle free nose mouth lead product candidate syngem registered intranasal vaccine prevent respiratory syncytial virus infection mucosis vaccine base patented validated register technology technology enable natural immune response broad base protection see proof concept animal human study flugem register vaccine candidate,biotech,0.493,longevity,0.263,gut microbiome,0.236
3018,3018,139,Multiverse,tech startup seek provide alternative university training ensure young people access good career focus apprenticeship offer empower support people create reality journey fulfil career true alternative track university route uninspire corporate training,economic empowerment,0.35,human resources,0.281,future of work,0.28
3019,3019,5582,Mumsnet,conceive early embark disastrous family holiday idea create website parent swap advice holiday stuff parent talk thought come uks big network parent generating page view visit month,familytech,0.516,femtech,0.314,sextech,0.308
3020,3020,7953,Munily,community use pen paper access management security blindspot traceability unknown visitor munily access control management s gate community,social networks,0.358,sharing economy,0.345,cybersecurity,0.296
3021,3021,9477,Munro-Vehicles,electric vehicle intend create circular value chain offering manufacturer support option refurbishment upgrade vehicle provide maximum return initial carbon investment work supplier reduce packaging supply chain use container,circular economy,0.375,mobility,0.367,infrastructure tech,0.347
3022,3022,1655,MusicGurus,teacher awe inspire world class musician ve choose musical community share talent knowledge student world subscribe access high quality educational video useful camera angle structure specific topic theme bit like series master class,entertainment,0.381,edtech,0.328,creator economy,0.299
3025,3025,9677,Muzicall,ringback tone service provider operator medium company sole objective focus sound generate telephone set drive market reach potential operator medium company partner found conjunction international project service company soho lead team telecom music consumer marketing specialist company work partnership basis customer invest marketing system use knowledge experience grow sustainable revenue partner,communications,0.382,5g networks,0.379,sales & crm,0.379
3026,3026,3022,MWS-Technology,technology solution provider training employability provider university college tutor assessor employer learner jobseeker create goal develop innovative technology product aid delivery complex regulate skill employability program company overarching mission create technology enable people find fulfilling job equip skill need advance career resource look achieve career goal technology drive solution vision mind,future of work,0.38,human resources,0.359,edtech,0.344
3027,3027,1157,MyBuilder,mybuilder online marketplace bring consumer builder tradesman offer open transparent platform promote support high quality work post job site free cost builder tradesman join operate charge small fee builder tradesman quote accept homeowner principle accountability feedback tradesman rate workmanship hire make easy find high quality builder builder find good quality job mybuilder participate organization seedcamp,platforms,0.412,e-commerce,0.346,procurement,0.287
3028,3028,2312,My-Car-Direct,mycardirect car subscription platform allow user add car van smart flexible easy way simple step subscription car deliver directly door long term contract hidden charge,automotive,0.479,e-commerce,0.395,payments,0.298
3029,3029,8388,Mycelial,mycelial computer company develop computer software unlock value constrain environment deliver software ocean floor interstellar space enable user solution sensitive environment instantaneous decision make meet life death mycelial establish base,platforms,0.312,climate tech/cleantech,0.303,analytics,0.303
3031,3031,2080,My-Community-Capital,social service make easy set new social activity meet people local helping meet new people learn new skill fun relaxed social activity design community currently support new activity creation surround area found base,social networks,0.315,platforms,0.269,social impact,0.264
3032,3032,7806,MycoTechnology,utilize fungi base food processing platform transform flavor value agricultural product platform solve variety challenge face food beverage flavor industry release natural free organic bitter blocker certify improve flavor agricultural product engage ferment agricultural product strain gourmet fungi company offer myceliate chocolate robusta arabica coffee bean develop license technology industry naturally improve flavor robusta arabica coffee company incorporate base,food & beverage,0.492,connected home,0.303,fashion,0.29
3034,3034,9125,My-Expert-Midwife,expert midwife help tackle physical emotional effect pregnancy birth recovery new parent journey help expertly care newborn product carefully blend safe prove premium ingredient include wide range natural botanical product soothe calm soreness relieve symptom physical effect commonly experience pregnancy baby bear provide approach solve problem product free guide checklist blogs popular e book webinar,life sciences,0.313,femtech,0.308,beauty,0.285
3037,3037,8664,MyHomeMove,award win house law firm premier market leader conveyance help people home conveyance provider vision revolutionise customer experience conveyance industry partner client innovative technology unrivalled expertise exceptional customer care core want industry partner client receive conveyancing service exceed expectation shape need modern consumer conveyancer expert field cover standard sale purchase move home share ownership help buy,sales & crm,0.451,sharing economy,0.415,professional services,0.356
3040,3040,10676,MymCart,uk base start provide self serve mobile commerce platform manage director chairman provide small business platform create mobile optimize brand website accept payment product service smartphone,mobile,0.366,e-commerce,0.355,analytics,0.333
3041,3041,10479,Myo,communication platform care proud design product bring people team look new talent like work product well care,beauty,0.389,design,0.372,healthcare,0.315
3042,3042,6977,MyOffer,myoffer base online overseas study application platform provide information course available university world company plan expand business field visa application accommodation career plan overseas experience employment overseas student,travel,0.348,professional services,0.245,economic empowerment,0.229
3043,3043,397,MyOptique-Group,revolutionise optical industry cut high street middle man provide customer superior service significant saving group clear leader grow online optical segment offering cover major segment eyewear market prescription glass sunglasse contact lense online retail brand lenson sale outside market carry brand style,fashion,0.441,5g networks,0.369,analytics,0.36
3044,3044,10707,Myra-Vision,myra vision design treatment allow maximum reduction patient moderate severe glaucoma privately hold portfolio company shifame llc company accelerate development kind treatment patient moderate severe glaucoma late funding,professional services,0.273,robotics,0.267,deep tech,0.254
3045,3045,2404,myrecovery,myrecovery digital companion undergo orthopaedic surgery help plan recovery simple straightforward way matter myrecovery trading,medtech,0.338,health tech,0.327,healthcare,0.324
3047,3047,312,MySQL,mysql open source database support scalable web base embed database application product offering range enterprise level support package complete service support free download late mysql version online platform offer forum article lab worklogs podcast community download documentation mysql launch base,data infrastructure,0.368,search,0.227,cloud infrastructure,0.216
3048,3048,7996,MyStudies,alternative traditional private lesson offer write correction online course business work numerous tutor degree certification subject include mathematic history etc employ qualified professional applicant field,edtech,0.337,travel,0.207,economic empowerment,0.199
3049,3049,9582,Mythical-Games,mythical generation game technology studio believe true ownership digital asset verifiable scarcity integrate secondary market spawn new generation game new economy base digital ownership bring player developer content creator close game love team veteran game platform developer passion bring big innovative concept market goal create world class product drive consumer adoption distribute ledg technology game,platforms,0.423,gaming,0.354,esports,0.34
3050,3050,959,myTips,develop simplest easy way create deploy interactive screen tutorial service mytip take pain boarding user training away get customer set quickly save time customer support,social networks,0.278,edtech,0.268,design,0.255
3052,3052,2529,myza,spend life struggle achieve good night sleep launch curate online platform focus exclusively product relate sleep sleep experience brilliantly fuse sleep content commerce unrivalled editorial include advice team lead sleep expert professional,travel,0.297,happiness & wellbeing,0.28,edtech,0.259
3053,3053,6541,Nabriva-Therapeutics,nabriva therapeutic biopharmaceutical company engage commercialization development innovative anti infective agent treat infection nabriva therapeutic receive approval tablet systemic pleuromutilin antibiotic community acquire bacterial pneumonia develop contepo fosfomycin injection potential class epoxide antibiotic complicate urinary tract infection include acute pyelonephritis nabriva enter exclusive agreement subsidiary market sell distribute sivextro tedizolid phosphate certain territory,biotech,0.329,life sciences,0.304,gut microbiome,0.265
3054,3054,223,Nacelle,headless progressive web app solution build online retailer dissatisfy slow page load speed low mobile conversion rate retailer deliver lightning fast customer experience storefront optimize device seo friendly pair seamlessly ecommerce platform found headquarter,mobile,0.377,e-commerce,0.346,fashion,0.323
3055,3055,9501,Nadine-West,nadine west personalize styling platform everyday woman member receive outfit personalize style day decide item want,fashion,0.47,e-commerce,0.402,beauty,0.3
3056,3056,9714,Naduvi,naduvi online shop offer furniture interior product brand customer place order ship directly seller avoid unnecessary stop distributor shop warehouse result eliminate link cost distribution chain allow provide high quality home living product competitive price,procurement,0.402,food & beverage,0.344,e-commerce,0.343
3057,3057,8448,NAG-Studios,base gaming startup give competitive gaming esport format found game industry veteran ex dice resolution games esport expert ex tobii survivor esport nag dedicate create competitive game streaming platform player broadcaster spectate audience community integrate team company found headquartered stockholm,esports,0.532,gaming,0.504,platforms,0.297
3058,3058,4661,Nandi-Proteins,sale marketing licensing company spin edinburgh company establish exploit patented process technology know improve functional property common protein whey egg soy company objective market leader field denature protein technology deliver significant growth direct trading value add protein license approach significant industry partner,professional services,0.406,analytics,0.383,biotech,0.325
3059,3059,10327,NanoBioDesign,nanobiodesign limited nbd form spinout company company acquire exclusive right patent emanate research professor group professor active field biological sensor research focusse human bacterial,nano,0.385,semiconductors,0.345,biotech,0.329
3060,3060,1224,Nanofy,industrial solution developer producer nano material launch midst global pandemic borne cohort fall short outcompete good class technology certify trial prompt closure company fail convert pilot implementation,nano,0.44,semiconductors,0.346,manufacturing,0.299
3062,3062,6920,NanoSight,form develop nanoparticle detection technique base suite patent come work founder current chief technical officer world lead provider series unique instrument optical detection real time analysis sub micron particle offer significant advantage compare exist light scatter technique,nano,0.527,deep tech,0.396,semiconductors,0.306
3063,3063,9865,Nanosolar,nanosolar print solar cell assemble panel enable cost efficient solar electricity nanosolar proprietary approach printing nanoparticle ink anneal process minimize use expensive high vacuum deposition manufacturing equipment allow utilize equipment industrial printing roll roll manufacturing industry produce solar electric foil high speed bring economic print world solar semiconductor manufacturing,3d printing,0.404,nano,0.346,semiconductors,0.321
3064,3064,4299,NanoSyrinx,emerge biotechnology company develop novel system target delivery therapeutic protein peptide direct cytosol synthetic biology approach develop completely novel method target drug delivery therapeutic protein peptide interior cell improve efficacy safety economy,biotech,0.586,longevity,0.347,life sciences,0.296
3065,3065,10249,Nanotech-Industrial-Solutions,produce oil additive engine oil oil water formulation metalworking fluids industrial oil additive formulation grease patented technology release nanostructure material certain physical condition unique morphology significantly improve friction wear property result substantial contribution technology resource efficiency heavy machinery power plant industrial plant,chemicals,0.312,manufacturing,0.269,connected home,0.257
3066,3066,4776,Napatech,help company reimagine business bring hyperscale computing benefit organization size smartnic enhance open standard virtualize server boost innovation release valuable computing resource improve service increase revenue reconfigurable computing platform base broad set software lead compute network security application support wide array hardware design,cloud infrastructure,0.409,analytics,0.312,platforms,0.309
3067,3067,6135,Napptive,computer software company specialize software development software engineering cloud compute industry company allow software developer create development environment equivalent production create debug testing cloud native application found headquarter,platforms,0.374,future of work,0.363,developer tools,0.361
3068,3068,6359,Narayana-Hrudayalaya,headquarter operate national network hospital particularly strong presence southern state eastern emerge presence western central,physical storage,0.383,healthcare,0.25,human resources,0.219
3071,3071,6653,Naseeb-Networks,onlineislamic network social business matchmaking purpose connect young educate professional network friend provide platform interact build new connection found base,social networks,0.413,esports,0.375,analytics,0.352
3072,3072,71,Nasty-Gal,operate online clothing store woman online platform feature clothing shoe accessory designer company brand root old school rock n roll thrill vintage chase company found headquarter,fashion,0.574,e-commerce,0.385,analytics,0.333
